ID,Severity,Start_Time,End_Time,Start_Lat,Start_Lng,End_Lat,End_Lng,Distance(mi),Description,Number,Street,Side,City,County,State,Zipcode,Country,Timezone,Airport_Code,Weather_Timestamp,Temperature(F),Wind_Chill(F),Humidity(%),Pressure(in),Visibility(mi),Wind_Direction,Wind_Speed(mph),Precipitation(in),Weather_Condition,Amenity,Bump,Crossing,Give_Way,Junction,No_Exit,Railway,Roundabout,Station,Stop,Traffic_Calming,Traffic_Signal,Turning_Loop,Sunrise_Sunset,Civil_Twilight,Nautical_Twilight,Astronomical_Twilight
C-5848144,2,2021-12-29 16:42:30,2021-12-29 17:03:00,37.511902,-118.583253,37.526495,-118.623194,2.40989077627,Slow traffic on US-395 N from Wye Rd (US-395) to South Landing Rd (US-395) due to roadwork.,,US-395 N,R,Bishop,Mono,CA,93514,US,US/Pacific,KBIH,2021-12-29 16:53:00,30.0,30.0,86.0,25.62,2.0,CALM,0.0,0.0,Light Snow,False,False,False,False,False,False,False,False,False,False,False,False,False,Day,Day,Day,Day
C-5848145,2,2021-05-19 05:29:30,2021-05-19 19:49:52,40.68010200000001,-74.004149,40.706957,-74.014699,1.9360668164,Slow traffic on I-478 W from exit [25] to Canal St (I-78) exit [3] due to roadwork.,,I-478 W,R,Brooklyn,Kings,NY,11231,US,US/Eastern,KJRB,2021-05-19 05:51:00,67.0,67.0,44.0,30.18,10.0,WNW,6.0,0.0,Partly Cloudy,False,False,False,False,False,False,False,False,False,False,False,False,False,Night,Day,Day,Day
C-5848146,2,2021-04-16 13:35:54,2021-12-13 15:00:30,39.55592,-86.25114,39.56537,-86.24691999999996,0.6905443796969999,Stationary traffic on IN-37 from Waverly Rd (IN-37) to IN-144 (IN-37) due to roadwork.,,State Road 37 N,R,Martinsville,Morgan,IN,46151,US,US/Eastern,KIND,2021-05-25 04:54:00,66.0,66.0,75.0,29.24,10.0,SW,7.0,0.0,Fair,False,False,False,False,False,False,False,False,False,False,False,True,False,Day,Day,Day,Day
C-5848147,2,2021-05-20 05:41:00,2021-05-20 17:58:31,40.75838,-73.972964,40.76155900000001,-73.97064,0.251074088666,Slow traffic from E 42nd St (Park Ave) to E 57th St (Park Ave) due to roadwork.,355.0,Park Ave,R,New York,New York,NY,10154-0020,US,US/Eastern,KNYC,2021-05-20 05:51:00,62.0,62.0,44.0,30.32,10.0,CALM,0.0,0.0,Fair,True,False,False,False,True,False,True,False,False,False,False,True,False,Day,Day,Day,Day
C-5848148,2,2021-02-09 15:04:00,2021-02-10 00:01:40,27.297523,-80.304864,27.299938,-80.305065,0.167316359987,Slow traffic on US-1 N - FL-5 from SE Highpoint Dr / SE Colchester Cir to SE Village Green Dr due to roadwork.,,SE Veterans Memorial Pkwy,R,Port Saint Lucie,St. Lucie,FL,34952,US,US/Eastern,KSUA,2021-02-09 14:47:00,84.0,84.0,58.0,30.09,7.0,ESE,10.0,0.0,Partly Cloudy,False,False,False,False,False,False,False,False,False,False,False,False,False,Day,Day,Day,Day
C-5848149,4,2018-04-30 06:32:13,2018-11-04 20:00:00,42.484119,-83.084846,,,14.1000003815,Road closed due to major construction on I-696 Westbound from Exit 28 I-94 to Exit 20 Service Rd. Detour in operation - WB I-94 to NB I-75 back onto WB I-696.,,I-696 W,R,Warren,Macomb,MI,48091,US,US/Eastern,KDET,2018-04-30 06:53:00,41.0,38.0,49.0,30.26,10.0,West,4.6,,Clear,False,False,False,False,False,False,False,False,False,False,False,False,False,Day,Day,Day,Day
C-5848151,2,2020-11-13 07:00:00,2020-11-13 15:00:00,42.315781,-83.19806700000002,,,0.579999983311,Construction work on Michigan Ave Westbound from Firestone St to Helen St.,4401.0,Helen St,L,Dearborn,Wayne,MI,48126-2811,US,US/Eastern,KDET,2020-11-13 06:53:00,41.0,36.0,79.0,29.32,10.0,WSW,7.0,0.0,Cloudy,False,False,False,False,False,False,False,False,True,False,False,False,False,Night,Day,Day,Day
C-5848152,2,2021-01-20 03:00:00,2021-01-20 13:45:00,30.007556,-90.266071,30.008694,-90.232032,2.0381304193200003,Road Construction on I-10 Both Directions from Williams Blvd (224) to Loyola Drive (222) . Lane Alternating. Starting 1/19/2021 7:00 PM and Ending 1/20/2021 5:00 AM,,Loyola Dr,R,Kenner,Jefferson,LA,70062,US,US/Central,KMSY,2021-01-20 02:53:00,53.0,53.0,86.0,30.33,7.0,CALM,0.0,0.0,Fair,False,False,False,False,False,False,False,False,False,False,False,True,False,Night,Night,Night,Night
C-5848153,2,2021-03-12 08:13:30,2021-06-14 15:24:18,47.325936,-106.252673,47.325596,-106.190793,2.89815403411,Slow traffic on MT-200 from MT-59/MT-22 (MT-200) to MT-24/South Flowing Wells Rd (MT-200) due to roadwork.,3211.0,Highway 200 E,R,Cohagen,Garfield,MT,59322,US,US/Mountain,KJDN,2021-06-14 14:48:00,98.0,98.0,21.0,27.17,,ESE,26.0,0.0,,False,False,False,False,False,False,False,False,False,False,False,False,False,Day,Day,Day,Day
C-5848154,2,2021-02-16 02:48:30,2021-02-16 07:46:55,38.112757,-92.920352,38.111139,-92.911055,0.517630306993,Roadwork on MO-Z (Climax Springs) (MO-7) from MO-J (MO-7) to MO-7.,6100.0,N State Highway 7,R,Roach,Camden,MO,65787-8062,US,US/Central,KH21,2021-02-16 02:56:00,-8.0,-8.0,86.0,29.24,10.0,NW,3.0,0.01,Fair,False,False,False,False,False,False,False,False,False,False,False,False,False,Night,Night,Night,Night
C-5848155,2,2021-05-26 13:48:45,2021-05-26 14:08:45,29.9614,-90.168802,29.96301,-90.165959,0.203312037701,Stationary traffic on US-90 E from LA-48 (US-90) to Causeway Blvd (US-90) due to roadwork.,4104.0,Jefferson Hwy,R,New Orleans,Jefferson,LA,70121-1534,US,US/Pacific,KAUD,2021-05-26 13:55:00,85.0,85.0,65.0,30.12,10.0,SSE,8.0,0.0,Mostly Cloudy,False,False,False,False,False,False,False,False,False,False,False,False,False,Day,Day,Day,Day
C-5848156,3,2021-07-22 21:30:00,2021-07-23 05:30:00,43.087021,-88.05789200000002,,,0.920000016689,Entry ramp to I-41 Southbound from W Capitol Dr Westbound closed due to construction work.,,I-41 S,R,Milwaukee,Milwaukee,WI,53222,US,US/Central,KMWC,2021-07-22 21:35:00,73.0,73.0,65.0,29.32,10.0,SE,3.0,0.0,Fair,False,False,False,False,False,False,False,False,False,False,False,False,False,Night,Night,Day,Day
C-5848157,2,2021-06-15 09:24:30,2021-06-15 10:10:00,40.760823,-112.024969,40.754789,-112.024922,0.416916950125,Stationary traffic on UT-172 from I-80 (S 5600 W/UT-172) to W 1300 S (S 5600 W/UT-172) due to roadwork.,427.0,S 5600 W,L,Salt Lake City,Salt Lake,UT,84104,US,US/Mountain,KSLC,2021-06-15 08:54:00,85.0,85.0,16.0,25.75,10.0,ESE,8.0,0.0,Partly Cloudy,False,False,False,False,False,False,False,False,False,False,False,False,False,Day,Day,Day,Day
C-5848158,2,2021-01-25 17:08:28,2021-01-25 23:29:02,40.612482,-74.153806,40.612621,-74.154054,0.0161690862732,Construction construction on I-278 westbound between Drive Martin Luther King Expressway (Staten Island) and South Avenue; Ramp (Staten Island) 1 Right lane of 4 lanes closed until 3:00 P.M.,,Dr Martin Luther King Jr Expy S,R,Staten Island,Richmond,NY,10314,US,US/Eastern,KLDJ,2021-01-25 17:15:00,37.0,37.0,39.0,30.06,10.0,CALM,0.0,0.0,Fair,False,False,False,False,True,False,False,False,False,False,False,False,False,Night,Day,Day,Day
C-5848159,2,2020-11-10 06:16:56,2020-11-11 07:01:56,26.237229,-80.136626,26.226729,-80.13650600000003,0.725519026312,Construction on I-95 SB near EXIT 36 Construction. Right lane closed.,,I-95 S,R,Pompano Beach,Broward,FL,33069,US,US/Eastern,KFXE,2020-11-10 05:53:00,80.0,80.0,85.0,29.8,10.0,E,12.0,0.0,Mostly Cloudy,False,False,False,False,True,False,False,False,False,False,False,False,False,Night,Day,Day,Day
C-5848160,2,2021-12-20 16:18:24,2021-12-23 20:59:00,34.082390000000004,-119.033292,34.06221,-118.985542,3.06797953309,One-Way Traffic closure due to Slope Repair Work between Sycamore Cyn Rd and Deer Creek Rd,,Pacific Coast Hwy,R,Newbury Park,Ventura,CA,91320,US,US/Pacific,KCMA,2021-12-23 08:14:00,53.0,53.0,89.0,29.91,9.0,ENE,13.0,0.01,Cloudy,False,False,False,False,False,False,False,False,False,True,False,False,False,Day,Day,Day,Day
C-5848161,2,2016-05-10 09:01:28,2016-05-10 15:01:28,41.783567,-72.588782,41.77406,-72.64066,2.75251658923,Between Mary St and US-5 - Construction work.,1154.0,Burnside Ave,L,East Hartford,Hartford,CT,06108-1508,US,US/Eastern,KHFD,2016-05-10 08:53:00,55.0,,42.0,30.24,10.0,SSW,3.5,,Clear,False,False,False,False,False,False,False,False,False,False,False,True,False,Day,Day,Day,Day
C-5848162,2,2021-07-30 09:00:00,2021-08-13 18:00:00,35.891399,-79.059415,35.89217,-79.068145,0.491551228338,In Chapel Hill / Both Directions. Contract forces are scheduled to mill and resurface Culbreth Road from US 15-501 to Smith Level Road.&amp;nbsp; This work will require lane closures Monday - Saturday 9AM-Sunset.&amp;nbsp; Motorists cyclists and pedestrians shall expect delays when traveling through the work area.&amp;nbsp; In addition to the newly resurfaced route a new traffic pattern will be implemented to provide bike lanes throughout the route.&amp;nbsp; Motorists are encouraged to remain alert and travel safe speeds when approaching the work area.&amp;nbsp;,,Mount Carmel Church Rd,R,Chapel Hill,Orange,NC,27517,US,US/Eastern,KIGX,,,,,,,,,,,False,False,True,False,False,False,False,False,False,False,False,True,False,Day,Day,Day,Day
C-5848163,2,2021-05-20 09:00:00,2021-05-20 23:59:59,41.539574,-73.76942700000002,41.539114,-73.772497,0.1619194959479999,Bridge work on I-84 both directions between Exit 52A/B (I-84) - Taconic Parkway (East Fishkill) and Exit 65 - State Hwy 312 - Carmel (Southeast) DOT BM - 29097309 Thursday May 20th 2021 09:00 AM thru 03:00 PM various lane closures Monday May 24th 2021 thru Thursday May 27th 2021 Monday/ Tuesday/ Wednesday/ Thursday 09:00 AM thru 03:00 PM various lane closures,,I-84 W,R,Hopewell Junction,Dutchess,NY,12533,US,US/Eastern,KPOU,2021-05-20 08:53:00,66.0,66.0,48.0,30.28,10.0,SE,3.0,0.0,Fair,False,False,False,False,True,False,False,False,False,False,False,False,False,Day,Day,Day,Day
C-5848164,2,2020-09-22 12:49:00,2020-09-23 02:26:53,42.011827,-87.712688,42.012556,-87.71146999999998,0.0802919136444,Stationary traffic from N Kimball Ave to Howard St due to resurfacing work.,3342.0,W Touhy Ave,R,Skokie,Cook,IL,60076-7200,US,US/Central,KORD,2020-09-22 12:51:00,76.0,76.0,46.0,29.43,10.0,WSW,10.0,0.0,Partly Cloudy,False,False,False,False,False,False,False,False,False,False,False,False,False,Day,Day,Day,Day
C-5848165,2,2021-05-10 10:30:00,2021-10-30 19:45:00,33.064163,-96.891037,33.066069,-96.889573,0.156617212796,Slow traffic on TX-121 from Crider Rd to Sam Rayburn Tollway S due to roadwork.,4572.0,State Highway 121,L,Lewisville,Denton,TX,75056-4535,US,US/Central,KADS,2021-08-06 16:47:00,93.0,93.0,44.0,29.29,10.0,S,14.0,0.0,Partly Cloudy,False,False,False,False,False,False,False,False,False,False,False,True,False,Day,Day,Day,Day
C-5848166,2,2021-06-21 14:46:28,2021-06-21 17:11:17,25.855988,-80.125462,25.855577,-80.131203,0.358084767623,Stationary traffic on FL-934 from FL-A1A/Abbott Ave/Collins Ave (FL-934) to US-1/FL-5/Biscayne Blvd (FL-934) due to roadwork.,707.0,71st St,R,Miami Beach,Miami-Dade,FL,33141-3021,US,US/Eastern,KOPF,2021-06-21 14:53:00,90.0,90.0,57.0,30.06,10.0,S,13.0,0.0,Fair,True,False,True,False,False,False,False,False,False,True,False,True,False,Day,Day,Day,Day
C-5848167,2,2016-12-01 21:00:43,2016-12-02 03:00:43,40.66678,-73.76576999999997,40.66574,-73.75421999999998,0.609569665286,At Springfield Blvd/Exit 22 - Construction work.,,Belt Pkwy E,R,Springfield Gardens,Queens,NY,11413,US,US/Eastern,KJFK,2016-12-01 20:51:00,46.9,,44.0,29.82,10.0,West,17.3,,Partly Cloudy,False,False,False,True,False,False,False,False,False,False,False,False,False,Night,Night,Night,Night
C-5848168,2,2021-09-27 10:48:30,2021-09-27 13:00:50,37.307703,-76.75313299999998,37.307287,-76.75149300000002,0.0946008937232,Slow traffic from New Point Rd to Westmoreland Dr due to roadwork.,4741.0,Longhill Rd,L,Williamsburg,James City,VA,23188-1530,US,US/Eastern,KJGG,2021-09-27 10:55:00,73.0,73.0,53.0,30.07,10.0,S,5.0,0.0,Fair,False,False,False,False,False,False,False,False,False,False,False,False,False,Day,Day,Day,Day
C-5848169,2,2021-10-17 15:53:00,2021-10-17 18:52:30,39.183812,-84.649731,39.178958,-84.64625500000002,0.383584978002,Stationary traffic from I-74/US-52 (Harrison Ave) to Race Rd (Harrison Ave) due to roadwork.,6178.0,Harrison Ave,R,Cincinnati,Hamilton,OH,45247-7848,US,US/Eastern,KCVG,2021-10-17 15:52:00,66.0,66.0,37.0,29.14,10.0,WNW,20.0,0.0,Fair,False,False,False,False,False,False,False,False,False,False,False,False,False,Day,Day,Day,Day
C-5848170,4,2021-10-19 22:33:25,2021-10-22 23:59:00,33.659087,-84.432645,33.65900300000001,-84.430497,0.1236676231739999,Closed road from US-29/GA-139/Main St (Virginia Ave) to I-85 (Virginia Ave) due to roadwork.,1329.0,Virginia Ave,R,Atlanta,Fulton,GA,30344-5213,US,US/Eastern,KATL,2021-10-19 22:52:00,60.0,60.0,64.0,29.13,10.0,S,3.0,0.0,Mostly Cloudy,False,False,False,False,False,False,False,False,False,False,False,False,False,Night,Night,Night,Night
C-5848171,2,2021-09-24 14:56:20,2021-09-24 15:20:08,29.441993,-98.503975,29.443352,-98.506709,0.189416276911,Stationary traffic from E Fredericksburg Rd / N Flores St to N San Marcos due to roadwork.,,Fredericksburg Rd,R,San Antonio,Bexar,TX,78212,US,US/Central,KSAT,2021-09-24 14:51:00,84.0,84.0,29.0,29.18,10.0,CALM,0.0,0.0,Fair,False,False,True,False,False,False,True,False,False,True,False,True,False,Day,Day,Day,Day
C-5848172,2,2021-06-20 07:26:00,2021-06-20 22:28:11,36.912764,-76.26325899999998,36.918324,-76.26894899999998,0.4963655899849999,Roadwork on VA-165/Little Creek Rd/Exit 276 (I-64 HOV) from I-564/US-460/Granby St/Exit 276 (I-64 HOV) to I-64 E - I-64 W.,,I-64 E,R,Norfolk,Norfolk,VA,23505,US,US/Eastern,KNGU,2021-06-20 06:59:00,79.0,79.0,60.0,29.9,10.0,WSW,12.0,0.0,Mostly Cloudy,False,False,False,False,True,False,False,False,False,False,False,False,False,Day,Day,Day,Day
C-5848173,3,2018-12-09 19:00:00,2018-12-10 07:00:00,31.934143,-83.74754300000002,,,48.4000015259,Right lane closed due to construction work on I-75 both ways between Exit 84 GA-159 and Exit 99 GA-300.,,GA-401 S,R,Cordele,Crisp,GA,31015,US,US/Eastern,KCKF,,,,,,,,,,,False,False,False,False,False,False,False,False,False,False,False,False,False,Night,Night,Night,Night
C-5848174,2,2021-11-20 16:36:30,2021-11-20 18:38:19,33.436890000000005,-112.154278,33.43691,-112.151156,0.180013537633,Slow traffic from S 51st Ave (W Buckeye Rd/AZ-85) to S 35th Ave (W Buckeye Rd/AZ-85) due to roadwork.,4345.0,W Buckeye Rd,L,Phoenix,Maricopa,AZ,85043-4901,US,US/Mountain,KGEU,2021-11-20 16:58:00,75.0,75.0,17.0,28.81,10.0,SSW,5.0,0.0,Fair,True,False,False,False,False,False,False,False,True,False,False,False,False,Day,Day,Day,Day
C-5848175,2,2020-07-28 14:30:00,2020-07-29 00:45:00,36.617577,-78.213629,36.671768,-78.213367,3.744269670340002,Construction on US-1 NB near REDLAWN RD Drive with caution.,9501.0,Redlawn Rd,L,Bracey,Mecklenburg,VA,23919,US,US/Eastern,KAVC,2020-07-28 14:35:00,96.0,96.0,35.0,29.49,10.0,WSW,10.0,0.0,Fair,False,False,False,False,False,False,False,False,False,False,False,False,False,Day,Day,Day,Day
C-5848176,2,2021-09-21 15:55:30,2021-09-21 16:18:00,39.168772,-96.60374,39.17041,-96.593784,0.545186730528,Slow traffic on KS-18 E - KS-18 from Riley St (Fort Riley Blvd/KS-18) to S 17th St (Fort Riley Blvd/KS-18) due to roadwork.,,S Seth Child Rd,R,Manhattan,Riley,KS,66502,US,US/Central,KMHK,2021-09-21 15:52:00,75.0,75.0,34.0,29.16,10.0,WNW,12.0,0.0,Partly Cloudy,False,False,False,False,False,False,False,False,False,False,False,False,False,Day,Day,Day,Day
C-5848177,2,2021-06-27 12:16:30,2021-06-27 13:59:30,35.386329,-108.150883,35.364599,-108.055923,5.55646023475,Slow traffic on I-40 E from NM-371/Exit 53 (I-40) to NM-412/Exit 63 (I-40) due to roadwork.,,I-40 E,R,Prewitt,McKinley,NM,87045,US,US/Mountain,KGNT,2021-06-27 11:53:00,76.0,76.0,26.0,23.73,10.0,WNW,5.0,0.0,Fair,False,False,False,False,True,False,False,False,False,False,False,False,False,Day,Day,Day,Day
C-5848178,2,2021-06-22 17:15:05,2021-06-22 17:54:53,40.711994,-73.919274,40.713436,-73.914683,0.260265646093,Slow traffic from Onderdonk Ave to Starr St due to roadwork.,1869.0,Flushing Ave,L,Ridgewood,Queens,NY,11385-1058,US,US/Eastern,KLGA,2021-06-22 16:51:00,66.0,66.0,78.0,29.74,8.0,NW,10.0,0.01,Light Rain,True,False,False,False,False,False,False,False,True,False,False,True,False,Day,Day,Day,Day
C-5848179,2,2021-10-26 17:34:19,2021-10-26 19:46:40,29.000346,-81.302736,28.998909,-81.301778,0.114932629845,Slow traffic on FL-15A - US-92 W - US-17 S from W Chipola Ave to Taylor Rd E / S State Road 15A due to roadwork.,1586.0,S Woodland Blvd,R,Deland,Volusia,FL,32720-7709,US,US/Eastern,KDED,2021-10-26 17:30:00,83.0,83.0,43.0,29.72,10.0,W,9.0,0.0,Fair,False,False,False,False,False,False,False,False,False,False,False,False,False,Day,Day,Day,Day
C-5848180,2,2020-12-28 13:54:30,2020-12-29 01:53:11,42.154671,-87.95952700000002,42.153703,-87.960738,0.0912191492051,Slow traffic on IL-83 from Bank Ln to N Buffalo Grove Rd due to roadwork.,32.0,McHenry Rd,R,Buffalo Grove,Lake,IL,60089-1741,US,US/Central,KPWK,2020-12-28 13:52:00,34.0,27.0,46.0,29.61,10.0,WNW,9.0,0.0,Fair,False,False,False,False,False,False,False,False,False,False,False,False,False,Day,Day,Day,Day
C-5848181,2,2020-10-14 12:23:00,2020-10-15 00:53:30,39.033116,-95.597455,39.032273,-95.592028,0.297038342151,Slow traffic on I-70 from I-470/KS-4/Exit 366 (I-70) to I-470/Kansas Tpke (I-70) due to roadwork.,,I-70 E,R,Tecumseh,Shawnee,KS,66542,US,US/Central,KTOP,2020-10-14 12:53:00,80.0,80.0,34.0,28.77,10.0,SW,10.0,0.0,Fair,False,False,False,False,False,False,False,False,False,False,False,False,False,Day,Day,Day,Day
C-5848182,2,2021-03-19 18:01:00,2021-03-22 05:01:00,34.023839,-117.55808799999998,33.993656,-117.358255,11.633901755999998,Lane closure due to Pavement Work between Route 83/Euclid Ave and Wineville Rd,,CA-60 E,R,Mira Loma,Riverside,CA,91752,US,US/Pacific,KRAL,2021-03-19 17:53:00,67.0,67.0,54.0,29.2,10.0,W,18.0,0.0,Fair,False,False,False,False,True,False,False,False,False,False,False,False,False,Day,Day,Day,Day
C-5848183,3,2019-12-27 08:00:00,2020-03-20 17:00:00,42.598618,-83.163483,,,4.1300001144400005,One lane blocked due to construction work on I-75 Northbound from Exits 69A-B 69B-A Big Beaver Rd to Exit 72 Crooks Rd.,,Chrysler Expy S,R,Troy,Oakland,MI,48098,US,US/Eastern,KVLL,2019-12-27 07:56:00,52.0,52.0,88.0,29.29,10.0,WSW,8.0,0.0,Partly Cloudy,False,False,False,False,False,False,False,False,False,False,False,False,False,Night,Day,Day,Day
C-5848184,2,2020-11-24 03:46:00,2020-11-24 06:00:00,35.08265,-81.706013,35.075495000000004,-81.738281,1.8903266434,Slow traffic on I-85 S from SC-11/Exit 92 (I-85) to Green River Rd/Exit 86 (I-85) due to roadwork.,,I-85 S,R,Gaffney,Cherokee,SC,29341,US,US/Eastern,KEHO,2020-11-24 03:55:00,35.0,35.0,81.0,29.4,10.0,CALM,0.0,0.0,Fair,False,False,False,False,False,False,False,False,False,False,False,False,False,Night,Night,Night,Night
C-5848185,2,2021-04-09 13:54:11,2021-04-09 15:36:57,28.854073,-98.789865,28.853918,-98.787108,0.16718495536,Stationary traffic on FM-140 - TX-85 from CR-3501/Keystone Rd (TX-85) to CR-349/Davis Switch Rd (TX-85) due to roadwork.,4047.0,E State Highway 85,R,Charlotte,Atascosa,TX,78011,US,US/Central,KPEZ,2021-04-09 13:55:00,89.0,89.0,49.0,29.17,10.0,SW,5.0,0.0,Fair,False,False,False,False,False,False,False,False,False,False,False,False,False,Day,Day,Day,Day
C-5848186,2,2021-05-08 21:17:30,2021-05-08 21:59:30,40.684027,-73.832954,40.679787,-73.830876,0.312534849957,Slow traffic from Liberty Ave to 109th Ave due to roadwork.,10400.0,109th St,R,South Richmond Hill,Queens,NY,11419-2408,US,US/Eastern,KJFK,2021-05-08 20:51:00,51.0,51.0,66.0,29.95,10.0,NW,8.0,0.0,Mostly Cloudy,True,False,False,False,False,False,True,False,True,True,False,True,False,Night,Night,Night,Day
C-5848187,2,2017-09-15 06:00:00,2017-09-15 14:00:00,42.384857,-71.047562,,,2.00999999046,Left lane closed due to maintenance work on US-1 Tobin Bridge Northbound from City Square Tunnel to old toll plaza.,,US-1 N,R,Charlestown,Suffolk,MA,02129,US,US/Eastern,KBOS,2017-09-15 05:54:00,68.0,,100.0,29.98,7.0,SSW,4.6,,Overcast,False,False,False,False,False,False,False,False,False,False,False,False,False,Night,Day,Day,Day
C-5848188,4,2016-11-21 09:01:35,2016-11-21 15:01:35,38.653141,-83.75774,38.65148,-83.75878,0.127749440539,Closed at 3rd St - Closed due to roadwork.,,Simon Kenton Brg,R,Aberdeen,Brown,OH,45101,US,US/Eastern,KI69,2016-11-21 08:55:00,32.9,26.7,63.0,30.28,10.0,North,6.9,,Overcast,False,False,False,False,False,False,False,False,False,False,False,False,False,Day,Day,Day,Day
C-5848189,2,2021-09-30 14:06:30,2021-09-30 14:27:30,26.350558000000003,-80.083704,26.350539,-80.08757299999998,0.239549949317,Slow traffic on FL-798 from FL-A1A/Ocean Blvd (E Palmetto Park Rd/FL-798) to I-95 (W Palmetto Park Rd/FL-798) due to roadwork.,1.0,NE Mizner Blvd,L,Boca Raton,Palm Beach,FL,33432,US,US/Eastern,KBCT,2021-09-30 13:53:00,87.0,87.0,59.0,29.98,10.0,ENE,16.0,0.0,Partly Cloudy,True,False,True,False,False,False,False,False,False,False,False,True,False,Day,Day,Day,Day
C-5848190,4,2019-09-11 18:34:15,2019-09-11 23:34:07,42.849408,-78.861979,42.883738,-78.879021,2.52410283029,Closed between Fuhrmann Blvd/Tifft St and Edward St/Goodell St - Closed due to roadwork.,,Buffalo Skwy N,R,Buffalo,Erie,NY,14203,US,US/Eastern,KBUF,2019-09-11 18:54:00,77.0,77.0,74.0,29.3,10.0,SW,6.0,0.0,Mostly Cloudy,False,False,True,False,False,False,False,False,False,False,False,True,False,Day,Day,Day,Day
C-5848191,2,2020-04-09 00:01:00,2020-07-10 23:59:00,44.264679,-88.366074,,,1.52999997139,Road closed due to construction work on CR-Z both ways from Schaefer St to White Oak Dr.,2755.0,E Newberry St,R,Appleton,Outagamie,WI,54915-3018,US,US/Central,KATW,2020-04-09 00:15:00,43.0,37.0,29.0,28.67,10.0,WNW,10.0,0.0,Mostly Cloudy,False,False,False,False,False,False,False,False,True,False,False,False,False,Night,Night,Night,Night
C-5848192,3,2019-09-10 07:02:43,2019-09-14 07:02:30,33.19388,-117.23434,33.2024,-117.2439,0.807490712313,At CR-S13/Vista Village Dr - Construction work.,,S Santa Fe Ave,R,Vista,San Diego,CA,92083,US,US/Pacific,KCRQ,2019-09-10 06:53:00,68.0,68.0,65.0,29.53,10.0,E,5.0,0.0,Cloudy,False,False,True,False,False,False,False,False,True,False,False,True,False,Day,Day,Day,Day
C-5848193,2,2017-11-08 20:56:00,2017-11-09 02:56:00,33.73066,-117.98659,33.71858,-117.97035,1.25203513686,Between CA-39/Beach Blvd/Exit 16 and Magnolia St/Exit 15B - Roadwork.,,San Diego Fwy S,R,Westminster,Orange,CA,92683,US,US/Pacific,KSLI,2017-11-08 20:58:00,61.9,,86.0,30.04,10.0,WNW,4.6,,Clear,False,False,False,False,False,False,False,False,False,False,False,False,False,Night,Night,Night,Night
C-5848194,2,2021-12-14 06:59:00,2021-12-14 07:19:30,47.202575,-122.278485,47.204455,-122.293981,0.7389172243709999,Slow traffic on WA-167 S - WA-161 from WA-410 (WA-167) to 66th Avenue Bridge (River Rd/WA-167) due to roadwork.,,WA-167 S,R,Puyallup,Pierce,WA,98372,US,US/Pacific,KPLU,2021-12-14 06:58:00,30.0,23.0,96.0,29.39,10.0,S,7.0,0.0,Fair,False,False,False,False,False,False,False,False,False,False,False,True,False,Night,Night,Day,Day
C-5848195,2,2016-08-12 10:00:51,2016-08-12 16:00:51,39.25393,-76.82257,39.24886,-76.82778,0.4476812876789999,At MD-100/Exit 22 - Construction work.,,Columbia Pike S,R,Ellicott City,Howard,MD,21042,US,US/Eastern,KBWI,2016-08-12 09:54:00,88.0,,61.0,29.98,10.0,West,10.4,,Partly Cloudy,False,False,False,False,False,False,False,False,False,False,False,False,False,Day,Day,Day,Day
C-5848196,2,2020-08-31 08:59:00,2020-09-01 04:39:25,40.720633,-73.99497,40.719918,-73.993002,0.114285586316,Slow traffic from Elizabeth St to Chrystie St due to roadwork.,25.0,Kenmare St,R,New York,New York,NY,10012-4614,US,US/Eastern,KJRB,2020-08-31 08:51:00,66.0,66.0,68.0,29.99,10.0,CALM,0.0,0.0,Fair,True,False,True,False,False,False,True,False,True,False,False,True,False,Day,Day,Day,Day
C-5848197,4,2021-06-15 00:00:00,2021-06-16 00:44:00,39.711145,-92.802768,39.736275,-92.808168,1.7598719884,Construction on MO-129 NB near MO-WW Road closed. Take alternate route.,12998.0,State Highway WW,R,New Cambria,Macon,MO,63558-2811,US,US/Central,KIRK,2021-06-15 00:55:00,62.0,62.0,84.0,29.04,10.0,CALM,0.0,0.0,Fair,False,False,False,False,False,False,False,False,False,False,False,False,False,Night,Night,Night,Night
C-5848198,2,2021-11-08 12:30:30,2021-11-08 12:50:30,47.643412,-122.308475,47.644486,-122.304361,0.205383811698,Slow traffic on WA-513 from WA-520 E to WA-520 W due to roadwork.,,WA-520 E,R,Seattle,King,WA,98112,US,US/Pacific,KBFI,2021-11-08 12:53:00,53.0,53.0,64.0,29.92,10.0,NNW,6.0,0.0,Fair,False,False,False,False,False,False,False,False,False,False,False,False,False,Day,Day,Day,Day
C-5848199,2,2019-03-28 09:22:04,2019-04-01 09:24:02,40.058902,-76.747439,40.060175,-76.746363,0.104756990403,At York St - Roadwork. Open.,510.0,Canal Road Ext,L,York,York,PA,17406-8435,US,US/Eastern,KMDT,2019-03-28 08:56:00,39.9,35.8,68.0,30.42,10.0,SE,5.8,,Clear,False,False,False,False,False,False,False,False,False,False,False,False,False,Day,Day,Day,Day
C-5848200,2,2020-04-30 07:00:00,2020-10-30 13:00:00,40.97941,-91.17009,40.84438,-91.14822,9.39931097741,Between CR-H38/Main St and US-34 (South) - Roadwork.,20446.0,US Highway 61,R,Mediapolis,Des Moines,IA,52637-9304,US,US/Central,KBRL,2020-04-30 06:53:00,47.0,42.0,68.0,29.15,10.0,NW,10.0,0.0,Fair,False,False,False,False,False,False,False,False,False,False,False,False,False,Day,Day,Day,Day
C-5848201,2,2021-06-21 15:00:02,2021-06-21 15:25:53,40.74705,-74.152671,40.745328,-74.15607,0.2140388840569999,Slow traffic on County Hwy-508 - County Hwy-697 from Patterson St to I-280 W due to roadwork.,529.0,Harrison Ave,R,Harrison,Hudson,NJ,07029-1820,US,US/Eastern,KEWR,2021-06-21 14:51:00,89.0,89.0,53.0,29.63,10.0,S,8.0,0.0,Mostly Cloudy,True,False,False,False,False,False,False,False,True,False,False,True,False,Day,Day,Day,Day
C-5848202,2,2021-04-23 04:49:00,2021-08-02 01:04:13,33.467046999999994,-112.151783,33.464872,-112.151828,0.1503005693,Slow traffic from W Thomas Rd (N 43rd Ave) to I-10/Papago Fwy (N 43rd Ave) due to roadwork.,1717.0,N 43rd Ave,R,Phoenix,Maricopa,AZ,85009,US,US/Mountain,KPHX,2021-04-23 04:51:00,67.0,67.0,37.0,28.61,10.0,VAR,3.0,0.0,Mostly Cloudy,False,False,False,False,False,False,False,False,False,False,False,False,False,Night,Night,Night,Day
