ID,Severity,Start_Time,End_Time,Start_Lat,Start_Lng,End_Lat,End_Lng,Distance(mi),Description,Number,Street,Side,City,County,State,Zipcode,Country,Timezone,Airport_Code,Weather_Timestamp,Temperature(F),Wind_Chill(F),Humidity(%),Pressure(in),Visibility(mi),Wind_Direction,Wind_Speed(mph),Precipitation(in),Weather_Condition,Amenity,Bump,Crossing,Give_Way,Junction,No_Exit,Railway,Roundabout,Station,Stop,Traffic_Calming,Traffic_Signal,Turning_Loop,Sunrise_Sunset,Civil_Twilight,Nautical_Twilight,Astronomical_Twilight
C-3730923,2,2021-11-10 18:10:00,2021-11-10 20:15:37,39.763718,-86.339596,39.763699,-86.33254000000002,0.374755907691,Slow traffic on US-36 E - US-36 W from IN-267 (US-36) to Raceway Rd (Rockville Rd/US-36) due to roadwork.,10342.0,E US Highway 36,L,Avon,Hendricks,IN,46123-7050,US,US/Eastern,KIND,2021-11-10 17:54:00,60.0,60.0,69.0,29.15,10.0,E,10.0,0.0,Mostly Cloudy,False,False,False,False,False,False,False,False,False,False,False,False,False,Night,Night,Day,Day
C-3730924,2,2021-09-12 09:19:30,2021-09-12 11:21:29,38.721127,-77.208393,38.726156,-77.202512,0.470355002586,Roadwork on Exit 163 (I-95 HOV) from VA-286/Fairfax County Pkwy/Exit 166 (I-95 HOV) to I-95 S - I-95 N.,,I-95 N,R,Lorton,Fairfax County,VA,22079,US,US/Eastern,KDAA,2021-09-12 08:56:00,69.0,69.0,78.0,30.1,10.0,S,3.0,0.0,Fair,False,False,False,False,False,False,False,False,False,False,False,False,False,Day,Day,Day,Day
C-3730925,3,2020-10-13 22:00:00,2020-10-14 05:00:00,40.849804,-73.943596,,,0.0,Left lane closed due to bridge maintenance work and construction work on I-95 Cross Bronx Expy Northbound at George Washington Bridge Lower-Trans.,,George Washington Brg,R,New York,New York,NY,10032,US,US/Eastern,KNYC,2020-10-13 21:51:00,57.0,57.0,87.0,29.78,10.0,VAR,3.0,0.0,Cloudy,False,False,False,False,False,False,False,False,False,False,False,False,False,Night,Night,Night,Night
C-3730926,2,2018-04-23 20:37:10,2018-09-27 21:00:00,41.916173,-91.423693,41.917138,-91.447948,1.24881839494,At US-151/IA-13 - Construction work. Lane closed.,204.0,Highway 30 SW,R,Mount Vernon,Linn,IA,52314-1560,US,US/Central,KCID,2018-04-27 03:52:00,39.9,33.4,73.0,29.89,10.0,NW,10.4,,Clear,False,False,False,False,False,False,False,False,False,False,False,False,False,Night,Night,Day,Day
C-3730927,2,2021-01-06 12:49:35,2021-01-12 15:44:24,38.234041,-121.226717,38.233611,-121.245167,1.00176469303,Roadwork from N Dustin Rd (Liberty Rd) to N CA-99 E Fr Rd (Liberty Rd).,27001.0,N Dustin Rd,L,Galt,San Joaquin,CA,95632,US,US/Pacific,KSAC,2021-01-06 12:53:00,51.0,51.0,89.0,30.24,9.0,WNW,5.0,0.0,Fair,False,False,False,False,False,False,False,False,False,False,False,False,False,Day,Day,Day,Day
C-3730928,2,2021-11-20 16:15:27,2021-11-20 17:21:35,32.954199,-96.8352,32.954417,-96.838764,0.207176898102,Stationary traffic from Addison Rd (8th St/Belt Line Rd) to Midway Rd (8th St/Belt Line Rd) due to roadwork.,4533.0,Belt Line Rd,L,Addison,Dallas,TX,75001-4516,US,US/Central,KADS,2021-11-20 15:56:00,72.0,72.0,53.0,29.32,10.0,S,16.0,0.0,Fair,False,False,False,False,False,False,False,False,False,False,False,True,False,Day,Day,Day,Day
C-3730929,3,2018-09-27 02:20:37,2018-09-27 06:01:00,34.009926,-118.281532,,,0.300000011921,Entry ramp to I-110 Southbound from W Martin Luther King Jr Blvd closed due to construction work.,4014.0,S Flower St,L,Los Angeles,Los Angeles,CA,90037-2131,US,US/Pacific,KCQT,2018-09-27 02:47:00,64.9,,87.0,29.91,8.0,Calm,,,Clear,False,False,False,False,False,False,False,False,False,False,False,False,False,Night,Night,Night,Night
C-3730930,2,2020-10-10 13:04:00,2020-10-10 18:13:00,39.798355,-104.781488,39.793944,-104.788258,0.471221469643,Queuing traffic from N Tower Rd to Peña Blvd due to roadwork.,17697.0,E 56th Ave,R,Denver,Denver,CO,80249,US,US/Mountain,KDEN,2020-10-10 12:53:00,81.0,81.0,11.0,24.53,10.0,S,7.0,0.0,Partly Cloudy,False,False,False,False,False,True,False,False,False,False,False,False,False,Day,Day,Day,Day
C-3730931,2,2017-09-21 07:33:58,2017-09-21 15:30:00,39.802242,-75.055298,,,8.760000228880001,Right hand shoulder closed due to construction work on NJ-42 both ways between Exit 12 NJ-41 Hurffville Rd and Exit 8 County Hwy-534 Church St.,,NJ-42 S,R,Blackwood,Camden,NJ,08012,US,US/Eastern,KPHL,2017-09-21 07:54:00,73.0,,68.0,30.04,10.0,NNW,8.1,,Mostly Cloudy,False,False,False,False,False,False,False,False,False,False,False,False,False,Day,Day,Day,Day
C-3730932,2,2021-05-21 07:31:02,2021-05-21 11:05:00,31.822162,-101.688545,31.777383,-101.673831,3.2123184467400003,Slow traffic on FM-1800 - TX-137 from TX-158 (FM-1800/TX-137) to FM-2401 (FM-1800/TX-137) due to roadwork.,3443.0,N State Highway 137,L,Garden City,Glasscock,TX,79739,US,US/Central,KBPG,2021-05-21 07:35:00,64.0,,89.0,27.31,10.0,,,0.0,Partly Cloudy,False,False,False,False,False,False,False,False,False,False,False,False,False,Day,Day,Day,Day
C-3730933,2,2020-04-13 09:00:00,2020-04-17 16:00:00,42.494839,-71.016281,,,0.0,Intermittent lane closures due to construction work on US-1 Broadway Southbound at Spring St.,135.0,Broadway,R,Saugus,Essex,MA,01906-1050,US,US/Eastern,KBOS,2020-04-13 08:54:00,53.0,53.0,96.0,29.95,3.0,S,13.0,0.02,Rain,False,False,False,False,False,False,False,False,False,False,False,False,False,Day,Day,Day,Day
C-3730934,4,2020-11-13 16:12:10,2020-11-14 00:13:49,40.43444,-74.301642,40.43517,-74.300682,0.0713645244268,Emergency construction and Watermain break on US 9 northbound Exit ramp Perrine Rd (Old Bridge Twp) All lanes closed,1399.0,US Highway 9,L,Old Bridge,Middlesex,NJ,08857-2867,US,US/Eastern,KLDJ,2020-11-13 16:15:00,50.0,50.0,82.0,29.91,10.0,NW,5.0,0.0,Fair,False,False,False,False,False,False,False,False,False,False,False,False,False,Day,Day,Day,Day
C-3730935,2,2019-11-26 07:00:00,2019-11-26 15:00:00,39.9753,-75.121117,,,0.579999983311,Road closed due to bridge maintenance work on Aramingo Ave Northbound between Richmond St and York St.,,E York St,R,Philadelphia,Philadelphia,PA,19125,US,US/Eastern,KPNE,2019-11-26 06:54:00,33.0,33.0,89.0,29.89,0.25,CALM,0.0,0.0,Fog,False,False,False,False,False,False,False,False,False,False,False,True,False,Day,Day,Day,Day
C-3730936,2,2021-10-21 13:16:30,2021-10-21 15:17:53,26.256124,-80.282106,26.259838,-80.282156,0.256631662331,Stationary traffic from FL-814/W Atlantic Blvd (Coral Ridge Dr) to FL-834/W Sample Rd (Coral Ridge Dr) due to roadwork.,1959.0,Coral Ridge Dr,L,Coral Springs,Broward,FL,33071-7801,US,US/Eastern,KFXE,2021-10-21 12:53:00,85.0,85.0,57.0,30.11,10.0,E,13.0,0.0,Partly Cloudy,False,False,False,False,False,False,False,False,False,False,False,False,False,Day,Day,Day,Day
C-3730937,2,2021-11-05 12:04:30,2021-12-14 20:33:37,37.980323,-101.751333,37.980108,-101.75286,0.0844783635163999,Stationary traffic on US-50 W - US-50 E - US-400 W - US-400 E - KS-27 from N Gates St to Santa Fe Rd due to roadwork.,200.0,E Avenue A,R,Syracuse,Hamilton,KS,67878-7055,US,US/Mountain,KLAA,2021-12-03 14:53:00,,,,26.27,,,,0.0,,False,False,False,False,False,False,False,False,False,True,False,False,False,Day,Day,Day,Day
C-3730938,2,2021-12-15 15:58:47,2021-12-15 18:09:30,27.893373,-82.787025,27.894723,-82.788596,0.133805163671,Slow traffic on FL-688 - US-19 Alt N - FL-595 from Lark Dr to Ridge Rd S due to roadwork.,13257.0,Seminole Blvd,L,Largo,Pinellas,FL,33773,US,US/Eastern,KPIE,2021-12-15 15:53:00,80.0,80.0,60.0,30.15,10.0,ENE,8.0,0.0,Fair,False,False,False,False,False,False,False,False,False,False,False,False,False,Day,Day,Day,Day
C-3730939,3,2018-07-31 04:02:14,2018-07-31 04:31:45,40.868389,-73.83270999999998,,,5.730000019069999,Left lane closed due to construction work on I-95 New England Trwy Southbound between Exit 15 US-1 Main St and Exits 11 12 Baychester Ave.,,Bartow Ave,R,Bronx,Bronx,NY,10475,US,US/Eastern,KLGA,2018-07-31 03:51:00,73.0,,76.0,30.12,10.0,NE,3.5,,Mostly Cloudy,False,False,False,False,False,False,False,False,False,False,False,False,False,Night,Night,Night,Day
C-3730940,2,2021-10-08 07:32:30,2021-10-08 08:00:00,45.223105,-93.395879,45.22492,-93.396255,0.126732480241,Stationary traffic on County Hwy-116 - MN-47 from Coolidge St / E Mineral Pond Blvd to Castle Field Blvd / Parkview Ln due to roadwork.,3809.0,Saint Francis Blvd,R,Anoka,Anoka,MN,55303-1024,US,US/Central,KANE,2021-10-08 07:45:00,64.0,64.0,94.0,29.01,3.0,VAR,6.0,0.0,Cloudy,False,False,True,False,False,False,False,False,False,True,False,False,False,Day,Day,Day,Day
C-3730941,2,2020-08-20 15:30:00,2020-08-21 06:59:59,39.399907,-74.520205,39.398937,-74.51838199999997,0.118174992379,Bridge inspection on Atlantic City Expressway eastbound between West of Exit 4 - CR 585 (Pleasantville) and East of Pleasantville Toll Plaza (Pleasantville) MOVE OVER FOR HIGHWAY WORKERS Thursday August 20th 2020 08:30 AM thru 02:30 PM left lane and shoulder closed,,Atlantic City Expy E,R,Pleasantville,Atlantic,NJ,08232,US,US/Eastern,KACY,2020-08-20 15:54:00,78.0,78.0,54.0,29.95,10.0,ESE,7.0,0.0,Cloudy,False,False,False,False,False,False,False,False,False,False,False,False,False,Day,Day,Day,Day
C-3730942,4,2021-06-10 08:54:00,2021-06-10 11:33:38,47.349797,-97.049692,47.356207,-97.049762,0.442900940107,I-29 N - US-81 N is closed from CR-11/Exit 92 (I-29) to ND-200A/Exit 100 (I-29) due to roadwork.,,I-29 N,R,Hillsboro,Traill,ND,58045,US,US/Central,KFAR,2021-06-10 08:53:00,75.0,75.0,73.0,28.9,10.0,NNE,15.0,0.0,Fair,False,False,False,False,True,False,False,False,False,False,False,False,False,Day,Day,Day,Day
C-3730943,2,2020-12-11 04:22:27,2020-12-11 05:00:00,45.70795800000001,-122.55271100000002,,,0.0,Intermittent lane closures due to construction during the day time on WA-503 117th Ave Southbound at 119th St.,,NE 119th St,R,Vancouver,Clark,WA,98662,US,US/Pacific,KPDX,2020-12-11 03:53:00,43.0,39.0,86.0,30.1,10.0,SSW,7.0,0.0,Cloudy,False,False,False,False,False,False,False,False,False,False,False,True,False,Night,Night,Night,Night
C-3730944,4,2020-03-05 04:57:42,2020-03-05 06:57:28,40.7014,-74.01476,40.70175,-74.01536,0.0396554443168,At West Side Hwy/Joe Dimaggio Hwy - Roadwork.,,South St,R,New York,New York,NY,10004,US,US/Eastern,KJRB,2020-03-05 04:51:00,41.0,41.0,53.0,29.94,10.0,VAR,3.0,0.0,Fair,False,False,False,False,False,False,False,False,False,False,False,False,False,Night,Night,Night,Day
C-3730945,2,2021-07-17 14:41:30,2021-07-17 16:55:30,37.275825,-97.258217,37.275488,-97.204412,2.95827798182,Stationary traffic on US-160 W - US-160 E from Oliver Rd (E 10th Ave N/US-160) to Oxford Rd/N Sumner St (Main St/US-160) due to roadwork.,101.0,N Woodlawn Rd,L,Wellington,Sumner,KS,67152-8070,US,US/Central,KWLD,2021-07-17 14:54:00,85.0,85.0,67.0,28.8,10.0,ENE,6.0,0.0,Fair,False,False,False,False,False,False,False,False,False,False,False,False,False,Day,Day,Day,Day
C-3730946,2,2021-09-18 11:40:04,2021-09-18 12:00:30,37.684404,-97.326305,37.686063,-97.327549,0.133289034796,Slow traffic from E Waterman St to N Mosley St due to roadwork.,146.0,S Washington St,L,Wichita,Sedgwick,KS,67211,US,US/Central,KIAB,2021-09-18 11:56:00,84.0,84.0,47.0,28.71,10.0,S,7.0,0.0,Fair,True,False,False,False,False,False,False,False,False,True,False,False,False,Day,Day,Day,Day
C-3730947,2,2020-07-06 15:29:00,2020-07-07 16:19:10,40.265053,-76.874781,40.26450300000001,-76.874571,0.0395814292906999,Construction on PA-230 EB near MARKET ST Allow extra time.,10.0,N Cameron St,L,Harrisburg,Dauphin,PA,17101,US,US/Eastern,KCXY,2020-07-06 15:56:00,97.0,97.0,34.0,29.59,10.0,SSW,8.0,0.0,Fair,False,False,False,False,False,False,False,False,False,False,False,True,False,Day,Day,Day,Day
C-3730948,2,2021-08-28 14:49:34,2021-08-28 15:27:00,47.605209,-122.339705,47.601741,-122.334837,0.329919633608,Stationary traffic on WA-519 from Seneca St to 1st Ave S due to roadwork.,1201.0,Alaskan Way,L,Seattle,King,WA,98101-3448,US,US/Pacific,KBFI,2021-08-28 14:53:00,73.0,73.0,49.0,30.08,10.0,VAR,6.0,0.0,Fair,True,False,True,False,False,False,False,False,False,False,False,False,False,Day,Day,Day,Day
C-3730949,2,2021-03-03 05:28:30,2021-03-03 19:48:51,33.509221000000004,-112.049291,33.510042,-112.047524,0.116534405876,Stationary traffic from N 15th St to E Medlock Dr due to roadwork.,1517.0,E Camelback Rd,R,Phoenix,Maricopa,AZ,85014-3404,US,US/Mountain,KPHX,2021-03-03 05:51:00,50.0,50.0,31.0,28.68,10.0,E,6.0,0.0,Fair,False,False,False,False,False,False,False,False,False,False,False,False,False,Night,Night,Night,Night
C-3730950,2,2021-02-16 08:00:00,2021-02-16 16:45:00,39.305414,-75.60794399999997,39.303524,-75.610304,0.18158442502,Daytime intermittent lane and shoulder closures from 8 a.m. until 4 p.m. for roadwork. Glenwood Avenue between US 13 southbound and Main Street (Smyrna) (T201706201) (Group 3),,E Aly,R,Smyrna,Kent,DE,19977,US,US/Eastern,KDOV,2021-02-16 07:56:00,44.0,37.0,100.0,29.6,10.0,WSW,12.0,0.0,Cloudy,False,False,False,False,False,False,False,False,False,False,False,True,False,Day,Day,Day,Day
C-3730951,2,2021-12-14 17:25:06,2021-12-14 19:34:56,25.77148,-80.312285,25.770157,-80.311396,0.106843940165,Slow traffic on FL-969 - FL-968 from NW 2nd St to Tamiami Canal Rd due to roadwork.,68.0,NW 72nd Ave,R,Miami,Miami-Dade,FL,33126-4200,US,US/Eastern,KMIA,2021-12-14 17:53:00,78.0,78.0,71.0,30.18,10.0,ENE,12.0,0.0,Mostly Cloudy,False,False,False,False,False,False,False,False,False,False,False,False,False,Day,Day,Day,Day
C-3730952,2,2021-10-15 13:23:04,2021-10-15 15:29:31,28.260040000000004,-81.60772800000002,28.260776,-81.612188,0.276148491779,Slow traffic from CR-545/S Lake Wilson Rd (Osceola Polk Line Rd/CR-532) to I-4 (Osceola Polk Line Rd/CR-532) due to roadwork.,7991.0,Osceola Polk Line Rd,R,Davenport,Osceola,FL,33896,US,US/Eastern,KISM,2021-10-15 12:56:00,87.0,87.0,53.0,29.89,10.0,VAR,7.0,0.0,Partly Cloudy,False,False,False,False,False,False,False,False,False,False,False,True,False,Day,Day,Day,Day
C-3730953,2,2021-12-14 15:42:00,2021-12-14 17:47:30,40.161248,-74.937993,40.12808,-74.96964200000002,2.83655389985,Slow traffic on Lincoln Hwy - US-1 S - New Lincoln Hwy S from W Interchange to Old Lincoln Hwy due to roadwork.,,New Lincoln Hwy S,R,Langhorne,Bucks,PA,19047,US,US/Eastern,KTTN,2021-12-14 15:53:00,52.0,52.0,40.0,30.3,10.0,N,5.0,0.0,Fair,False,False,False,False,False,False,False,False,False,True,False,False,False,Day,Day,Day,Day
C-3730954,2,2020-08-24 10:49:37,2020-08-29 00:27:57,40.726516,-73.728169,40.72664,-73.72877199999998,0.0327155637575,Construction on NY 25 both directions between 240th Street (New York) and Park Place (Nassau) Not currently scheduled,24001.0,Braddock Ave,L,Bellerose,Queens,NY,11426-1152,US,US/Eastern,KJFK,2020-08-24 10:51:00,83.0,83.0,65.0,30.01,10.0,SW,8.0,0.0,Fair,False,False,False,False,False,False,False,False,False,False,False,False,False,Day,Day,Day,Day
C-3730955,2,2020-09-13 14:06:00,2020-09-14 08:44:10,33.679945000000004,-111.97478,33.680434000000005,-111.977047,0.134650792716,Slow traffic from E Marriott Dr to N Tatum Blvd due to roadwork.,4762.0,E Deer Valley Dr,R,Phoenix,Maricopa,AZ,85054,US,US/Mountain,KSDL,2020-09-13 13:53:00,97.0,97.0,16.0,28.26,10.0,VAR,6.0,0.0,Fair,False,False,True,False,False,False,False,False,False,False,False,True,False,Day,Day,Day,Day
C-3730956,4,2019-01-07 10:14:30,2019-01-07 14:00:00,34.125842,-117.302896,34.125842,-117.302896,0.0,Ramp closed to I-215/Riverside Fwy - Closed. Bridge maintenance work.,,Barstow Fwy S,R,San Bernardino,San Bernardino,CA,92405,US,US/Pacific,KSBD,2019-01-07 09:47:00,55.4,,58.0,30.29,7.0,Calm,,,Scattered Clouds,False,False,False,False,False,False,False,False,False,False,False,False,False,Day,Day,Day,Day
C-3730957,2,2020-09-10 16:00:00,2020-09-11 02:45:00,45.595442,-94.044387,45.582377,-94.07201,1.6120652641100002,Construction on MN-23 SB near 65TH AVE Construction. Drive with caution.,5777.0,Highway 23 NE,L,Sauk Rapids,Benton,MN,56379-9617,US,US/Central,KSTC,2020-09-10 15:53:00,59.0,59.0,44.0,29.3,10.0,VAR,6.0,0.0,Fair,False,False,False,False,False,False,False,False,False,False,False,False,False,Day,Day,Day,Day
C-3730958,3,2016-06-09 06:57:36,2016-06-09 09:00:00,37.808453,-122.366776,,,0.0,Intermittent lane closures due to construction work on I-80 Eastbound between Exits 1 1C Bryant St and Exit 4A Treasure Is.,,San Francisco-Oakland Bay Brg E,R,San Francisco,San Francisco,CA,94130,US,US/Pacific,KOAK,2016-06-09 06:53:00,59.0,,78.0,29.96,7.0,West,13.8,,Overcast,False,False,False,False,False,False,False,False,False,True,False,False,False,Day,Day,Day,Day
C-3730959,2,2017-06-07 20:43:54,2017-06-08 06:00:00,41.14237,-73.42683000000002,41.16331,-73.361166,3.70987929744,Between Main Ave/Exit 40 and CT-57/Exit 42 - Construction work.,,Merritt Pkwy N,R,Norwalk,Fairfield,CT,06850,US,US/Eastern,KHPN,2017-06-07 20:56:00,57.9,,75.0,30.01,10.0,Calm,,,Clear,False,False,False,False,False,False,False,False,False,False,False,False,False,Night,Day,Day,Day
C-3730960,2,2021-10-25 07:29:00,2021-10-25 15:00:00,37.614517,-77.521628,37.611127,-77.519858,0.253470366756,On US-250 (W Broad St) in the County of Henrico from Deep Run Ave to Bethlehem Rd; Rt. 7647N/S (Henrico County) motorists can expect potential delays in this area from 10/25/21 at 7:29 AM until 10/25/21 at 3:00 PM due to paving operations. The west left shoulder and left outside lane are closed.,7299.0,W Broad St,L,Henrico,Henrico,VA,23294-3635,US,US/Eastern,KOFP,2021-10-25 07:54:00,62.0,62.0,93.0,29.79,7.0,S,6.0,0.0,Fair,False,False,False,False,False,False,False,False,False,True,False,True,False,Day,Day,Day,Day
C-3730961,2,2021-03-10 04:13:00,2021-12-18 11:50:46,33.406782,-112.044342,33.406766,-112.048437,0.236193982758,Slow traffic from S 24th St (E Broadway Rd) to S 7th St (E Broadway Rd) due to roadwork.,1689.0,E Broadway Rd,L,Phoenix,Maricopa,AZ,85040-2405,US,US/Mountain,KPHX,2021-10-22 15:51:00,87.0,87.0,16.0,28.66,10.0,WNW,8.0,0.0,Mostly Cloudy,True,False,False,False,False,False,False,False,False,False,False,False,False,Night,Night,Night,Night
C-3730962,2,2021-07-18 13:06:57,2021-07-18 13:20:57,41.067,-76.904296,41.073866,-76.919911,0.941615209879,Slow traffic on I-80 W from US-15/Exit 210A (I-80) to Mile Run Rd/Exit 199 (I-80) due to roadwork.,,I-80 W,R,New Columbia,Union,PA,17856,US,US/Eastern,KIPT,2021-07-18 12:54:00,70.0,70.0,73.0,29.45,10.0,W,9.0,0.0,Cloudy,False,False,False,False,False,False,False,False,False,False,False,False,False,Day,Day,Day,Day
C-3730963,2,2021-10-13 08:31:00,2021-10-13 10:38:35,33.538532000000004,-112.113984,33.538539,-112.112267,0.0988838331294,Stationary traffic from N 35th Ave (W Glendale Ave) to I-17/N Black Canyon Hwy (W Glendale Ave) due to roadwork.,2533.0,W Glendale Ave,L,Phoenix,Maricopa,AZ,85051-6793,US,US/Mountain,KDVT,2021-10-13 08:53:00,55.0,55.0,42.0,28.32,10.0,E,3.0,0.0,Fair,False,False,True,False,False,False,False,False,False,False,False,True,False,Day,Day,Day,Day
C-3730964,2,2020-12-10 17:01:00,2020-12-11 00:46:00,41.015825,-121.641918,41.039984,-121.630467,1.7727293926099998,Construction on CA-89 NB near BURNEY FALLS STATE PARK Expect long delays.,25201.0,State Highway 89,R,Burney,Shasta,CA,96013,US,US/Pacific,KRDD,2020-12-10 16:53:00,62.0,62.0,28.0,29.44,10.0,W,9.0,0.0,Fair,False,False,False,False,False,False,False,False,False,False,False,False,False,Night,Day,Day,Day
C-3730965,2,2020-10-07 13:16:00,2020-10-08 00:09:36,39.704814,-86.39644200000002,39.703419,-86.400959,0.25873465202,Stationary traffic on US-40 from IN-267/Quaker Blvd (E Main St/US-40) to IN-39/Morgan St (Cumberland St/US-40) due to construction work.,501.0,E Main St,R,Plainfield,Hendricks,IN,46168,US,US/Eastern,KIND,2020-10-07 12:54:00,78.0,78.0,43.0,29.09,10.0,WSW,15.0,0.0,Fair,False,False,True,False,False,False,False,False,False,False,False,True,False,Day,Day,Day,Day
C-3730966,2,2020-09-11 02:00:00,2020-09-11 12:45:00,40.893587,-74.28884000000002,40.901566,-74.15389300000002,7.06932622641,Construction on I-80 EB near COUNTY HWY-613 Drive with caution.,,I-80 E,R,Fairfield,Essex,NJ,07004,US,US/Eastern,KCDW,2020-09-11 02:04:00,75.0,75.0,94.0,29.9,10.0,CALM,0.0,0.0,Partly Cloudy,False,False,False,False,False,False,False,False,False,False,False,False,False,Night,Night,Night,Night
C-3730967,2,2021-10-05 06:42:00,2021-11-17 02:00:20,32.747121,-96.755884,32.746913,-96.756533,0.0403602016348,Roadwork from Bexar St (US-175) to TX-310 (US-175).,3182.0,Hawn Fwy N,R,Dallas,Dallas,TX,75215,US,US/Central,KDAL,2021-11-14 20:53:00,52.0,52.0,77.0,29.6,10.0,CALM,0.0,0.0,Partly Cloudy,False,False,False,False,False,False,False,False,False,False,False,False,False,Night,Night,Day,Day
C-3730968,2,2018-03-16 08:07:25,2018-03-16 14:09:23,41.341517,-74.896867,41.351579,-74.97627299999998,4.17707743253,At PA-739/Exit 34 - Roadwork. Lane blocked.,,I-84 W,R,Milford,Pike,PA,18337,US,US/Eastern,KFWN,2018-03-16 07:53:00,30.9,25.2,64.0,29.7,10.0,SW,5.8,,Scattered Clouds,False,False,False,False,False,False,False,False,False,False,False,False,False,Day,Day,Day,Day
C-3730969,2,2021-09-19 16:34:15,2021-09-19 19:54:14,40.723901,-73.84929699999998,40.722361,-73.84621700000002,0.193218226355,Slow traffic on NY-25 from 62nd Dr/Junction Blvd (Queens Blvd/NY-25) to 108th St/71st Ave/Continental Ave (Queens Blvd/NY-25) due to roadwork.,,Queens Blvd,R,Forest Hills,Queens,NY,11375,US,US/Eastern,KLGA,2021-09-19 16:51:00,77.0,77.0,39.0,30.12,10.0,N,5.0,0.0,Fair,True,False,True,False,False,False,False,False,False,True,False,True,False,Day,Day,Day,Day
C-3730970,2,2021-09-07 13:56:00,2021-09-07 14:19:00,40.175086,-75.282149,40.18303,-75.274555,0.6796875834810001,Slow traffic on US-202 S - US-202 N from PA-73/Skippack Pike (DeKalb Pike/US-202) to Sumneytown Pike (DeKalb Pike/US-202) due to roadwork.,438.0,Dekalb Pike,L,Blue Bell,Montgomery,PA,19422-1443,US,US/Eastern,KLOM,2021-09-07 13:55:00,80.0,80.0,47.0,29.66,10.0,WSW,5.0,0.0,Fair,False,False,False,False,False,False,False,False,False,False,False,True,False,Day,Day,Day,Day
C-3730971,2,2018-01-28 20:55:47,2018-01-29 02:55:47,34.08156,-118.70431,34.041989,-118.693032,2.80927181776,At Harbor Vista Dr - Roadwork.,740.0,Malibu Canyon Rd,R,Calabasas,Los Angeles,CA,91302,US,US/Pacific,KVNY,2018-01-28 20:51:00,73.0,,17.0,30.12,10.0,North,21.9,,Clear,False,False,False,False,False,False,False,False,False,False,False,False,False,Night,Night,Night,Night
C-3730972,4,2020-09-18 03:00:00,2020-09-18 12:45:00,35.925303,-83.954161,35.91302299999999,-83.955731,0.853002979136,Construction on TN-115 SB near WOODSON DR Road closed. Take alternate route.,2299.0,Alcoa Hwy,R,Knoxville,Knox,TN,37920-2232,US,US/Eastern,KTYS,2020-09-18 02:53:00,67.0,67.0,90.0,28.85,10.0,NNE,10.0,0.0,Mostly Cloudy,False,False,False,False,False,False,False,False,False,False,False,False,False,Night,Night,Night,Night
C-3730973,2,2020-09-01 04:01:00,2020-09-01 12:46:00,34.110757,-118.263605,34.108117,-118.258785,0.330611326132,Construction on I-5 SB near CA-134 Expect delays.,,Golden State Fwy S,R,Los Angeles,Los Angeles,CA,90039,US,US/Pacific,KCQT,2020-09-01 03:52:00,67.0,67.0,73.0,29.71,9.0,W,3.0,0.0,Cloudy,False,False,False,False,True,False,False,False,False,False,False,False,False,Night,Night,Night,Night
C-3730974,2,2020-05-21 06:55:27,2020-05-25 07:01:08,40.55559,-79.81124,40.56414,-79.79934,0.859755601197,Between PA-910/Exit 11 and Crawford Run/Orange Belt/Exit 13 - Roadwork. Open.,,PA-28 N,R,Cheswick,Allegheny,PA,15024,US,US/Eastern,KAGC,2020-05-21 06:53:00,51.0,51.0,71.0,28.89,10.0,E,10.0,0.0,Fair,False,False,False,False,False,False,False,False,False,False,False,False,False,Day,Day,Day,Day
C-3730975,2,2021-06-24 10:57:00,2021-06-24 12:11:30,35.459512,-108.395257,35.48099699999999,-108.436662,2.7626192890200003,Slow traffic on I-40 W - Historic US 66 W from Red Rock to exit [39] due to roadwork.,,Historic US 66 W,R,Continental Divide,McKinley,NM,87312,US,US/Mountain,KGUP,2021-06-24 10:53:00,76.0,76.0,40.0,23.8,10.0,WSW,16.0,0.0,Partly Cloudy,False,False,False,False,False,False,False,False,False,False,False,False,False,Day,Day,Day,Day
C-3730976,3,2020-06-02 18:36:27,2020-06-08 07:39:37,43.90156,-116.20308,43.90517,-116.20098,0.270450093457,At ID-52/N Riverside Dr - Bridge maintenance work.,2.0,Old Emmett Rd,R,Horseshoe Bend,Boise,ID,83629-8014,US,US/Mountain,KBOI,2020-06-02 18:53:00,82.0,82.0,25.0,27.07,10.0,NNW,6.0,0.0,Fair,False,False,False,False,False,False,False,False,False,False,False,False,False,Day,Day,Day,Day
C-3730977,2,2021-06-05 20:42:17,2021-06-05 21:02:17,25.85026400000001,-80.12155600000001,25.846602,-80.121271,0.253639948268,Stationary traffic on FL-A1A from FL-A1A/Abbott Ave (FL-A1A) to FL-907/63rd St (FL-A1A) due to roadwork.,6640.0,Indian Creek Dr,L,Miami Beach,Miami-Dade,FL,33141-5807,US,US/Eastern,KOPF,2021-06-05 20:53:00,82.0,82.0,74.0,30.05,10.0,E,14.0,0.0,Mostly Cloudy,False,False,False,False,False,False,False,False,False,False,False,False,False,Night,Night,Day,Day
C-3730978,2,2021-05-21 08:50:30,2021-05-21 09:27:30,41.05109,-111.628829,41.04466,-111.669959,2.18874753036,Slow traffic on I-84 W from Rees Ln/Exit 106 (I-84) to UT-66/Exit 103 (I-84) due to roadwork.,,I-84 W,R,Morgan,Morgan,UT,84050,US,US/Mountain,KHIF,2021-05-21 08:58:00,53.0,53.0,44.0,24.87,10.0,S,7.0,0.0,Mostly Cloudy,False,False,False,False,False,False,False,False,False,False,False,False,False,Day,Day,Day,Day
C-3730979,2,2021-08-02 15:52:31,2021-12-22 18:37:00,41.986829,-87.701328,41.990404,-87.708486,0.442883382706,Stationary traffic on US-14 E - US-41 N - US-14 W from N Francisco Ave to N Jersey Ave due to roadwork.,5793.0,N Lincoln Ave,R,Chicago,Cook,IL,60659-4722,US,US/Central,KORD,2021-09-02 14:51:00,77.0,77.0,45.0,29.38,10.0,E,9.0,0.0,Mostly Cloudy,False,False,False,False,False,False,False,False,True,False,False,False,False,Day,Day,Day,Day
C-3730980,2,2020-01-09 09:00:00,2020-01-10 16:00:00,35.218819,-80.823441,,,0.6800000071529999,Entry ramp to Us-74 Southbound from E 7th St Eastbound closed due to construction work.,,NC-27,R,Charlotte,Mecklenburg,NC,28204,US,US/Eastern,KCLT,2020-01-09 08:52:00,45.0,41.0,48.0,29.8,10.0,E,8.0,0.0,Fair,False,False,False,False,False,False,False,False,False,False,False,False,False,Day,Day,Day,Day
