ID,Severity,Start_Time,End_Time,Start_Lat,Start_Lng,End_Lat,End_Lng,Distance(mi),Description,Number,Street,Side,City,County,State,Zipcode,Country,Timezone,Airport_Code,Weather_Timestamp,Temperature(F),Wind_Chill(F),Humidity(%),Pressure(in),Visibility(mi),Wind_Direction,Wind_Speed(mph),Precipitation(in),Weather_Condition,Amenity,Bump,Crossing,Give_Way,Junction,No_Exit,Railway,Roundabout,Station,Stop,Traffic_Calming,Traffic_Signal,Turning_Loop,Sunrise_Sunset,Civil_Twilight,Nautical_Twilight,Astronomical_Twilight
C-3080215,2,2020-06-17 14:56:00,2020-09-03 09:29:11,40.965174,-78.112438,40.997774,-77.996628,6.4469463443400015,Roadwork on I-80 eastbound between Exit 111: PA 153 - CLEARFIELD and Exit 147: PA 144 - SNOW SHOE. There is a traffic disruption.,,I-80 E,R,Grassflat,Clearfield,PA,16839,US,US/Eastern,KFIG,2020-06-17 14:54:00,78.0,78.0,36.0,28.6,10.0,E,9.0,0.0,Fair,False,False,False,False,False,False,False,False,False,False,False,False,False,Day,Day,Day,Day
C-3080216,2,2021-11-30 09:55:30,2021-11-30 10:18:00,33.391897,-89.21754,33.372504,-89.196797,1.79655965629,Slow traffic on MS-9 from Natchez Trace Pkwy (MS-9) to MS-415 (MS-9) due to roadwork.,5699.0,MS Highway 9,L,Ackerman,Choctaw,MS,39735-5711,US,US/Central,KSTF,2021-11-30 09:55:00,59.0,59.0,55.0,29.83,10.0,WSW,5.0,0.0,Fair,False,False,False,False,False,False,False,False,False,False,False,False,False,Day,Day,Day,Day
C-3080217,2,2020-04-13 20:01:00,2020-04-14 05:59:00,36.5637,-119.6157,36.51787,-119.56148,4.3687860049500005,Between Second Street Under-Crossing and Sierra Street - Construction work. Lane closed.,1600.0,2nd St,R,Selma,Fresno,CA,93662-3927,US,US/Pacific,KFAT,2020-04-13 19:53:00,68.0,68.0,52.0,29.72,10.0,NNW,8.0,0.0,Fair,False,False,False,False,False,False,False,False,False,False,False,False,False,Night,Night,Day,Day
C-3080218,2,2021-12-15 14:58:26,2021-12-15 16:09:38,40.763591,-74.011257,40.76654,-74.02260600000002,0.627883637739,Slow traffic on NJ-495 W - NJ-495 E from NJ--NY State Border (Lincoln Tunnel (Inner Lane)/NJ-495) to NJ-495/Lincoln Tunnel (Lincoln Tunnel (Inner Lane)/NJ-495) due to roadwork.,,Lincoln Tunl,R,Weehawken,Hudson,NJ,07086,US,US/Eastern,KNYC,2021-12-15 14:51:00,52.0,52.0,59.0,30.39,10.0,VAR,6.0,0.0,Cloudy,False,False,False,False,False,False,False,False,False,False,False,False,False,Day,Day,Day,Day
C-3080219,2,2020-10-01 13:04:30,2020-10-02 01:54:34,41.705276,-87.942468,41.700072,-87.93340400000002,0.589837896001,Queuing traffic on IL-83 - IL-171 from Jeans Rd to Lemont due to roadwork.,,Kingery Hwy,R,Willowbrook,DuPage,IL,60527,US,US/Central,KMDW,2020-10-01 12:53:00,56.0,56.0,55.0,29.34,10.0,WNW,17.0,0.0,Mostly Cloudy,False,False,False,False,False,False,False,False,False,False,False,False,False,Day,Day,Day,Day
C-3080220,2,2021-12-23 12:57:07,2021-12-23 13:31:14,39.87364,-75.082686,39.866488,-75.07948499999998,0.522498004763,Slow traffic on NJ-168 from Kings Hwy (Black Horse Pike/NJ-168) to New Jersey Tpke (Black Horse Pike/NJ-168) due to roadwork.,779.0,Black Horse Pike,L,Haddon Heights,Camden,NJ,08035-1101,US,US/Eastern,KPHL,2021-12-23 12:54:00,38.0,31.0,36.0,30.21,10.0,NW,9.0,0.0,Partly Cloudy,True,False,False,False,False,False,False,False,False,False,False,True,False,Day,Day,Day,Day
C-3080221,4,2019-06-19 23:39:09,2019-06-20 04:39:00,42.848492,-78.861491,42.883462,-78.879099,2.57548792651,Closed between Fuhrmann Blvd/Tifft St and Edward St/Goodell St - Closed due to roadwork.,,Buffalo Skwy N,R,Buffalo,Erie,NY,14203,US,US/Eastern,KBUF,2019-06-19 23:54:00,69.0,69.0,70.0,28.93,10.0,NE,7.0,0.0,Mostly Cloudy,False,False,True,False,False,False,False,False,False,False,False,True,False,Night,Night,Night,Night
C-3080222,4,2020-11-10 19:37:30,2020-11-26 07:59:00,26.1525,-80.111694,26.153915,-80.111076,0.105011735682,Closed road from FL-838/E Sunrise Blvd (Bayview Dr) to NE 26th St (Bayview Dr) due to roadwork.,2701.0,NE 21st St,L,Fort Lauderdale,Broward,FL,33305-3614,US,US/Eastern,KFXE,2020-11-10 19:48:00,81.0,81.0,84.0,29.84,10.0,ESE,14.0,0.0,Mostly Cloudy,False,False,False,False,False,False,False,False,False,False,False,False,False,Night,Night,Night,Night
C-3080223,2,2020-09-24 13:11:30,2020-09-24 20:51:33,26.529208,-80.147379,26.52819,-80.146272,0.0981346684878999,Stationary traffic on FL-804 from Jog Rd to Copper Lake Ct due to resurfacing work.,9961.0,S Jog Rd,L,Boynton Beach,Palm Beach,FL,33437-3638,US,US/Eastern,KBCT,2020-09-24 12:53:00,84.0,84.0,82.0,29.96,10.0,ESE,14.0,0.03,Mostly Cloudy,False,False,False,False,False,False,False,False,False,False,False,False,False,Day,Day,Day,Day
C-3080224,2,2021-08-24 16:14:00,2021-08-24 18:27:57,27.892934000000004,-82.787025,27.894562,-82.786007,0.12851914225,Slow traffic on FL-688 - US-19 Alt N - FL-595 from Lark Dr to Honeyvine Mobile Home Park due to roadwork.,13227.0,Seminole Blvd,L,Largo,Pinellas,FL,33773,US,US/Eastern,KPIE,2021-08-24 15:53:00,85.0,85.0,74.0,29.99,10.0,NNW,6.0,0.02,Fair,False,False,False,False,False,False,False,False,True,False,False,False,False,Day,Day,Day,Day
C-3080225,2,2020-12-15 13:14:00,2020-12-15 18:23:30,25.947317,-80.151248,25.947887,-80.14678599999998,0.280000588771,Stationary traffic on US-1 N - FL-860 - FL-5 from NE 24th Pl to NE 187th St due to roadwork.,,NE 24th Pl,R,Miami,Miami-Dade,FL,33180,US,US/Eastern,KHWO,2020-12-15 12:53:00,81.0,81.0,67.0,29.98,10.0,WSW,5.0,0.0,Partly Cloudy,False,False,True,False,False,False,False,False,False,False,False,False,False,Day,Day,Day,Day
C-3080226,3,2016-09-13 13:35:07,2017-01-21 18:37:16,41.995806,-87.874548,42.082657,-88.339612,24.60750638610001,Between I-294/Tri-State Tollway and Randall Rd - Roadwork.,,Jane Addams Memorial Tollway W,R,Des Plaines,Cook,IL,60018,US,US/Central,KORD,2016-09-13 14:51:00,82.0,,51.0,30.03,10.0,West,12.7,,Mostly Cloudy,False,False,False,False,True,False,False,False,False,False,False,False,False,Day,Day,Day,Day
C-3080227,2,2020-10-28 13:20:00,2020-10-28 16:14:30,40.231803,-79.58488299999998,40.241531,-79.57674499999997,0.7975069232619999,Queuing traffic on US-119 from Burton Ave (US-119) to Fairview St (US-119) due to roadwork.,598.0,S 3rd St,L,Youngwood,Westmoreland,PA,15697-1106,US,US/Eastern,KLBE,2020-10-28 13:47:00,50.0,50.0,100.0,28.81,8.0,SSW,7.0,0.0,Mostly Cloudy,False,False,False,False,False,False,False,False,False,False,False,False,False,Day,Day,Day,Day
C-3080228,2,2021-02-19 09:01:00,2021-02-19 15:46:00,38.588731,-122.607059,38.598416,-122.621344,1.0212205716299998,Construction on CA-128 WB near TUBBS LN Expect long delays.,1100.0,Tubbs Ln,R,Calistoga,Napa,CA,94515-1054,US,US/Pacific,KSTS,2021-02-19 08:53:00,49.0,47.0,97.0,30.18,2.0,NNW,6.0,0.0,Fog,False,False,False,False,False,False,False,False,False,False,False,False,False,Day,Day,Day,Day
C-3080229,2,2021-11-16 01:27:24,2021-11-17 02:12:27,45.461164,-96.433798,45.463626,-96.433817,0.170110490803,Construction on US-75 NB near MN-7 Allow extra time.,,3rd St,R,Clinton,Big Stone,MN,56225,US,US/Central,KVVV,2021-11-16 01:35:00,32.0,22.0,93.0,28.63,10.0,SE,15.0,0.0,Fair,False,False,False,False,False,False,False,False,False,False,False,False,False,Night,Night,Night,Night
C-3080230,3,2021-04-23 09:20:29,2021-04-23 11:30:00,37.741749,-121.57399,,,43.9099998474,One lane closed due to maintenance work on I-580 Eastbound from Castro Valley Rd to I-205.,,I-580 E,R,Tracy,Alameda,CA,95377,US,US/Pacific,KLVK,2021-04-23 08:53:00,54.0,54.0,66.0,29.57,10.0,W,7.0,0.0,Fair,False,False,False,False,True,False,False,False,False,False,False,False,False,Day,Day,Day,Day
C-3080231,2,2017-05-01 11:30:24,2017-05-01 15:00:00,40.430374,-74.186287,,,0.63,Right hand shoulder closed due to construction work on NJ-36 both ways from Poole Ave to County Hwy-516 Middle Rd.,,State Route 36,R,Hazlet,Monmouth,NJ,07730,US,US/Eastern,KLDJ,2017-05-01 11:35:00,55.4,,91.0,29.98,5.0,Calm,,,Overcast,False,False,False,False,True,False,False,False,False,False,False,False,False,Day,Day,Day,Day
C-3080232,2,2019-07-19 09:02:30,2019-07-23 09:02:22,33.74265,-84.40348,33.74431,-84.40006,0.227516131384,At Windsor St/EB Exit 56 - Maintenance work. Left lane blocked.,,McDaniel St SW,R,Atlanta,Fulton,GA,30312,US,US/Eastern,KATL,2019-07-19 08:52:00,78.0,78.0,79.0,29.02,10.0,CALM,0.0,0.0,Cloudy,False,False,False,False,True,False,False,False,False,False,False,False,False,Day,Day,Day,Day
C-3080233,2,2021-06-16 13:08:45,2021-06-16 13:29:38,25.850611,-80.121668,25.844415,-80.121534,0.428183906418,Slow traffic on FL-A1A from FL-A1A/Abbott Ave (FL-A1A) to FL-907/63rd St (FL-A1A) due to roadwork.,6650.0,Indian Creek Dr,L,Miami Beach,Miami-Dade,FL,33141-5807,US,US/Eastern,KOPF,2021-06-16 13:09:00,81.0,81.0,67.0,30.03,10.0,E,13.0,0.0,Fair,False,False,True,False,False,False,False,False,False,False,False,True,False,Day,Day,Day,Day
C-3080234,2,2021-11-19 18:18:00,2021-11-19 18:38:30,34.797665,-92.410237,34.793685,-92.399622,0.662092804201,Stationary traffic on AR-10 from Taylor Loop Rd (Little Rock) (East) (AR-10) to I-430 (AR-10) due to roadwork.,12345.0,Cantrell Rd,L,Little Rock,Pulaski,AR,72223,US,US/Central,KLZK,2021-11-19 17:56:00,39.0,35.0,77.0,29.98,10.0,ESE,5.0,0.0,Fair,False,False,True,False,False,False,False,False,False,False,False,False,False,Night,Night,Night,Day
C-3080235,2,2021-01-29 11:39:30,2021-01-30 03:20:55,33.451231,-112.171276,33.452106,-112.169126,0.13790223248,Stationary traffic from N 52nd Ave to W Polk St due to roadwork.,5135.0,W Van Buren St,L,Phoenix,Maricopa,AZ,85043-3720,US,US/Mountain,KGEU,2021-01-29 11:56:00,63.0,63.0,38.0,28.74,10.0,SSW,18.0,0.0,Fair,False,False,False,False,False,False,False,False,False,False,False,False,False,Day,Day,Day,Day
C-3080236,4,2019-07-22 22:33:43,2019-07-23 03:31:31,39.55632,-104.87795,39.55524000000001,-104.87501,0.173486084089,Ramp closed to I-25 - Closed due to roadwork.,,CO-470 E,R,Lone Tree,Douglas,CO,80124,US,US/Mountain,KAPA,2019-07-22 22:53:00,68.0,68.0,68.0,24.45,10.0,S,17.0,0.0,Fair,False,False,False,False,True,False,False,False,False,False,False,False,False,Night,Night,Night,Night
C-3080237,2,2021-11-02 07:00:00,2021-11-02 23:59:00,40.866748,-74.314409,40.85932800000001,-74.327159,0.840655680531,Bridge maintenance operations on US 46 westbound West of NJ 159/CR 627/Plymouth Rd (Fairfield Twp) Tuesday November 2nd 2021 07:00 AM thru 02:00 PM right shoulder closed,49.0,US Highway 46,L,Fairfield,Essex,NJ,07004-3003,US,US/Eastern,KCDW,2021-11-02 06:53:00,46.0,46.0,79.0,30.01,10.0,CALM,0.0,0.0,Cloudy,False,False,False,False,False,False,False,False,False,False,False,False,False,Night,Day,Day,Day
C-3080238,2,2018-09-07 14:04:55,2018-09-07 14:49:26,35.075829,-89.86314399999998,,,0.0,Very slow traffic and center lane blocked due to maintenance work on TN-385 Bill Morris Pkwy Westbound at Ridgeway Rd.,,Bill Morris Pkwy,R,Memphis,Shelby,TN,38119,US,US/Central,KOLV,2018-09-07 13:50:00,86.0,,79.0,30.02,10.0,South,8.1,,Mostly Cloudy,False,False,False,False,False,False,False,False,False,False,False,False,False,Day,Day,Day,Day
C-3080239,4,2020-09-29 14:24:40,2020-10-07 06:59:00,33.184034999999994,-87.526301,33.184395,-87.526155,0.0262673427101,Closed road from Oakhill Ct to McFarland Blvd E due to roadwork.,,Albright Rd,R,Tuscaloosa,Tuscaloosa,AL,35401,US,US/Central,KTCL,2020-09-29 14:53:00,74.0,74.0,37.0,29.76,10.0,NW,13.0,0.0,Fair,False,False,False,False,False,False,False,False,False,False,False,False,False,Day,Day,Day,Day
C-3080241,2,2021-07-17 19:00:00,2021-07-18 08:02:02,36.090633,-85.741111,36.089172,-85.725824,0.859482276529,State Route 141 both directions in Putnam County - Between DEKALB-PUTNAM COUNTY LINE / BEGIN STATE HWY.141 and SR-56 (STATE HWY.56) RT. &amp; LT. construction work will cause temporary lane closures at night. This work is expected to be completed by 07/21/2021.,14167.0,Center Hill Dam Rd,R,Silver Point,Putnam,TN,38582-6407,US,US/Central,KSRB,2021-07-17 18:55:00,79.0,79.0,83.0,28.99,10.0,CALM,0.0,0.0,Fair,False,False,False,False,False,False,False,False,False,False,False,False,False,Day,Day,Day,Day
C-3080242,2,2020-09-29 20:00:00,2020-11-23 08:18:07,46.311861,-123.484525,46.309268,-123.47928600000002,0.307598535388,Beginning Wednesday Sept. 30 2020  until further notice: Travelers on both directions of SR 4 between Loop Road and West Valley Road  will see equipment and crews starting work again. This section of SR 4 will be reduced to a single lane around-the-clock until work is complete later this year. Note: For safety the speed limit has been reduced to 25 mph throughout the work zone.,2087.0,W State Road 4,L,Skamokawa,Wahkiakum,WA,98647,US,US/Pacific,KAST,2020-09-29 19:55:00,65.0,65.0,81.0,29.98,10.0,SE,3.0,0.0,Fair,False,False,False,False,False,False,False,False,False,False,False,False,False,Night,Night,Night,Day
C-3080243,3,2017-11-22 07:01:06,2017-11-22 13:01:06,41.590241,-88.007959,41.582765,-88.00322800000002,0.571482661977,At 167th St - Roadwork.,,I-355 S,R,Lockport,Will,IL,60441,US,US/Central,KLOT,2017-11-22 06:55:00,19.2,14.1,87.0,30.34,10.0,NW,3.5,,Clear,False,False,False,False,False,False,False,False,False,False,False,False,False,Day,Day,Day,Day
C-3080244,2,2021-10-11 15:07:46,2021-10-11 16:14:49,33.691429,-84.51486899999998,33.690629,-84.511466,0.203292365516,Stationary traffic on GA-154 - GA-166 from County Line Rd (GA-166) to Fairburn Rd (GA-166) due to roadwork.,3876.0,Campbellton Rd SW,L,Atlanta,Fulton,GA,30331-5052,US,US/Eastern,KFTY,2021-10-11 14:53:00,77.0,77.0,60.0,29.08,10.0,VAR,3.0,0.0,Partly Cloudy,False,False,False,False,False,False,False,False,False,False,False,True,False,Day,Day,Day,Day
C-3080245,2,2020-11-24 12:00:30,2020-11-24 18:41:30,40.571634,-75.617402,40.575448,-75.62043,0.307729703628,Slow traffic on PA-100 from US-222/Trexlertown Rd (PA-100) to Penn Dr/Stroh Dr (PA-100) due to roadwork.,47.0,S Route 100,L,Allentown,Lehigh,PA,18106-9207,US,US/Eastern,KXLL,2020-11-24 11:55:00,45.0,40.0,53.0,29.93,10.0,NNW,9.0,0.0,Fair,False,False,True,False,False,False,False,False,False,False,False,True,False,Day,Day,Day,Day
C-3080246,2,2020-06-04 13:16:00,2020-10-01 13:16:00,44.465435,-72.68740600000002,44.471607,-72.688299,0.428711752804,Repaving starting mid June From Intersection of Rte.108 &amp; Rte.100 in Stowe (108 to Eagles Ridge rd) (100 north to just past Cemetery rd) night work 7:00 pm - 6:00 am,1.0,S Main St,R,Stowe,Lamoille,VT,05672,US,US/Eastern,KMVL,2020-06-04 12:54:00,72.0,72.0,55.0,29.02,10.0,SW,10.0,0.0,Mostly Cloudy,True,False,True,False,False,False,False,False,False,True,False,False,False,Day,Day,Day,Day
C-3080247,2,2021-11-23 11:12:00,2021-11-23 12:16:00,29.539966,-95.808437,29.531654,-95.808306,0.5743584928190001,Slow traffic on TX-36 from US-90 Alt/Avenue H (US-90 Alt/1st St/Avenue H/TX-36) to US-59/Southwest Fwy (1st St/TX-36) due to roadwork.,2617.0,1st St,R,Rosenberg,Fort Bend,TX,77471-5801,US,US/Central,KSGR,2021-11-23 10:53:00,68.0,68.0,55.0,30.17,10.0,SE,10.0,0.0,Fair,False,False,False,False,False,False,False,False,False,False,False,True,False,Day,Day,Day,Day
C-3080249,2,2017-01-18 09:01:31,2017-01-18 18:01:31,38.76766,-94.82758,38.8107,-94.821518,2.9916475893400003,At 175th St - Maintenance work.,,S Highway 169,R,Spring Hill,Johnson,KS,66083,US,US/Central,KIXD,2017-01-18 08:53:00,30.0,20.5,100.0,30.19,0.2,SSE,11.5,,Light Freezing Fog,False,False,False,False,False,False,False,False,False,False,False,False,False,Day,Day,Day,Day
C-3080250,2,2021-02-24 06:44:00,2021-02-24 08:31:30,34.989777000000004,-80.769965,34.988784,-80.773671,0.220714365953,Slow traffic from Twelve Mile Creek Rd (New Town Rd) to NC-16/Providence Rd (New Town Rd) due to roadwork.,8223.0,New Town Rd,R,Waxhaw,Union,NC,28173-8301,US,US/Eastern,KEQY,2021-02-24 06:53:00,38.0,38.0,83.0,29.38,10.0,CALM,0.0,0.0,Fair,False,False,False,False,False,False,False,False,False,False,False,True,False,Night,Day,Day,Day
C-3080251,2,2021-05-05 19:53:41,2021-05-06 06:45:00,41.547595,-72.805295,41.554405,-72.84399,2.05538962053,Construction on I-691 WB near EXIT 6 Construction. Right lane closed.,,I-691 W,R,Meriden,New Haven,CT,06451,US,US/Eastern,KMMK,2021-05-05 19:53:00,57.0,57.0,83.0,29.6,10.0,NNW,8.0,0.0,Cloudy,False,False,False,False,False,False,False,False,False,False,False,False,False,Night,Day,Day,Day
C-3080252,2,2021-07-19 07:47:00,2021-07-19 08:23:00,39.656323,-105.000299,39.660319,-104.99801399999998,0.301666862401,Slow traffic on US-85 N from W Hampden Ave to W Dartmouth Ave due to roadwork.,,S Santa Fe Dr,R,Englewood,Arapahoe,CO,80110,US,US/Mountain,KAPA,2021-07-19 07:53:00,69.0,69.0,61.0,24.44,10.0,CALM,0.0,0.0,Fair,False,False,False,False,False,False,False,False,False,False,False,False,False,Day,Day,Day,Day
C-3080253,2,2021-03-05 15:27:59,2021-03-05 18:49:16,28.420529,-81.635779,28.419799,-81.635858,0.0506661311919,Roadwork on FL-429 Toll (Avalon Rd) from Seidel Rd (Avalon Rd) to County Hwy-545.,9972.0,Avalon Rd,L,Winter Garden,Orange,FL,34787,US,US/Eastern,KORL,2021-03-05 15:53:00,79.0,79.0,20.0,29.83,10.0,NNE,9.0,0.0,Fair,False,False,True,False,False,False,False,False,False,False,False,False,False,Day,Day,Day,Day
C-3080254,2,2021-06-15 12:51:47,2021-06-15 14:54:36,28.079381,-80.60681600000002,28.07938900000001,-80.603255,0.217082350953,Slow traffic on US-192 E - US-192 W - US-1 N - US-1 S - FL-5 from Waverly Pl to E New Haven Ave due to roadwork.,846.0,E Strawbridge Ave,L,Melbourne,Brevard,FL,32901-4739,US,US/Eastern,KMLB,2021-06-15 12:53:00,87.0,87.0,61.0,29.94,10.0,WSW,14.0,0.0,Mostly Cloudy,False,False,False,False,False,False,False,False,True,False,False,False,False,Day,Day,Day,Day
C-3080255,2,2020-10-18 08:03:00,2020-10-19 00:25:52,40.72164,-73.993587,40.719918,-73.993002,0.122859313394,Slow traffic from Rivington St to Chrystie St due to roadwork.,210.0,Bowery,L,New York,New York,NY,10012-4203,US,US/Eastern,KJRB,2020-10-18 07:51:00,47.0,47.0,93.0,30.38,10.0,NNE,3.0,0.0,Fair,False,False,True,False,False,False,True,False,True,False,False,True,False,Day,Day,Day,Day
C-3080256,2,2020-06-23 09:26:36,2020-06-23 15:00:00,40.79898,-73.91903,40.77054,-73.91756,1.96652113999,Between I-87 and 31st St/Hoyt Ave/Exit 3 - Roadwork. Right lane closed.,,Bruckner Expy W,R,Bronx,Bronx,NY,10454,US,US/Eastern,KLGA,2020-06-23 09:51:00,84.0,84.0,51.0,29.79,10.0,S,10.0,0.0,Fair,False,False,False,False,False,False,True,False,True,False,False,True,False,Day,Day,Day,Day
C-3080257,2,2020-09-21 15:30:00,2020-09-22 16:43:14,40.529923,-80.154131,40.531161,-80.148664,0.299571688341,Utility work on REDGATE RD / RIVER RD / REDGATE/RIVER RD both directions between RHODES AV and SHIELDS LN. There is a lane restriction.,320.0,Redgate Rd,L,Sewickley,Allegheny,PA,15143-2504,US,US/Eastern,KPIT,2020-09-21 15:51:00,65.0,65.0,31.0,29.13,10.0,CALM,0.0,0.0,Fair,False,False,False,False,False,False,False,False,False,False,False,False,False,Day,Day,Day,Day
C-3080258,3,2021-12-16 23:04:30,2021-12-17 05:00:00,32.82209,-117.114822,,,0.469999998808,Entry ramp to I-15 Northbound from Tierrasanta Blvd Eastbound closed due to bridge maintenance work.,,Tierrasanta Blvd,R,San Diego,San Diego,CA,92124,US,US/Pacific,KMYF,2021-12-16 23:10:00,52.0,52.0,97.0,29.66,5.0,ESE,6.0,0.0,Cloudy,False,False,False,False,False,False,False,False,False,False,False,False,False,Night,Night,Night,Night
C-3080259,2,2021-03-24 00:00:01,2021-03-24 05:00:00,39.746136,-105.466122,39.744691,-105.476302,0.5499555564249999,Crews are working behind barrier and in shoulders during daytime hours and various lane closures and mobile closures exist during overnight hours for construction activities related to the new Express Lane. Work also includes toll system testing.,,I-70 W,R,Evergreen,Clear Creek,CO,80439,US,US/Mountain,K0CO,2021-03-24 00:53:00,18.0,18.0,57.0,20.6,10.0,VAR,3.0,0.0,Cloudy,False,False,False,False,False,False,False,False,False,False,False,False,False,Night,Night,Night,Night
C-3080260,2,2019-04-22 18:00:00,2019-04-23 06:00:00,42.324184,-83.16229200000002,,,7.610000133510001,One lane closed due to construction work on US-12 Michigan Ave Westbound from Rosa Parks Blvd to I-94.,,Detroit Industrial Fwy E,R,Dearborn,Wayne,MI,48126,US,US/Eastern,KDET,2019-04-22 17:53:00,69.0,69.0,33.0,29.41,10.0,S,10.0,0.0,Fair,False,False,False,False,False,False,False,False,False,False,False,False,False,Day,Day,Day,Day
C-3080261,2,2021-08-18 20:29:30,2021-08-18 20:50:30,36.900219,-106.846442,36.904118,-106.856223,0.603838379329,Stationary traffic on US-64 W - US-64 E from US-84 (Tierra Amarilla) (West) (US-64) to CR-356 (US-64) due to roadwork.,,US-64 W,R,Tierra Amarilla,Rio Arriba,NM,87575,US,US/Mountain,KE33,2021-08-18 20:35:00,58.0,58.0,97.0,22.72,10.0,CALM,0.0,0.0,Cloudy,False,False,False,False,False,False,False,False,False,False,False,False,False,Night,Night,Day,Day
C-3080262,3,2019-01-10 08:00:00,2019-01-10 17:00:00,29.66655200000001,-98.631729,,,0.0,Intermittent lane closures due to construction work on I-10 Eastbound at Boerne Stage Rd.,,I-10 E,R,San Antonio,Bexar,TX,78257,US,US/Central,K5C1,2019-01-10 07:55:00,46.4,,57.0,30.35,10.0,Calm,,,Mostly Cloudy,False,False,False,False,False,False,False,False,False,False,False,False,False,Day,Day,Day,Day
C-3080263,2,2020-06-08 06:03:58,2020-06-09 18:59:59,42.25457,-83.68332,42.25933,-83.71061999999998,1.43429859108,Between I-94-br/US-23 and E Stadium Blvd - Construction work. Lane blocked.,,Washtenaw Ave,R,Ann Arbor,Washtenaw,MI,48104,US,US/Eastern,KARB,2020-06-08 09:53:00,68.0,68.0,55.0,29.2,10.0,CALM,0.0,0.0,Fair,False,False,False,False,False,False,False,False,False,False,False,False,False,Day,Day,Day,Day
C-3080264,2,2021-07-25 06:22:00,2021-07-26 08:50:59,40.432158,-80.00396500000002,40.432519,-80.003687,0.0289119485058,Construction on SMITHFIELD ST NB near CARSON ST Allow extra time.,101.0,W Carson St,R,Pittsburgh,Allegheny,PA,15219-1211,US,US/Eastern,KAGC,2021-07-25 06:43:00,71.0,71.0,78.0,28.6,8.0,SSW,7.0,0.0,Cloudy,True,False,True,False,False,False,True,False,False,False,False,True,False,Day,Day,Day,Day
C-3080265,4,2016-03-30 06:37:00,2019-03-08 13:00:00,34.03857,-118.22833,34.038232,-118.233798,0.313940889357,Closed between Los Angeles River and S Alameda St - Closed due to roadwork.,,Whittier Blvd,R,Los Angeles,Los Angeles,CA,90021,US,US/Pacific,KCQT,2016-03-30 06:47:00,52.0,,63.0,29.96,10.0,Variable,3.5,,Clear,False,False,False,False,False,False,False,False,False,False,False,False,False,Night,Day,Day,Day
C-3080266,2,2021-04-17 13:02:00,2021-04-17 13:57:30,33.377596999999994,-112.13468600000002,33.37766,-112.133734,0.0551000750715999,Stationary traffic at S 35th Ave due to roadwork.,3509.0,W Baseline Rd,L,Laveen,Maricopa,AZ,85339,US,US/Mountain,KPHX,2021-04-17 12:51:00,81.0,81.0,11.0,28.66,10.0,WNW,5.0,0.0,Fair,False,False,True,False,False,False,False,False,True,False,False,True,False,Day,Day,Day,Day
C-3080267,2,2021-07-07 16:52:01,2021-07-07 19:52:16,42.464489,-83.474592,42.467073,-83.474728,0.178671909425,Stationary traffic from W 9 Mile Rd (Novi Rd) to Grand River Ave (Novi Rd) due to roadwork.,23915.0,Novi Rd,L,Novi,Oakland,MI,48375-3244,US,US/Eastern,KPTK,2021-07-07 16:53:00,76.0,76.0,74.0,28.84,9.0,S,3.0,0.0,Light Rain with Thunder,False,False,True,False,False,False,False,False,False,False,False,False,False,Day,Day,Day,Day
C-3080268,2,2021-11-11 15:36:00,2021-11-11 18:38:22,45.069293,-93.329477,45.069992,-93.328323,0.0741858820128,Stationary traffic on County Hwy-152 from France Ave N to Halifax Dr due to roadwork.,6299.0,France Ave N,R,Minneapolis,Hennepin,MN,55429-4041,US,US/Central,KMIC,2021-11-11 15:53:00,38.0,30.0,68.0,28.54,10.0,W,14.0,0.0,Cloudy,False,False,True,False,False,False,False,False,False,False,False,False,False,Day,Day,Day,Day
C-3080269,2,2021-06-18 05:48:00,2021-06-18 11:38:00,41.830463,-87.630219,41.846816,-87.640374,1.24494966274,Slow traffic on I-94 W - I-90 W - Dan Ryan Expy N from Pershing Rd/Exit 55B (I-90/I-94) to I-55/Adlai E Stevenson Expy/Exit 53B (I-90/I-94) due to roadwork.,,Dan Ryan Expy N,R,Chicago,Cook,IL,60609,US,US/Central,KMDW,2021-06-18 05:47:00,68.0,68.0,83.0,29.22,8.0,NE,13.0,0.2,Light Rain,False,False,False,False,True,False,False,False,False,False,False,False,False,Day,Day,Day,Day
C-3080270,4,2017-10-13 23:55:52,2017-10-14 05:55:52,33.88325,-117.54282,33.88495,-117.54913,0.380518183204,Ramp closed to I-15 - Closed due to roadwork.,,CA-91 W,R,Corona,Riverside,CA,92879,US,US/Pacific,KAJO,2017-10-13 23:56:00,54.0,,93.0,30.0,9.0,Calm,,,Clear,False,False,False,False,True,False,False,False,False,False,False,False,False,Night,Night,Night,Night
C-3080271,2,2021-02-22 05:30:00,2021-02-22 17:33:27,33.58208,-111.927778,33.582747,-111.925925,0.11619108713,Stationary traffic from N 71st Pl to E Sahuaro Dr due to roadwork.,7101.0,E Shea Blvd,R,Scottsdale,Maricopa,AZ,85254-5251,US,US/Mountain,KSDL,2021-02-22 05:53:00,43.0,43.0,40.0,28.58,10.0,CALM,0.0,0.0,Fair,False,False,True,False,False,False,False,False,False,False,False,True,False,Night,Night,Night,Night
C-3080272,2,2021-11-12 17:38:00,2021-11-12 19:39:57,45.433199,-122.567321,45.433284,-122.564179,0.15245493271,Stationary traffic from OR-213/SE 82nd Ave/Cascade Hwy (SE Sunnyside Rd) to SE Sunnybrook Blvd (SE Sunnyside Rd) due to roadwork.,,SE Sunnyside Rd,R,Clackamas,Clackamas,OR,97015,US,US/Pacific,KTTD,2021-11-12 17:53:00,61.0,61.0,81.0,30.2,10.0,CALM,0.0,0.0,Cloudy,False,False,True,True,False,False,False,False,False,False,False,True,False,Night,Night,Day,Day
C-3080273,2,2020-10-10 06:29:34,2020-10-10 15:14:34,45.521732,-122.665497,45.529242,-122.665167,0.519137403533,Construction on I-5 NB near MP 301 Allow extra time.,,I-5 N,R,Portland,Multnomah,OR,97214,US,US/Pacific,KPDX,2020-10-10 06:53:00,59.0,59.0,90.0,29.65,10.0,S,9.0,0.02,Light Rain,False,False,False,False,False,False,False,False,False,False,False,False,False,Night,Night,Day,Day
