ID,Severity,Start_Time,End_Time,Start_Lat,Start_Lng,End_Lat,End_Lng,Distance(mi),Description,Number,Street,Side,City,County,State,Zipcode,Country,Timezone,Airport_Code,Weather_Timestamp,Temperature(F),Wind_Chill(F),Humidity(%),Pressure(in),Visibility(mi),Wind_Direction,Wind_Speed(mph),Precipitation(in),Weather_Condition,Amenity,Bump,Crossing,Give_Way,Junction,No_Exit,Railway,Roundabout,Station,Stop,Traffic_Calming,Traffic_Signal,Turning_Loop,Sunrise_Sunset,Civil_Twilight,Nautical_Twilight,Astronomical_Twilight
C-1771033,2,2020-09-01 14:16:00,2020-09-01 17:25:23,48.843297,-122.289486,48.79460200000001,-122.415041,6.6292290246500025,On SR 542 eastbound &amp; westbound at Noon Rd (MP 3) to Putnam Rd (MP 10) all lanes are affected by a maintenance operation.,3685.0,Mt Baker Hwy,R,Everson,Whatcom,WA,98247-9405,US,US/Pacific,KBLI,2020-09-01 13:53:00,72.0,72.0,55.0,29.99,10.0,VAR,5.0,0.0,Fair,False,False,False,False,False,False,False,False,False,False,False,False,False,Day,Day,Day,Day
C-1771034,2,2021-08-28 03:16:30,2021-08-28 03:52:30,38.77395900000001,-90.320438,38.772289,-90.304168,0.8839860164450001,Slow traffic on I-270 E from Graham Rd/Hanley Rd/Exit 26 (I-270) to N Elizabeth Ave/Washington St/Exit 28 (I-270) due to roadwork.,,I-270 E,R,Florissant,St. Louis County,MO,63031,US,US/Central,KSTL,2021-08-28 02:51:00,81.0,81.0,69.0,29.41,10.0,S,8.0,0.0,Fair,False,False,False,False,False,False,False,False,False,False,False,False,False,Night,Night,Night,Night
C-1771035,2,2021-07-24 13:06:00,2021-07-24 15:34:14,33.463597,-112.392392,33.464788,-112.393118,0.092319115962,Stationary traffic from I-10 W to N 159th Ave due to roadwork.,1463.0,N Estrella Pkwy,R,Goodyear,Maricopa,AZ,85395,US,US/Mountain,KLUF,2021-07-24 12:56:00,81.0,81.0,73.0,28.87,10.0,SE,9.0,0.0,Mostly Cloudy,True,False,False,False,False,False,False,False,True,False,False,False,False,Day,Day,Day,Day
C-1771037,2,2020-09-01 22:31:00,2020-09-02 02:29:00,33.672136,-112.001924,33.672694,-112.03091299999998,1.66734244582,Stationary traffic on AZ-101 from Tatum Blvd/Exit 31 (Pima Fwy/AZ-101) to Cave Creek Rd/N 28th St/Exit 28 (Pima Fwy/AZ-101) due to roadwork.,,AZ-101 Loop W,R,Phoenix,Maricopa,AZ,85050,US,US/Mountain,KDVT,2020-09-01 22:53:00,91.0,91.0,41.0,28.24,10.0,SW,13.0,0.0,Fair,False,False,True,False,False,False,False,False,False,False,False,True,False,Night,Night,Night,Night
C-1771038,2,2021-10-22 15:45:00,2021-10-22 16:18:30,33.480453999999995,-112.005694,33.480483,-112.012917,0.4162592302319999,Slow traffic from N 40th St (E Thomas Rd) to N 32nd St (E Thomas Rd) due to roadwork.,3511.0,E Thomas Rd,R,Phoenix,Maricopa,AZ,85018-7411,US,US/Mountain,KPHX,2021-10-22 15:51:00,87.0,87.0,16.0,28.66,10.0,WNW,8.0,0.0,Mostly Cloudy,False,False,True,False,False,False,False,False,False,False,False,True,False,Day,Day,Day,Day
C-1771039,2,2020-12-24 13:39:00,2020-12-24 19:01:25,28.523683,-81.330954,28.524251,-81.331852,0.0671715468433,Slow traffic on FL-15 - FL-552 from Derbyshire Ln to Edmundshire Rd due to roadwork.,1615.0,S Conway Rd,L,Orlando,Orange,FL,32812-2746,US,US/Eastern,KORL,2020-12-24 13:53:00,80.0,80.0,60.0,29.75,10.0,SSW,21.0,0.0,Fair / Windy,False,False,True,False,False,False,False,False,False,False,False,False,False,Day,Day,Day,Day
C-1771040,4,2020-02-28 12:45:15,2021-02-23 10:43:14,40.262522,-74.846698,40.256306,-74.843722,0.4572522274600001,Closed road at NJ-29 due to roadwork.,,NJ-29,R,Trenton,Mercer,NJ,08628,US,US/Eastern,KTTN,2020-02-28 12:53:00,39.0,30.0,41.0,29.59,10.0,WSW,17.0,0.0,Cloudy,False,False,False,False,True,False,False,False,False,False,False,False,False,Day,Day,Day,Day
C-1771041,2,2021-11-22 13:03:30,2021-11-22 13:31:30,32.933240000000005,-97.310042,32.933383,-97.314927,0.28345524855,Slow traffic on FM-1709 from Alta Vista Rd (Golden Triangle Blvd) to I-35W/North Fwy (Golden Triangle Blvd) due to roadwork.,3375.0,Golden Triangle Blvd,R,Fort Worth,Tarrant,TX,76177,US,US/Central,KAFW,2021-11-22 12:53:00,63.0,63.0,30.0,29.54,10.0,VAR,3.0,0.0,Fair,False,False,False,False,False,False,False,False,False,False,False,True,False,Day,Day,Day,Day
C-1771042,2,2021-07-30 18:09:45,2021-07-30 18:29:45,40.703302,-73.79609599999998,40.701858,-73.802391,0.344496384718,Slow traffic from Guy R Brewer Blvd to 158th St due to roadwork.,16300.0,Archer Ave,R,Jamaica,Queens,NY,11433,US,US/Eastern,KJFK,2021-07-30 17:51:00,82.0,82.0,34.0,29.81,10.0,NW,22.0,0.0,Fair / Windy,True,False,True,False,False,False,True,False,True,False,False,True,False,Day,Day,Day,Day
C-1771043,2,2021-12-27 10:18:30,2021-12-27 12:24:23,39.465285,-119.783418,39.467958,-119.785758,0.222908016043,Stationary traffic on NV-667 from Sierra Center Pkwy to Martin Luther King Jr Memorial Fwy due to roadwork.,6798.0,S Virginia St,L,Reno,Washoe,NV,89511-1106,US,US/Pacific,KRNO,2021-12-27 09:55:00,33.0,24.0,70.0,25.21,8.0,W,13.0,0.0,Light Snow,False,False,False,False,False,False,False,False,False,False,False,True,False,Day,Day,Day,Day
C-1771044,2,2020-03-09 05:54:42,2020-03-13 23:59:00,38.07478,-83.918739,,,0.0,Intermittent lane closures due to new traffic signals on KY-686 Indian Mound Dr both ways between US-460 Maysville Rd and US-60 Owingsville Rd.,2535.0,Owingsville Rd,L,Mount Sterling,Montgomery,KY,40353-9133,US,US/Eastern,KIOB,2020-03-09 05:55:00,48.0,44.0,46.0,29.31,10.0,SW,10.0,0.0,Fair,False,False,False,False,False,False,False,False,False,False,False,False,False,Night,Night,Night,Night
C-1771045,4,2020-05-13 05:24:59,2020-05-13 17:41:52,40.83994000000001,-73.92926,40.82601,-73.93121,0.967854853033,Between 179th St/Exit 8 and 155th St/Macombs Dam Brg/Exit 5 - Roadwork. Two lanes closed.,,Major Deegan Expy S,R,Bronx,Bronx,NY,10452,US,US/Eastern,KLGA,2020-05-13 05:51:00,43.0,36.0,49.0,30.25,10.0,NW,14.0,0.0,Fair,False,False,False,False,False,False,False,False,False,True,False,False,False,Night,Day,Day,Day
C-1771047,2,2021-08-20 06:00:00,2021-08-20 19:00:00,43.442033,-93.517322,43.496927,-93.497338,3.922957517850002,Lane closed on US-69 S - US-69 N from CR-R74/Main St (US-69) to CR-A14 (US-69) due to roadwork.,46818.0,Highway 69,L,Lake Mills,Winnebago,IA,50450,US,US/Central,KFXY,2021-08-20 05:55:00,64.0,64.0,94.0,28.61,7.0,SSE,5.0,0.0,Fair,False,False,False,False,False,False,False,False,False,False,False,False,False,Night,Day,Day,Day
C-1771048,2,2020-09-18 17:12:00,2020-09-18 18:50:30,28.800168,-82.576382,28.80557,-82.576431,0.373254442729,Slow traffic on US-98 from W Cardinal St (US-98) to CR-490/W Homosassa Trl (US-98) due to roadwork.,4247.0,S Suncoast Blvd,L,Homosassa,Citrus,FL,34446-1105,US,US/Eastern,KCGC,2020-09-18 17:15:00,84.0,84.0,70.0,29.86,10.0,W,10.0,0.0,Mostly Cloudy,False,False,False,False,False,False,False,False,False,False,False,True,False,Day,Day,Day,Day
C-1771049,2,2021-01-19 17:14:00,2021-01-19 23:45:00,40.730942,-74.125388,40.752942,-74.111558,1.6836646154,Roadwork on New Jersey Turnpike - Eastern Spur Northbound between Interchange 17E - NJ 3/Lincoln Tunnel (Secaucus) and South of Northern Mixing Bowl (Ridgefield) 1 left lane closed until 3:00 P.M.,,New Jersey Tpke N,R,Newark,Essex,NJ,07105,US,US/Eastern,KEWR,2021-01-19 16:51:00,39.0,31.0,55.0,30.06,10.0,W,14.0,0.0,Partly Cloudy,False,False,False,False,False,False,False,False,False,False,False,False,False,Night,Day,Day,Day
C-1771050,2,2020-12-18 15:37:00,2020-12-18 19:49:30,40.754097,-73.97834300000002,40.758466,-73.975101,0.346288908635,Slow traffic from E 42nd St (Madison Ave) to E 57th St (Madison Ave) due to roadwork.,339.0,Madison Ave,R,New York,New York,NY,10017-4610,US,US/Eastern,KNYC,2020-12-18 15:51:00,32.0,27.0,52.0,30.19,10.0,VAR,5.0,0.0,Cloudy,False,False,True,False,False,False,False,False,False,False,False,True,False,Day,Day,Day,Day
C-1771051,4,2020-04-27 14:28:00,2020-10-01 06:59:00,39.644631,-99.778024,39.653901,-99.703155,4.03416330421,Road KS-9 is closed from US-283 (Lenora) (East) (KS-9) to 1st St/Douglas St (KS-9) due to roadwork.,,Road E6,R,Lenora,Norton,KS,67645,US,US/Central,KHLC,2020-04-27 14:53:00,83.0,83.0,21.0,27.56,10.0,CALM,0.0,0.0,Fair,False,False,False,False,False,False,False,False,False,True,False,False,False,Day,Day,Day,Day
C-1771052,4,2017-11-07 19:02:01,2017-11-08 01:02:01,41.581826,-87.682008,41.57929,-87.67671999999996,0.324648291052,Closed at I-294/Tri-State Toll/Exit 155 - Closed due to roadwork.,,I-80 E,R,Hazel Crest,Cook,IL,60429,US,US/Central,KIGQ,2017-11-07 18:55:00,42.4,37.5,78.0,30.32,10.0,North,8.1,,Mostly Cloudy,False,False,False,False,False,False,False,False,False,False,False,False,False,Night,Night,Night,Night
C-1771053,2,2021-02-28 19:00:00,2021-12-30 20:11:52,27.287841,-80.296284,27.286338,-80.297329,0.12207297418,Slow traffic on US-1 S - FL-5 from SE Hillmoor Dr to US-1 due to roadwork.,1713.0,SE Tiffany Ave,L,Port Saint Lucie,St. Lucie,FL,34952-7520,US,US/Eastern,KSUA,2021-08-18 16:47:00,88.0,88.0,66.0,30.1,7.0,ESE,12.0,0.0,Partly Cloudy,False,False,False,False,False,False,False,False,False,False,False,False,False,Night,Night,Day,Day
C-1771054,3,2021-09-28 03:42:22,2021-09-28 05:01:00,33.788990000000005,-117.886436,,,0.509999990463,Exit ramp from I-5 Northbound at Exits 107B 107C 109 109A 109B to W Chapman Ave closed due to construction work.,,I-5 N,R,Orange,Orange,CA,92868,US,US/Pacific,KSNA,2021-09-28 03:53:00,67.0,67.0,70.0,29.88,10.0,CALM,0.0,0.0,Cloudy,False,False,False,False,False,False,False,False,False,False,False,False,False,Night,Night,Night,Night
C-1771055,2,2020-05-14 07:08:00,2020-05-14 15:59:59,40.66344,-74.2506,40.66391,-74.24689000000002,0.197136579882,At RT-439/Elmora Ave - Roadwork. Right lane closed.,398.0,E Westfield Ave,R,Roselle Park,Union,NJ,07204-2345,US,US/Eastern,KLDJ,2020-05-14 07:15:00,48.0,48.0,50.0,30.32,10.0,CALM,0.0,0.0,Fair,False,False,False,False,False,False,False,False,False,False,False,True,False,Day,Day,Day,Day
C-1771056,2,2021-12-04 20:27:30,2021-12-04 20:47:30,26.93574000000001,-80.081781,26.94426,-80.084501,0.612053044193,Stationary traffic on US-1 N - FL-5 from FL-706/E Indiantown Rd (FL-A1A/US-1) to FL-A1A/Ocean Blvd (FL-A1A/US-1) due to roadwork.,373.0,N US Highway 1,L,Jupiter,Palm Beach,FL,33477,US,US/Eastern,KPBI,2021-12-04 20:53:00,68.0,68.0,84.0,30.14,10.0,CALM,0.0,0.0,Cloudy,False,False,True,False,False,False,False,False,False,False,False,True,False,Night,Night,Night,Night
C-1771057,2,2020-09-16 15:37:05,2020-09-17 16:29:04,39.215975,-76.668937,39.214579,-76.673019,0.238858245886,Construction on MD-295 SB near W NURSERY RD Expect delays.,,Baltimore Washington Pkwy S,R,Linthicum Heights,Anne Arundel,MD,21090,US,US/Eastern,KBWI,2020-09-16 15:54:00,73.0,73.0,49.0,29.99,10.0,SSW,8.0,0.0,Mostly Cloudy,False,False,False,False,False,False,False,False,False,False,False,False,False,Day,Day,Day,Day
C-1771058,2,2021-05-27 13:09:30,2021-11-18 18:48:51,41.01841,-89.056516,40.97104,-89.056576,3.2729567797099994,Stationary traffic on US-51 S - I-39 S from IL-17/Exit 35 (I-39) to CR-2200/CR-2/Exit 27 (I-39) due to roadwork.,,I-39 S,R,Rutland,Marshall,IL,61358,US,US/Central,KC75,2021-05-27 13:15:00,69.0,69.0,68.0,29.33,10.0,ESE,10.0,0.0,Light Rain,False,False,False,False,False,False,False,False,False,False,False,False,False,Day,Day,Day,Day
C-1771059,2,2021-01-21 15:52:00,2021-01-22 00:15:00,38.825899,-77.722774,38.826775,-77.72915,0.348498530602,On VA-55 (John Marshall Hwy) in the County of Fauquier from Obannon Rd; Rt. 698N/S (Fauquier County) to Bust Head Rd; Trapp Branch Rd; Rt. 628N/S (Fauquier County) motorists can expect potential delays in this area from 01/21/21 at 7:52 AM until 01/21/21 at 3:30 PM due to roadside maintenance. The east through lanes are alternating closures. The west through lanes are alternating closures.,5198.0,Bust Head Rd,R,Broad Run,Fauquier,VA,20137,US,US/Eastern,KHEF,2021-01-21 15:56:00,55.0,55.0,33.0,29.45,10.0,W,10.0,0.0,Fair,False,False,False,False,False,False,False,False,False,False,False,False,False,Day,Day,Day,Day
C-1771060,2,2019-07-08 00:00:00,2019-07-13 00:00:00,41.26278,-84.271637,41.26249,-84.26929,0.1235323092579999,At state Route 281 - Roadwork.,28788.0,State Route 18,L,Defiance,Defiance,OH,43512-8959,US,US/Eastern,KDFI,2019-07-08 00:53:00,71.0,71.0,68.0,29.25,10.0,N,7.0,0.0,Fair,False,False,False,False,False,False,False,False,False,False,False,False,False,Night,Night,Night,Night
C-1771061,2,2021-08-22 12:49:20,2021-08-22 13:03:08,42.140642,-86.368521,42.130188,-86.374826,0.791253386935,Slow traffic on US-31 S - I-196 W from exit [1] to I-94 Bus Loop exit [33] due to roadwork.,,I-196 W,R,Benton Harbor,Berrien,MI,49022,US,US/Eastern,KBEH,2021-08-22 12:53:00,80.0,80.0,71.0,29.3,10.0,VAR,5.0,0.0,Fair,False,False,False,False,False,False,False,False,False,False,False,False,False,Day,Day,Day,Day
C-1771062,2,2021-02-06 04:59:00,2021-02-06 06:41:30,35.807194,-90.675621,35.807316,-90.701574,1.45427624365,Slow traffic on US-49 S - Joe N Martin Expy W - I-555 N - US-63 N from Stadium Blvd (US-63) to AR-1 Bus (US-63) due to roadwork.,,I-555 N,R,Jonesboro,Craighead,AR,72401,US,US/Central,KJBR,2021-02-06 04:53:00,37.0,37.0,79.0,29.71,10.0,CALM,0.0,0.0,Fair,False,False,False,False,True,False,False,False,False,False,False,False,False,Night,Night,Night,Night
C-1771063,2,2021-09-26 18:06:30,2021-09-26 18:27:00,33.494248,-112.245874,33.494273,-112.237742,0.468567745351,Slow traffic from N 91st Ave (W Indian School Rd) to N 83rd Ave (W Indian School Rd) due to roadwork.,8677.0,W Indian School Rd,L,Phoenix,Maricopa,AZ,85037,US,US/Mountain,KGEU,2021-09-26 17:58:00,70.0,70.0,91.0,28.79,10.0,NNE,7.0,0.0,Fair,False,False,True,False,False,False,False,False,True,False,False,True,False,Day,Day,Day,Day
C-1771064,2,2020-07-20 15:24:30,2020-07-22 00:22:37,43.308055,-73.642638,43.307408,-73.642186,0.0501482944548999,Bridge work on US 9 both directions north of City of Glens Falls; Town of Moreau Line; Saratoga-Warren County Line (Moreau) Not currently scheduled,66.0,Glen St,L,Glens Falls,Warren,NY,12801-4433,US,US/Eastern,KGFL,2020-07-20 15:53:00,89.0,89.0,42.0,29.45,10.0,VAR,7.0,0.0,Cloudy,False,False,False,False,False,False,False,False,False,False,False,True,False,Day,Day,Day,Day
C-1771065,2,2021-07-03 13:37:51,2021-07-03 13:49:07,39.379201,-77.407418,39.38969,-77.416475,0.871295246003,Slow traffic on I-270 N - Dwight D Eisenhower Hwy N from MD-80/Exit 26 (I-270) to I-70/US-40 (I-270) due to roadwork.,,Dwight D Eisenhower Hwy N,R,Frederick,Frederick,MD,21704,US,US/Eastern,KFDK,2021-07-03 13:47:00,75.0,75.0,53.0,29.49,10.0,NW,12.0,0.0,Cloudy,False,False,False,False,True,False,False,False,False,False,False,False,False,Day,Day,Day,Day
C-1771066,4,2019-06-24 04:22:24,2019-06-24 09:07:01,29.73286,-95.37476,29.75048,-95.35768,1.59124306362,Between Fannin St and I-45 - Roadwork.,,US-59 N,R,Houston,Harris,TX,77004,US,US/Central,KMCJ,2019-06-24 03:53:00,83.0,83.0,85.0,29.8,9.0,S,8.0,0.0,Mostly Cloudy,False,False,False,False,True,False,False,False,False,False,False,False,False,Night,Night,Night,Night
C-1771067,2,2018-12-03 07:01:47,2018-12-07 07:01:25,41.83572,-71.57604,41.82964000000001,-71.52003,2.91390289347,Between Danielson Pike and I-295 - Construction work. Lane blocked.,84.0,Hartford Ave,R,North Scituate,Providence,RI,02857-1853,US,US/Eastern,KSFZ,2018-12-03 06:56:00,48.9,,100.0,29.39,10.0,West,8.1,,Overcast,False,False,False,False,False,False,False,False,False,False,False,False,False,Day,Day,Day,Day
C-1771068,2,2021-06-27 08:00:00,2021-06-27 17:38:00,38.0888,-77.525759,38.090026,-77.526065,0.0863274779034,On Rt. 605 (Paige Rd) in the County of Caroline from Jefferson Davis Hwy; Marye Rd; US-1N/S to S River Rd; Rt. 638N/S (Caroline County) motorists can expect potential delays in this area from 06/27/21 at 8:00 AM until 06/27/21 at 5:38 PM due to paving operations. The east through lanes are alternating closures. The west through lanes are alternating closures.,12672.0,Jefferson Davis Hwy,R,Woodford,Caroline,VA,22580-2204,US,US/Eastern,KEZF,2021-06-27 07:55:00,76.0,76.0,89.0,30.1,10.0,S,8.0,0.0,Cloudy,False,False,False,False,False,False,False,False,False,False,False,False,False,Day,Day,Day,Day
C-1771069,2,2021-02-02 04:10:57,2021-02-02 17:00:00,40.117149,-76.533363,,,3.7300000190699993,Lane closed due to construction work on PA-230 Main St both ways between Ridge Run Rd and Snyder Rd.,100.0,Snyder Rd,L,Mount Joy,Lancaster,PA,17552-8542,US,US/Eastern,KLNS,2021-02-02 03:53:00,31.0,21.0,76.0,29.16,6.0,NNW,13.0,0.0,Light Snow,False,False,False,False,False,False,False,False,False,False,False,False,False,Night,Night,Night,Night
C-1771070,2,2020-11-01 23:27:00,2020-11-01 23:39:30,41.357435,-88.191866,41.373192,-88.192298,1.08893545782,Slow traffic on I-55 from River Rd/Exit 241 (I-55) to Arsenal Rd/Exit 245 (I-55) due to roadwork.,,I-55 N,R,Wilmington,Will,IL,60481,US,US/Central,KJOT,2020-11-01 23:35:00,29.0,29.0,68.0,29.79,10.0,CALM,0.0,0.0,Fair,False,False,False,False,True,False,False,False,False,False,False,False,False,Night,Night,Night,Night
C-1771071,2,2021-01-25 13:59:30,2021-01-26 01:05:38,33.50922,-112.049705,33.510042,-112.047524,0.137886573676,Stationary traffic from N 15th St to E Medlock Dr due to roadwork.,4999.0,N 15th St,R,Phoenix,Maricopa,AZ,85014,US,US/Mountain,KPHX,2021-01-25 14:03:00,43.0,32.0,86.0,28.54,1.0,W,32.0,0.06,T-Storm / Windy,False,False,False,False,False,False,False,False,False,True,False,False,False,Day,Day,Day,Day
C-1771072,4,2018-10-03 01:59:54,2018-10-03 06:59:23,39.044943,-94.43376,39.047523,-94.43365,0.178358721527,Closed at 35th St S - Closed due to roadwork.,4199.0,S Crysler Ave,L,Independence,Jackson,MO,64055-4403,US,US/Central,KLXT,2018-10-03 01:53:00,73.0,,87.0,29.91,10.0,SSW,13.8,,Clear,False,False,False,False,False,False,False,False,False,False,False,False,False,Night,Night,Night,Night
C-1771073,2,2019-12-12 16:30:00,2020-07-31 12:45:00,33.685661,-112.117415,33.685656,-112.119571,0.123953555042,Construction on LOUISE DR near W LOUISE DR Allow extra time.,21898.0,N 27th Ave,R,Phoenix,Maricopa,AZ,85027-1842,US,US/Mountain,KDVT,2019-12-12 16:53:00,63.0,63.0,46.0,28.53,10.0,CALM,0.0,0.0,Fair,False,False,False,False,False,False,False,False,False,True,False,False,False,Day,Day,Day,Day
C-1771074,2,2021-09-25 17:09:08,2021-09-25 19:11:01,40.757899,-73.991389,40.75792,-73.989316,0.108503325922,Slow traffic from 9th Ave to W 43rd St due to roadwork.,332.0,W 42nd St,L,New York,New York,NY,10036-6974,US,US/Eastern,KNYC,2021-09-25 16:51:00,73.0,,46.0,29.83,10.0,,,0.0,Fair,True,False,True,False,False,False,True,False,True,False,False,True,False,Day,Day,Day,Day
C-1771075,3,2021-09-27 02:14:28,2021-09-27 04:59:00,33.961220000000004,-118.281853,,,0.310000002384,Entry ramp to I-110 Southbound from W Manchester Ave Westbound closed due to electricity work.,8500.0,S Figueroa St,L,Los Angeles,Los Angeles,CA,90003-2752,US,US/Pacific,KHHR,2021-09-27 01:53:00,65.0,65.0,75.0,29.96,10.0,CALM,0.0,0.0,Cloudy,False,False,False,False,False,False,False,False,False,False,False,False,False,Night,Night,Night,Night
C-1771076,4,2016-11-28 05:55:11,2016-11-28 11:55:11,32.630227000000005,-116.458603,32.608374,-116.474131,1.75965644592,Closed between Sheridan Rd and Forest Gate Rd - Closed due to roadwork.,32052.0,Highway 94,R,Campo,San Diego,CA,91906-3106,US,US/Pacific,KCZZ,2016-11-28 05:52:00,46.0,43.1,89.0,29.92,,West,5.8,,,False,False,True,False,False,False,True,False,True,False,False,False,False,Night,Night,Day,Day
C-1771077,2,2021-11-29 18:02:00,2021-11-29 18:22:00,31.551531,-97.115727,31.553839,-97.120597,0.328099159848,Stationary traffic on FM-434 from Baylor Ave to I-35 N due to roadwork.,1276.0,S University Parks Dr,L,Waco,McLennan,TX,76706-1219,US,US/Central,KCNW,2021-11-29 17:55:00,63.0,63.0,45.0,29.59,10.0,SSE,7.0,,Fair,False,False,False,False,False,False,False,False,False,False,False,True,False,Night,Night,Day,Day
C-1771078,2,2021-06-09 14:18:31,2021-06-09 15:10:24,47.443938,-101.780134,47.470948,-101.779941,1.86623504235,Stationary traffic on ND-1806 from Highway 1806 / 2nd St NW to 4th St NW due to roadwork.,,2nd St NW,R,Hazen,Mercer,ND,58545,US,US/Central,KHZE,2021-06-09 14:15:00,82.0,82.0,58.0,28.04,10.0,NW,5.0,0.0,Fair,False,False,False,False,False,False,False,False,False,True,False,False,False,Day,Day,Day,Night
C-1771079,2,2021-11-06 14:13:45,2021-11-06 16:15:51,33.582115,-84.376835,33.58275,-84.377996,0.0799437033058,Slow traffic from Old Dixie Hwy to Lees Mill Rd due to roadwork.,6336.0,Tara Blvd,L,Jonesboro,Clayton,GA,30236-1224,US,US/Eastern,KATL,2021-11-06 13:52:00,57.0,57.0,32.0,29.08,10.0,N,8.0,0.0,Mostly Cloudy,False,False,True,False,False,False,False,False,False,False,False,True,False,Day,Day,Day,Day
C-1771080,2,2021-05-24 05:22:30,2021-05-24 11:06:06,26.724753000000003,-80.068359,26.724689,-80.065862,0.154160004893,Slow traffic from 7th St/N Mangonia Dr (Palm Beach Lakes Blvd) to US-1/FL-5/N Dixie Hwy (Palm Beach Lakes Blvd) due to roadwork.,,Palm Beach Lakes Blvd,R,West Palm Beach,Palm Beach,FL,33401,US,US/Eastern,KPBI,2021-05-24 04:53:00,74.0,74.0,64.0,30.12,10.0,E,7.0,0.0,Fair,False,False,False,False,False,False,False,False,False,False,False,False,False,Night,Night,Night,Day
C-1771081,2,2021-04-28 00:00:00,2021-04-30 00:44:00,41.081763,-81.52041700000002,41.082655,-81.520606,0.0624124127450999,Construction on QUAKER ST near W BOWERY ST Allow extra time.,173.0,Quaker St,R,Akron,Summit,OH,44308,US,US/Eastern,KAKR,2021-04-28 00:54:00,66.0,66.0,52.0,28.77,10.0,SSW,8.0,0.0,Fair,False,False,True,False,False,False,False,False,False,False,False,False,False,Night,Night,Night,Night
C-1771082,2,2021-12-12 13:18:24,2021-12-12 15:20:46,40.756644,-73.874502,40.756887,-73.872209,0.1211784975679999,Stationary traffic on NY-25A from 82nd St (Northern Blvd/NY-25A) to 108th St (Northern Blvd/NY-25A) due to roadwork.,9302.0,Northern Blvd,R,Jackson Heights,Queens,NY,11372,US,US/Eastern,KLGA,2021-12-12 12:51:00,48.0,42.0,30.0,30.11,10.0,NW,16.0,0.0,Fair,True,False,False,False,False,False,False,False,True,False,False,True,False,Day,Day,Day,Day
C-1771083,2,2021-06-25 15:16:17,2021-06-25 16:39:14,37.282045,-99.135926,37.281615,-99.168133,1.77083738083,Slow traffic on US-160 W - US-160 E from Sun City Rd (US-160) to Wilmore County Rd (US-160) due to roadwork.,2363.0,Highway 160,L,Wilmore,Comanche,KS,67155,US,US/Central,KP28,2021-06-25 14:56:00,96.0,96.0,41.0,28.12,,S,9.0,0.0,,False,False,False,False,False,False,False,False,False,False,False,False,False,Day,Day,Day,Day
C-1771084,2,2017-10-16 18:40:10,2017-10-17 01:00:00,38.99376,-75.4522,38.943774,-75.427099,3.70759730039,Between Frederica Rd and Tub Mill Pond Rd - Construction work.,,Bay Rd,R,Milford,Kent,DE,19963,US,US/Eastern,KDOV,2017-10-16 18:58:00,53.2,,67.0,30.13,10.0,NW,6.9,,Clear,False,False,False,False,False,False,False,False,False,False,False,False,False,Night,Day,Day,Day
C-1771085,2,2021-01-27 13:35:00,2021-01-28 05:09:26,25.771672,-80.26446,25.772935,-80.263644,0.1009602787219999,Slow traffic on FL-968 - FL-953 from NW 43rd Ave / SW 43rd Ave to NW 2nd St due to roadwork.,4236.0,W Flagler St,R,Coral Gables,Miami-Dade,FL,33134-1606,US,US/Eastern,KMIA,2021-01-27 13:53:00,84.0,84.0,53.0,30.02,10.0,W,9.0,0.0,Partly Cloudy,False,False,True,False,False,False,False,False,False,False,False,True,False,Day,Day,Day,Day
C-1771086,2,2020-09-27 03:46:00,2020-09-27 04:06:00,40.679463,-73.820849,40.67700900000001,-73.819645,0.180912023147,Slow traffic from Liberty Ave (Lefferts Blvd) to Rockaway Blvd (Lefferts Blvd) due to resurfacing work.,11185.0,Lefferts Blvd,L,South Ozone Park,Queens,NY,11420,US,US/Eastern,KJFK,2020-09-27 03:51:00,67.0,67.0,97.0,30.0,10.0,CALM,0.0,0.0,Cloudy,False,False,False,False,False,False,False,False,False,False,False,True,False,Night,Night,Night,Night
C-1771087,2,2020-07-23 14:00:00,2020-07-23 23:46:00,37.053186,-122.073319,37.025495,-122.05926200000002,2.06437161245,Construction on CA-9 SB near GLENGARRY RD Expect long delays.,6315.0,Highway 9,L,Felton,Santa Cruz,CA,95018-9763,US,US/Pacific,KWVI,2020-07-23 13:53:00,66.0,66.0,68.0,29.79,10.0,SW,7.0,0.0,Fair,True,False,True,False,False,False,False,False,False,False,False,True,False,Day,Day,Day,Day
C-1771088,2,2020-11-03 17:39:55,2020-11-04 21:49:30,40.002573,-75.22362,39.9986,-75.23206400000002,0.524497037235,Stationary traffic on US-1 from Belmont Ave (E City Ave/US-1) to 54th St (Bala Cynwyd) (East) (W City Ave/US-1) due to roadwork.,77.0,E City Ave,R,Bala Cynwyd,Montgomery,PA,19004-2421,US,US/Eastern,KLOM,2020-11-03 17:35:00,47.0,47.0,67.0,29.84,10.0,CALM,0.0,0.0,Fair,False,False,True,False,False,False,False,False,False,True,False,True,False,Night,Night,Day,Day
C-1771089,3,2021-07-08 03:41:30,2021-07-08 04:59:00,34.16198,-118.470993,,,0.430000007153,Exit ramp from I-405 Southbound to US-101 Southbound closed due to construction work.,,US-101 N,R,Sherman Oaks,Los Angeles,CA,91403,US,US/Pacific,KVNY,2021-07-08 03:51:00,69.0,69.0,73.0,28.97,10.0,ESE,6.0,0.0,Fair,False,False,False,False,False,False,False,False,False,False,False,False,False,Night,Night,Night,Night
C-1771090,2,2019-06-28 05:21:27,2019-07-05 23:58:00,41.499722,-81.624573,,,0.0,Restrictions due to maintenance work on 89th St Northbound between Quincy Ave and Cedar Ave.,8800.0,Cedar Ave,R,Cleveland,Cuyahoga,OH,44106-2964,US,US/Eastern,KBKL,2019-06-28 04:53:00,71.0,71.0,81.0,29.51,10.0,SSE,8.0,0.0,Fair,False,False,True,False,False,False,False,False,False,False,False,True,False,Night,Night,Day,Day
C-1771091,2,2021-07-27 04:09:00,2021-07-27 16:00:00,35.243851,-86.033752,,,3.67000007629,Lane closed due to bridge maintenance work on US-64 David Crockett Pkwy both ways from Greenhaw Rd to Mantooth Rd.,,TN-50,R,Decherd,Franklin,TN,37324,US,US/Eastern,KBGF,2021-07-27 04:15:00,72.0,72.0,94.0,28.95,7.0,CALM,0.0,0.0,Fair,False,False,False,False,False,False,False,False,False,False,False,False,False,Night,Night,Night,Night
