ID,Severity,Start_Time,End_Time,Start_Lat,Start_Lng,End_Lat,End_Lng,Distance(mi),Description,Number,Street,Side,City,County,State,Zipcode,Country,Timezone,Airport_Code,Weather_Timestamp,Temperature(F),Wind_Chill(F),Humidity(%),Pressure(in),Visibility(mi),Wind_Direction,Wind_Speed(mph),Precipitation(in),Weather_Condition,Amenity,Bump,Crossing,Give_Way,Junction,No_Exit,Railway,Roundabout,Station,Stop,Traffic_Calming,Traffic_Signal,Turning_Loop,Sunrise_Sunset,Civil_Twilight,Nautical_Twilight,Astronomical_Twilight
C-1681304,2,2019-01-28 08:01:30,2019-02-01 08:01:04,42.56259,-83.1581,42.56583,-83.15856,0.225083252451,Ramp to I-75 Northbound - Roadwork.,,Chrysler Expy N,R,Troy,Oakland,MI,48084,US,US/Eastern,KVLL,2019-01-28 07:55:00,10.4,-4.1,61.0,29.95,10.0,East,11.5,,Overcast,False,False,False,False,False,False,False,False,False,False,False,False,False,Day,Day,Day,Day
C-1681305,4,2020-06-01 07:11:42,2020-06-01 09:10:23,39.66174,-84.09964000000002,39.65822,-84.103,0.301815040419,At Wilmington Pike/Exit 7 - Roadwork.,,I-675 S,R,Dayton,Greene,OH,45440,US,US/Eastern,KMGY,2020-06-01 06:53:00,46.0,46.0,83.0,29.29,10.0,E,3.0,0.0,Fair,False,False,False,False,False,False,False,False,False,False,False,False,False,Day,Day,Day,Day
C-1681306,2,2021-04-26 16:30:30,2021-04-26 17:06:30,37.908636,-96.815482,37.88104600000001,-96.842742,2.41725441726,Stationary traffic on Kansas Tpke S - I-35 S from KS-177/Exit 92 (I-35) to US-77/Exit 76 (I-35) due to roadwork.,,I-35 S,R,El Dorado,Butler,KS,67042,US,US/Central,KAAO,2021-04-26 16:54:00,78.0,78.0,48.0,28.09,10.0,S,26.0,0.0,Fair / Windy,False,False,False,False,False,False,False,False,False,False,False,False,False,Day,Day,Day,Day
C-1681307,3,2021-05-25 20:00:00,2021-05-26 06:00:00,32.97795900000001,-97.036636,,,0.0,Road closed due to construction work on TX-121 Northbound from Bass Pro to FM-2499 Grapevine Mills Pkwy. Detour in operation - Traffic will be detoured to I635 then to Royal Lane..,3559.0,Grapevine Mills Pkwy,R,Grapevine,Tarrant,TX,76051-2045,US,US/Central,KDFW,2021-05-25 19:53:00,77.0,77.0,71.0,29.32,10.0,SE,10.0,0.0,Partly Cloudy,False,False,False,False,False,False,False,False,False,False,False,False,False,Day,Day,Day,Day
C-1681308,4,2020-05-28 21:03:29,2020-05-29 02:01:22,25.93206,-80.20382,25.82464,-80.20665,7.424099861880001,Closed between I-95 Local Ln Access and I-195/SR-112/Airport Expy - Closed due to roadwork.,,I-95 S,R,Miami,Miami-Dade,FL,33169,US,US/Eastern,KHWO,2020-05-28 20:53:00,,,,30.04,10.0,E,14.0,0.0,Partly Cloudy,False,False,False,False,True,False,False,False,False,False,False,False,False,Night,Night,Night,Day
C-1681309,2,2021-12-27 10:07:00,2021-12-27 11:21:30,37.615968,-118.814749,37.576508,-118.757698,4.14584743921,Slow traffic on US-395 S from Benton Crossing Rd (US-395) to South Landing Rd (US-395) due to roadwork.,,US-395 S,R,Mammoth Lakes,Mono,CA,93546,US,US/Pacific,KMMH,2021-12-27 10:35:00,21.0,21.0,86.0,22.77,0.25,NE,3.0,0.0,Cloudy,False,False,False,False,False,False,False,False,False,True,False,False,False,Day,Day,Day,Day
C-1681310,2,2018-10-10 09:59:10,2018-10-16 19:00:00,36.115929,-97.055298,,,0.0,Lane closed due to construction work on OK-51 6th Ave Westbound at Kelly St.,398.0,S Kelly St,L,Stillwater,Payne,OK,74074,US,US/Central,KSWO,2018-10-10 09:53:00,48.9,,71.0,29.98,10.0,WNW,12.7,,Overcast,False,False,False,False,False,False,False,False,False,False,False,False,False,Day,Day,Day,Day
C-1681311,2,2020-09-22 07:00:00,2020-11-10 20:45:00,37.797625,-97.10308,37.805294,-96.976523,6.929469397719999,Construction on KS-254 EB near I-135 Drive with caution.,14049.0,SW State Road 254,L,Benton,Butler,KS,67017,US,US/Central,KAAO,2020-09-22 06:54:00,60.0,60.0,93.0,28.64,10.0,CALM,0.0,0.0,Cloudy,False,False,False,False,False,False,False,False,False,False,False,False,False,Night,Day,Day,Day
C-1681312,2,2019-12-10 09:31:33,2019-12-15 09:30:42,38.65819000000001,-77.24969,38.65966,-77.25081,0.118184024801,Between US-1/Jefferson Davis Hwy and Davis St - Roadwork.,,Jefferson Davis Hwy,R,Woodbridge,Prince William,VA,22191,US,US/Eastern,KDAA,2019-12-10 09:08:00,57.0,57.0,88.0,29.78,10.0,S,5.0,0.0,Light Rain,False,False,True,False,False,False,False,False,False,False,False,True,False,Day,Day,Day,Day
C-1681313,2,2020-08-31 13:43:00,2020-09-01 01:44:38,28.524242,-81.332536,28.523294,-81.331114,0.108362081547,Stationary traffic on FL-15 from Edmundshire Rd to Devonshire Ln due to roadwork.,4210.0,Curry Ford Rd,R,Orlando,Orange,FL,32806-2704,US,US/Eastern,KORL,2020-08-31 13:53:00,77.0,77.0,94.0,29.88,1.0,NW,9.0,0.24,T-Storm,False,False,True,False,False,False,False,False,True,False,False,False,False,Day,Day,Day,Day
C-1681314,2,2021-12-13 15:01:14,2021-12-13 15:33:34,25.926024,-80.150675,25.926209,-80.154884,0.26185841084,Slow traffic on FL-826 from FL-A1A/Collins Ave (FL-826) to FL-909/22nd Ave/Dixie Hwy (FL-826) due to roadwork.,2423.0,NE 163rd St,L,North Miami Beach,Miami-Dade,FL,33160-3902,US,US/Eastern,KHWO,2021-12-13 14:53:00,81.0,81.0,54.0,30.2,10.0,ENE,13.0,0.0,Fair,False,False,False,False,False,False,False,False,True,False,False,False,False,Day,Day,Day,Day
C-1681315,2,2021-10-19 19:40:30,2021-10-19 19:51:30,40.923774,-80.555239,40.925343,-80.55893499999998,0.2213186214,Slow traffic on Ohio Tpke W - I-76 W from OH--PA State Border (I-76) to I-680/Exit 234 (I-76) due to roadwork.,,Ohio Tpke W,R,New Springfield,Mahoning,OH,44443,US,US/Eastern,KUCP,2021-10-19 19:56:00,56.0,56.0,72.0,28.97,10.0,SW,3.0,0.0,Fair,False,False,False,False,False,False,False,False,False,False,False,False,False,Night,Night,Night,Day
C-1681316,2,2019-05-24 09:03:00,2019-05-28 09:02:20,41.42877,-73.471223,41.432511,-73.473111,0.276363655807,At Barnum Rd - Construction work.,,Pembroke Rd,R,Danbury,Fairfield,CT,06811,US,US/Eastern,KDXR,2019-05-24 08:53:00,66.0,66.0,52.0,29.35,10.0,WNW,9.0,0.0,Fair,False,False,False,False,False,False,False,False,False,False,False,False,False,Day,Day,Day,Day
C-1681317,2,2018-06-18 11:40:08,2018-07-06 23:59:00,35.929081,-83.96759,,,0.0,Road closed due to sewer works on Wilani Rd both ways between Taliluna Ave and Southgate Rd.,3999.0,Wilani Rd,R,Knoxville,Knox,TN,37919-8368,US,US/Eastern,KTYS,2018-06-18 11:53:00,86.0,,59.0,30.13,10.0,SW,5.8,,Partly Cloudy,False,False,False,False,False,False,False,False,False,False,False,False,False,Day,Day,Day,Day
C-1681318,3,2016-10-12 06:01:55,2016-10-12 08:00:00,32.788406,-117.113747,,,0.01,Exit ramp closed due to paving repairs on I-15 Southbound at Exits 7 7B Friars Rd.,,Friars Rd,R,San Diego,San Diego,CA,92124,US,US/Pacific,KMYF,2016-10-12 05:53:00,63.0,,78.0,30.05,10.0,Variable,3.5,,Overcast,False,False,False,False,False,False,False,False,False,False,False,False,False,Night,Night,Day,Day
C-1681319,2,2017-12-08 08:18:43,2017-12-08 15:30:00,40.844055,-74.122978,,,5.6300001144400005,Right hand shoulder closed due to construction work on NJ-21 Southbound between Exit 14 Garden State Pkwy and Exits 10 10B Union Ave.,,Passaic County 624 II,R,Passaic,Passaic,NJ,07055,US,US/Eastern,KTEB,2017-12-08 07:51:00,34.0,29.8,52.0,30.08,10.0,West,4.6,,Clear,False,False,False,False,False,False,False,False,False,False,False,False,False,Day,Day,Day,Day
C-1681320,2,2020-06-16 06:54:56,2020-06-17 14:00:00,42.9769,-77.19407,42.9769,-77.19407,0.0,At RT-21/Exit 43 - Construction work. Right lane blocked.,,I-90 W,R,Shortsville,Ontario,NY,14548,US,US/Eastern,KPEO,2020-06-16 06:53:00,52.0,52.0,89.0,29.35,10.0,WSW,5.0,0.0,Fair,False,False,False,False,False,False,False,False,False,False,False,False,False,Day,Day,Day,Day
C-1681321,2,2021-11-08 12:07:30,2021-11-10 03:15:25,41.082032,-115.273157,41.055942,-115.329414,3.44052607479,Roadwork - on I-80 in both directions between Exit 310 - Osino and Exit 333 - Deeth Starr Valley in Elko County Nevada. 24 hour lane closures with the speed limit reduced to 55 miles per hour with delays of up to 10 minutes. There is a 14 foot width limit and periodic on and off ramp closures with flaggers. Decrease speed and move over for highway workers and equipment.,,I-80 W,R,Deeth,Elko,NV,89823,US,US/Pacific,K9BB,2021-11-08 11:56:00,43.0,39.0,56.0,24.93,10.0,NNE,7.0,0.0,Mostly Cloudy,False,False,False,False,False,False,False,False,False,False,False,False,False,Day,Day,Day,Day
C-1681322,4,2021-10-21 00:00:00,2021-10-24 23:59:59,45.140222,-93.462172,45.132065,-93.461998,0.5636588277660001,County Hwy-121 is closed from CR-81 (CR-121) to 93rd Ave (CR-121) due to roadwork.,,County Road 81,R,Osseo,Hennepin,MN,55369,US,US/Central,KMIC,2021-10-21 00:43:00,47.0,41.0,90.0,28.91,9.0,N,15.0,0.03,Light Rain,False,False,True,False,False,False,False,False,False,False,False,True,False,Night,Night,Night,Night
C-1681323,2,2017-07-28 09:00:00,2017-07-29 17:00:00,43.074471,-88.06660500000002,,,0.0,One lane closed due to construction work on Burleigh St Eastbound at 124th St.,,W Burleigh St,R,Milwaukee,Milwaukee,WI,53222,US,US/Central,KMWC,2017-07-28 08:45:00,66.2,,73.0,30.05,10.0,NNE,10.4,,Scattered Clouds,False,False,True,False,False,False,False,False,False,False,False,True,False,Day,Day,Day,Day
C-1681324,2,2021-07-29 13:26:30,2021-07-29 13:38:30,39.019886,-76.980632,39.015776,-77.001362,1.14849178674,Slow traffic on I-495 W from MD-650/New Hampshire Ave/Exit 28 (Capital Beltway/I-495) to MD-193/University Blvd/Exit 29 (Capital Beltway/I-495) due to roadwork.,,Capital Beltway W,R,Silver Spring,Montgomery,MD,20903,US,US/Eastern,KCGS,2021-07-29 13:35:00,87.0,87.0,54.0,29.86,10.0,S,6.0,0.0,Fair,False,False,False,False,True,False,False,False,False,False,False,False,False,Day,Day,Day,Day
C-1681325,2,2021-12-14 11:32:30,2021-12-15 21:38:25,38.619829,-120.219107,38.628169,-120.208707,0.804494178518,Roadwork on Bear River Rd (CA-88) from Mormon Emigrant Trl (CA-88) to CA-88.,,CA-88,R,Pioneer,Amador,CA,95666,US,US/Pacific,KPVF,2021-12-14 11:35:00,34.0,34.0,100.0,27.13,3.0,SW,3.0,0.04,Mostly Cloudy,False,False,False,False,False,False,False,False,False,True,False,False,False,Day,Day,Day,Day
C-1681326,2,2021-09-05 18:03:00,2021-09-05 18:35:00,40.726555,-73.995866,40.720833,-74.000644,0.467867472576,Slow traffic from E 14th St (Broadway) to Canal St (Broadway) due to roadwork.,640.0,Broadway,R,New York,New York,NY,10012-2629,US,US/Eastern,KJRB,2021-09-05 17:51:00,73.0,73.0,76.0,29.7,10.0,CALM,0.0,0.0,Cloudy,True,False,True,False,False,False,False,False,False,False,False,True,False,Day,Day,Day,Day
C-1681327,4,2020-04-30 21:40:12,2020-05-01 02:39:31,47.7005,-117.35777,47.70052,-117.36483,0.328294892576,Closed between N Havana St/E Valley Springs Rd and N Haven St/N Market St - Closed due to roadwork.,3598.0,E Wellesley Ave,R,Spokane,Spokane,WA,99217-6806,US,US/Pacific,KSFF,2020-04-30 21:53:00,53.0,53.0,38.0,27.93,10.0,WSW,6.0,0.0,Fair,False,False,True,False,False,False,False,False,False,False,False,True,False,Night,Night,Night,Day
C-1681328,2,2021-10-04 14:48:30,2021-10-04 16:50:34,42.672091,-82.87771500000002,42.673459,-82.878457,0.101758542019,Stationary traffic from Dailey Rd to Summit View Dr due to roadwork.,50783.0,North Ave,L,Macomb,Macomb,MI,48042-4624,US,US/Eastern,KMTC,2021-10-04 14:56:00,69.0,69.0,100.0,29.28,10.0,E,6.0,0.0,Mostly Cloudy,False,False,False,False,False,False,False,False,False,False,False,False,False,Day,Day,Day,Day
C-1681329,2,2021-05-04 15:04:07,2021-05-17 21:44:00,42.589273,-78.94100300000002,42.594265,-78.940946,0.344926536331,Roadwork on CR-447/Shirley Rd (Gowanda State Rd/US-62) from NY-249/Brant St/Sherman Ave (Main St/Gowanda State Rd/US-62) to US-62 S - US-62 N.,10752.0,Gowanda State Rd,R,North Collins,Erie,NY,14111-9510,US,US/Eastern,KDKK,2021-05-04 15:13:00,65.0,65.0,84.0,28.93,8.0,SW,13.0,0.0,Cloudy,False,False,False,False,False,False,False,False,False,False,False,False,False,Day,Day,Day,Day
C-1681330,2,2018-11-28 09:00:00,2018-11-28 15:00:00,40.30669,-75.898285,,,0.0,Intermittent lane closures due to construction work on US-422 both ways at I-176.,,Conrad Weiser Pkwy,R,Birdsboro,Berks,PA,19508,US,US/Eastern,KRDG,2018-11-28 08:54:00,35.1,23.0,61.0,29.65,10.0,West,24.2,,Partly Cloudy,False,False,False,False,False,False,False,False,False,False,False,False,False,Day,Day,Day,Day
C-1681331,2,2021-05-26 18:59:35,2021-12-17 16:09:22,40.332716,-76.758477,40.328952,-76.777875,1.05429730824,Slow traffic on I-81 S from PA-39/Exit 77 (I-81) to Mountain Rd/Exit 72 (I-81) due to roadwork.,,I-81 S,R,Harrisburg,Dauphin,PA,17112,US,US/Eastern,KCXY,2021-11-02 01:56:00,45.0,45.0,74.0,29.83,10.0,SW,3.0,0.0,Cloudy,False,False,False,False,False,False,False,False,False,False,False,False,False,Day,Day,Day,Day
C-1681332,2,2021-10-27 07:52:30,2021-10-27 10:52:30,27.955555,-82.444234,27.952284,-82.449167,0.376459214792,Stationary traffic on FL-618 W - FL-618 E from FL-618 (Eastbound Entrance) (FL-618 Exp/Crosstown Expy (Express Ln)) to Twiggs St/Meridian Ave (FL-618 Exp/Crosstown Expy (Express Ln)) due to roadwork.,,Lee Roy Selmon Expy W,R,Tampa,Hillsborough,FL,33602,US,US/Eastern,KTPF,2021-10-27 07:55:00,61.0,61.0,94.0,29.87,10.0,CALM,0.0,0.0,Fair,False,False,True,False,False,False,True,False,False,False,False,True,False,Day,Day,Day,Day
C-1681333,3,2019-09-15 04:05:55,2019-11-16 15:36:10,38.86126,-77.09198,38.85638,-77.1098,1.01632402081,Between S Walter Reed Dr and S Four Mile Run Dr - Construction work. Lane blocked.,,S Glebe Rd,R,Arlington,Arlington,VA,22204,US,US/Eastern,KDCA,2019-09-15 03:52:00,75.0,75.0,84.0,30.14,10.0,CALM,0.0,0.0,Cloudy,False,False,True,False,False,False,False,False,False,False,False,True,False,Night,Night,Night,Night
C-1681334,2,2016-12-05 12:03:49,2016-12-09 16:00:00,42.36095,-87.832619,,,0.0,Construction work on County St both ways between County Hwy-A22 Washington St and Madison St.,61.0,N County St,R,Waukegan,Lake,IL,60085-4305,US,US/Central,KUGN,2016-12-05 11:55:00,33.1,23.9,96.0,30.03,2.5,South,12.7,,Overcast,False,False,False,False,False,False,False,False,False,True,False,False,False,Day,Day,Day,Day
C-1681335,2,2019-04-01 05:36:00,2020-09-08 07:49:57,47.266885,-121.225117,47.269772,-121.263595,1.8150136268,I-90 Snoqualmie Pass: We expect to see delays and congestion westbound on Monday between North Bend and Cle Elum. Plan for added travel time. We are closing I-90 both directions for rock blasting Wednesday night Sept. 9 and Thursday night Sept 10 starting at 6:30 p.m. These closures are expected to last about an hour. The eastbound lanes will be closed at milepost 63 near Price Creek 11 miles east of the summit and the westbound lanes will be closed at milepost 70 near Easton.,,I-90 W,R,Cle Elum,Kittitas,WA,98922,US,US/Pacific,KSMP,2019-04-01 05:53:00,37.0,37.0,82.0,28.13,10.0,CALM,0.0,0.0,Mostly Cloudy,False,False,False,False,False,False,False,False,False,False,False,False,False,Night,Night,Day,Day
C-1681336,4,2019-10-17 00:03:32,2019-10-17 05:02:50,34.2572,-83.96370999999998,34.25926,-83.9606,0.2275972850599999,Closed at Ann Harbor Dr - Closed due to roadwork.,8999.0,Browns Bridge Rd,L,Gainesville,Forsyth,GA,30506-4014,US,US/Eastern,KGVL,2019-10-17 00:53:00,51.0,51.0,63.0,28.57,10.0,WNW,10.0,0.0,Fair,False,False,False,False,False,False,False,False,False,False,False,False,False,Night,Night,Night,Night
C-1681337,2,2021-09-20 16:27:30,2021-09-20 18:58:43,33.465740000000004,-112.010598,33.465268,-112.01292,0.137753682613,Stationary traffic from N 33rd St to AZ-202 Loop W due to roadwork.,3292.0,E McDowell Rd,L,Phoenix,Maricopa,AZ,85008-3842,US,US/Mountain,KPHX,2021-09-20 16:51:00,97.0,97.0,14.0,28.68,10.0,NW,6.0,0.0,Partly Cloudy,True,False,False,False,False,False,False,False,True,True,False,False,False,Day,Day,Day,Day
C-1681338,2,2021-11-09 06:03:00,2021-11-30 00:00:00,36.39498,-88.719792,36.400143,-88.719166,0.3584241592409999,State Route 118 both directions in Weakley County - Between W. MAIN ST. and TENNESSEE-KENTUCKY STATE LINE maintenance work will cause temporary lane closures every day from 12:03PM 11/09/2021 to 12:00AM 11/30/2021 (Central Time Zone).,4234.0,Highway 118,R,Dresden,Weakley,TN,38225-1970,US,US/Central,KUCY,2021-11-09 05:55:00,41.0,41.0,100.0,29.86,10.0,CALM,0.0,0.0,Cloudy,False,False,False,False,False,False,False,False,False,False,False,False,False,Night,Day,Day,Day
C-1681339,2,2021-05-21 05:34:30,2021-12-29 17:30:00,37.679489,-97.162109,37.679459,-97.171249,0.499811239448,Stationary traffic on US-54 W - US-400 W from Rose Hill Rd/S Andover Rd (US-400/US-54) to KS-96 (US-400/E Kellogg Dr/US-54) due to roadwork.,14708.0,E Kellogg St,R,Wichita,Sedgwick,KS,67230,US,US/Central,KAAO,2021-05-21 05:33:00,66.0,66.0,87.0,28.54,10.0,S,13.0,0.0,Cloudy,False,False,False,False,False,False,False,False,False,False,False,True,False,Night,Night,Day,Day
C-1681340,2,2021-06-24 06:15:00,2021-10-15 01:30:03,40.799726,-76.21775699999998,40.802482,-76.21358199999997,0.289728699569,Roadwork on PA 924 northbound between Exit: GILBERTON and ENTR TO GOLD STAR PLAZA. There is a lane restriction.,,Gold Star Hwy,R,Gilberton,Schuylkill,PA,17934,US,US/Eastern,KMUI,2021-06-24 05:56:00,51.0,51.0,92.0,29.81,10.0,CALM,0.0,0.0,Mostly Cloudy,False,False,False,False,False,False,False,False,False,False,False,False,False,Day,Day,Day,Day
C-1681341,2,2020-11-16 13:06:00,2020-11-16 19:58:34,40.611126,-73.96799,40.609557,-73.966302,0.139969683797,Slow traffic on Ocean Pkwy from Avenue O to E 7th St due to roadwork.,,Ocean Pkwy,R,Brooklyn,Kings,NY,11230,US,US/Eastern,KJRB,2020-11-16 12:51:00,53.0,53.0,34.0,29.85,10.0,VAR,5.0,0.0,Fair,False,False,True,False,False,False,False,False,False,False,False,True,False,Day,Day,Day,Day
C-1681342,4,2020-12-14 03:43:00,2020-12-21 07:59:00,39.346217,-76.607736,39.346814,-76.607626,0.0416654056434,Closed road from E Cold Spring Ln to Richwood Ave due to roadwork.,4731.0,Old York Rd,R,Baltimore,Baltimore City,MD,21212-4638,US,US/Eastern,KDMH,,,,,,,,,,,False,False,False,False,False,False,False,False,True,False,False,True,False,Night,Night,Night,Night
C-1681343,2,2019-07-24 21:02:32,2019-07-29 05:00:00,25.92552,-80.171649,25.9256,-80.17004,0.1001360194669999,At NE 15th Ave - Construction work. Lane blocked.,1414.0,NE 163rd St,R,North Miami Beach,Miami-Dade,FL,33162-4625,US,US/Eastern,KHWO,2019-07-24 20:53:00,86.0,86.0,63.0,30.0,10.0,NNW,8.0,0.0,Fair,False,False,True,False,False,False,False,False,False,False,False,True,False,Night,Night,Day,Day
C-1681344,2,2021-04-27 05:23:30,2021-04-27 11:44:30,40.734175,-73.999128,40.737358,-73.996825,0.250806952584,Stationary traffic from Bleecker St/Downing St/Minetta St (6th Ave) to W 23rd St (6th Ave) due to roadwork.,,Christopher St,R,New York,New York,NY,10014,US,US/Eastern,KJRB,2021-04-27 05:51:00,47.0,47.0,39.0,30.03,10.0,CALM,0.0,0.0,Mostly Cloudy,True,False,True,False,False,False,True,False,True,False,False,True,False,Night,Night,Day,Day
C-1681345,3,2018-10-04 08:01:56,2018-10-08 08:01:52,34.021025,-84.489124,34.014781,-84.494419,0.527329704808,Between Trickum Rd NE and Piedmont Rd NE - Construction work. Lane blocked.,2883.0,Sandy Plains Rd,L,Marietta,Cobb,GA,30066-4552,US,US/Eastern,KRYY,2018-10-04 07:48:00,66.0,,96.0,29.35,10.0,Calm,,,Clear,False,False,True,False,False,False,False,False,False,False,False,True,False,Day,Day,Day,Day
C-1681346,2,2020-09-23 07:48:30,2020-09-23 22:46:53,40.84133900000001,-73.916882,40.84543,-73.913987,0.320616379127,Slow traffic from E 161st St/Woodycrest Ave (Jerome Ave) to I-95/US-1/Cross Bronx Expy (Jerome Ave) due to roadwork.,1464.0,Jerome Ave,R,Bronx,Bronx,NY,10452-3314,US,US/Eastern,KLGA,2020-09-23 07:51:00,64.0,64.0,50.0,29.88,10.0,W,10.0,0.0,Fair,False,False,False,False,False,False,False,False,False,False,False,True,False,Day,Day,Day,Day
C-1681347,2,2021-08-26 13:13:00,2021-08-26 13:35:30,27.901209,-81.600103,27.896678,-81.59994499999998,0.313210913957,Stationary traffic on US-27 S - FL-25 from Washington Ave (US-27) to CR-17B/Hunt Brothers Rd (US-27) due to roadwork.,19618.0,Highway 27,L,Lake Wales,Polk,FL,33853,US,US/Eastern,KBOW,2021-08-26 12:50:00,86.0,86.0,70.0,29.92,10.0,ENE,14.0,0.0,Partly Cloudy,False,False,True,False,False,False,False,False,False,False,False,True,False,Day,Day,Day,Day
C-1681348,2,2021-12-27 11:16:30,2021-12-27 11:37:00,40.518468,-77.129441,40.495518,-77.113681,1.78882417525,Slow traffic on US-322 E - US-22 E from PA-1012/Old Ferry Rd (US-22/US-322) to PA-34/Red Hill Rd (US-22/US-322) due to roadwork.,,US-22 E,R,Millerstown,Perry,PA,17062,US,US/Eastern,KSEG,2021-12-27 10:53:00,33.0,33.0,85.0,29.59,6.0,CALM,0.0,0.0,Light Snow,False,False,False,False,True,False,False,False,False,False,False,False,False,Day,Day,Day,Day
C-1681349,2,2021-11-23 11:12:30,2021-11-23 14:03:34,39.763687,-86.345751,39.763285,-86.33688000000002,0.471970218821,Slow traffic on US-36 E - US-36 W from Washington to Conrail Railroad due to roadwork.,9963.0,E US Highway 36,R,Avon,Hendricks,IN,46123-7987,US,US/Eastern,KIND,2021-11-23 10:54:00,33.0,27.0,54.0,29.44,10.0,S,7.0,0.0,Mostly Cloudy,False,False,False,False,False,False,False,False,False,False,False,False,False,Day,Day,Day,Day
C-1681350,2,2021-09-17 10:24:30,2021-09-17 12:37:22,39.763723,-86.34074,39.764293,-86.33668399999998,0.218989125091,Slow traffic on US-36 E - US-36 W from Shiloh Crossing Dr to Shiloh Xing / N County Road 1050 E due to roadwork.,10269.0,E US Highway 36,R,Avon,Hendricks,IN,46123-7985,US,US/Eastern,KIND,2021-09-17 10:54:00,77.0,77.0,74.0,29.29,10.0,CALM,0.0,0.0,Fair,False,False,False,False,False,False,False,False,False,False,False,True,False,Day,Day,Day,Day
C-1681351,2,2021-09-15 17:58:51,2021-09-15 18:18:51,40.686979,-73.979525,40.689941,-73.98139300000003,0.226851142605,Slow traffic from Atlantic Ave (Flatbush Ave) to Tillary St (Flatbush Ave) due to roadwork.,67.0,Flatbush Ave,L,Brooklyn,Kings,NY,11217,US,US/Eastern,KJRB,2021-09-15 17:51:00,81.0,,67.0,29.83,10.0,,,0.0,Fair,True,False,False,False,False,False,True,False,True,False,False,True,False,Day,Day,Day,Day
C-1681352,2,2021-08-23 18:35:31,2021-12-07 16:25:42,30.544698,-84.227041,30.541438,-84.22869399999998,0.245785760809,Slow traffic on US-319 S - FL-61 from Bannerman Rd/Bradfordville Rd (US-319) to Killarney Way (US-319) due to roadwork.,5618.0,Thomasville Rd,L,Tallahassee,Leon,FL,32312-3816,US,US/Eastern,KTLH,2021-12-07 13:53:00,67.0,67.0,84.0,29.97,10.0,E,6.0,0.0,Cloudy,False,False,True,False,False,False,False,False,False,False,False,False,False,Day,Day,Day,Day
C-1681353,2,2020-09-30 13:16:00,2020-09-30 20:21:00,26.444927000000003,-80.068229,26.441737,-80.069991,0.2458899113769999,Stationary traffic on US-1 from SE 10th St (US-1) to E Linton Blvd (US-1) due to resurfacing work.,,Franklin Club Dr,R,Delray Beach,Palm Beach,FL,33483,US,US/Eastern,KBCT,2020-09-30 13:17:00,85.0,85.0,82.0,29.92,10.0,NE,13.0,0.0,Thunder in the Vicinity,False,False,False,False,False,False,False,False,False,True,False,True,False,Day,Day,Day,Day
C-1681354,2,2019-11-25 09:30:00,2019-11-25 15:30:00,41.324429,-73.988838,,,0.990000009537,Intermittent lane closures due to bridge maintenance work on US-9W both ways between US-6 and Firefighters Memorial Dr.,449.0,Route 9W,L,Highland Falls,Orange,NY,10928,US,US/Eastern,KSWF,2019-11-25 09:45:00,43.0,37.0,81.0,29.29,20.0,W,9.0,0.0,Partly Cloudy,False,False,False,False,False,False,False,False,False,False,False,False,False,Day,Day,Day,Day
C-1681355,2,2021-05-28 04:57:30,2021-05-28 09:41:00,29.777282,-95.920477,29.772015000000003,-96.032773,6.74444846479,Stationary traffic on US-90 W - I-10 W from Pederson Rd/Exit 737 (I-10) to Bartlett Rd (Overpass) (I-10) due to roadwork.,,I-10 W,R,Brookshire,Waller,TX,77423,US,US/Central,KTME,2021-05-28 04:55:00,75.0,75.0,100.0,29.75,7.0,S,9.0,0.0,Fair,False,False,False,False,False,False,False,False,False,False,False,False,False,Night,Night,Night,Day
C-1681356,2,2021-06-04 14:48:40,2021-06-04 16:56:28,40.235694,-79.580835,40.241531,-79.57674499999997,0.4573669393,Slow traffic on US-119 N from Burton Ave (US-119) to Fairview St (US-119) due to roadwork.,229.0,S 3rd St,R,Youngwood,Westmoreland,PA,15697-1626,US,US/Eastern,KLBE,2021-06-04 14:47:00,77.0,77.0,57.0,28.75,10.0,SW,12.0,0.0,Fair,False,False,False,False,False,False,False,False,False,False,False,False,False,Day,Day,Day,Day
C-1681357,3,2020-02-04 20:00:00,2020-02-05 05:00:00,32.985981,-96.884132,,,0.40000000596,Exit ramp from President George Bush Tpke Westbound to Josey Ln closed due to construction during the night.,,Scott Mill Rd,R,Carrollton,Dallas,TX,75007,US,US/Central,KADS,2020-02-04 19:47:00,43.0,35.0,76.0,29.29,10.0,NNW,15.0,0.0,Cloudy,False,False,False,False,False,False,False,False,False,False,False,True,False,Night,Night,Night,Night
C-1681358,2,2021-07-01 14:50:33,2021-07-01 15:17:00,41.120249,-85.151225,41.1168,-85.148414,0.279637412021,Slow traffic on US-27 S from US-30/IN-1/IN-3 (Lima Rd/US-27) to N Clinton St/Edgewood Ave (IN-1/Northrop St/US-27) due to roadwork.,4569.0,Lima Rd,L,Fort Wayne,Allen,IN,46808-1271,US,US/Eastern,KFWA,2021-07-01 14:54:00,82.0,82.0,49.0,29.08,10.0,N,14.0,0.0,Partly Cloudy,False,False,False,False,False,False,False,False,False,False,False,False,False,Day,Day,Day,Day
C-1681359,2,2021-10-19 14:07:37,2021-10-19 14:28:35,29.965577000000003,-90.156656,29.97431,-90.156338,0.6036929658510001,Slow traffic from US-90/Jefferson Hwy (Causeway Blvd) to US-61/Airline Hwy (N Causeway Blvd) due to roadwork.,,S Causeway Blvd,R,New Orleans,Jefferson,LA,70121,US,US/Pacific,KAUD,2021-10-19 13:55:00,80.0,80.0,58.0,30.08,10.0,E,10.0,0.0,Mostly Cloudy,False,False,False,False,False,False,False,False,False,False,False,False,False,Day,Day,Day,Day
C-1681360,3,2016-08-04 21:00:33,2017-09-01 16:00:00,40.023834,-82.865753,40.03843,-82.86486,1.00959353708,At US-62/E Johnstown Rd - Roadwork.,401.0,Clark State Rd,L,Columbus,Franklin,OH,43230-2202,US,US/Eastern,KCMH,2016-08-04 20:51:00,82.9,,63.0,29.93,10.0,ESE,6.9,,Mostly Cloudy,False,False,True,False,False,False,False,False,False,False,False,True,False,Night,Day,Day,Day
