ID,Severity,Start_Time,End_Time,Start_Lat,Start_Lng,End_Lat,End_Lng,Distance(mi),Description,Number,Street,Side,City,County,State,Zipcode,Country,Timezone,Airport_Code,Weather_Timestamp,Temperature(F),Wind_Chill(F),Humidity(%),Pressure(in),Visibility(mi),Wind_Direction,Wind_Speed(mph),Precipitation(in),Weather_Condition,Amenity,Bump,Crossing,Give_Way,Junction,No_Exit,Railway,Roundabout,Station,Stop,Traffic_Calming,Traffic_Signal,Turning_Loop,Sunrise_Sunset,Civil_Twilight,Nautical_Twilight,Astronomical_Twilight
C-5360568,2,2021-09-27 15:29:30,2021-09-27 16:10:00,32.867503,-97.342391,32.863763,-97.341625,0.26220530627,Stationary traffic on FM-156 from Rough Rider Ln to Overland St due to roadwork.,,Rough Rider Ln,R,Fort Worth,Tarrant,TX,76131,US,US/Central,KFWD,2021-09-27 15:53:00,85.0,85.0,36.0,29.18,9.0,SE,5.0,0.0,Fair,False,False,False,False,False,False,False,False,False,False,False,False,False,Day,Day,Day,Day
C-5360569,2,2017-06-16 10:55:41,2017-06-16 15:00:00,39.87579,-75.122658,,,0.0,Right lane closed and right hand shoulder closed due to construction work on US-130 Southbound at NJ-47 Old Broadway.,,US-130 N,R,Gloucester City,Camden,NJ,08030,US,US/Eastern,KPHL,2017-06-16 10:54:00,73.0,,76.0,29.94,10.0,Variable,4.6,,Overcast,False,False,False,False,False,False,False,False,False,False,False,False,False,Day,Day,Day,Day
C-5360570,4,2019-09-02 20:48:13,2019-09-03 01:46:50,33.77193,-118.2402,33.785509999999995,-118.22551,1.26179281254,Closed between CA-47 and I St - Closed due to roadwork.,,CA-103 N,R,Wilmington,Los Angeles,CA,90744,US,US/Pacific,KTOA,2019-09-02 19:47:00,72.0,72.0,94.0,29.81,10.0,W,12.0,,Fair,False,False,False,False,True,False,False,False,False,False,False,False,False,Night,Night,Night,Night
C-5360571,2,2021-09-04 11:33:30,2021-09-04 15:30:47,42.676945,-83.30341800000002,42.67787,-83.300696,0.152323763615,Slow traffic from Hollywood Ave to W New York Ave / E New York Ave due to roadwork.,14682.0,Hollywood Ave,R,Pontiac,Oakland,MI,48340,US,US/Eastern,KPTK,2021-09-04 11:53:00,73.0,73.0,55.0,28.9,10.0,S,9.0,0.0,Cloudy,False,False,False,False,False,False,False,False,True,False,False,False,False,Day,Day,Day,Day
C-5360572,2,2021-11-08 08:02:30,2021-11-08 09:04:53,40.814579,-73.913878,40.81610300000001,-73.91759,0.220827076774,Slow traffic from St Anns Ave (E 149th St) to Melrose Ave (E 149th St) due to roadwork.,526.0,E 149th St,R,Bronx,Bronx,NY,10455-2812,US,US/Eastern,KLGA,2021-11-08 07:51:00,53.0,53.0,47.0,30.12,10.0,N,9.0,0.0,Fair,True,False,True,False,False,False,True,False,True,False,False,True,False,Day,Day,Day,Day
C-5360573,2,2018-08-30 01:13:20,2018-09-14 23:59:00,40.888783,-83.871974,40.88402,-83.8956,1.27723460309,At Bentley Rd/Exit 140 - Roadwork.,,I-75 S,R,Bluffton,Hancock,OH,45817,US,US/Eastern,KFDY,2018-08-30 00:53:00,71.1,,87.0,30.07,10.0,NW,3.5,,Clear,False,False,False,False,False,False,False,False,False,False,False,False,False,Night,Night,Night,Night
C-5360574,2,2020-07-21 16:30:00,2020-07-29 00:15:00,33.422077,-111.896179,33.422099,-111.900486,0.248379981057,UNIVERSITY DR and RIVER DR - Construction - UNIVERSITY DR is restricted Northbound between RIVER DR to SMITH RD to allow for bore work. UNIVERSITY DR is restricted 1 Lane Eastbound between RIVER DR to SMITH RD to allow for bore work. The sidewalk will be closed.The bike lane will be closed.UNIVERSITY DR is restricted 2 Lanes Westbound between RIVER DR to SMITH RD to allow for bore work.,2099.0,E University Dr,R,Tempe,Maricopa,AZ,85281-4604,US,US/Mountain,KPHX,,,,,,,,,,,False,False,True,False,False,False,False,False,False,False,False,True,False,Day,Day,Day,Day
C-5360575,2,2017-03-21 07:23:09,2017-03-21 17:00:00,40.530621,-79.627625,,,2.07,Intermittent lane closures due to construction on PA-780 Washington Rd both ways between Hunt Valley Rd and PA-380.,1200.0,State Route 380,R,Apollo,Westmoreland,PA,15613-1912,US,US/Eastern,KLBE,2017-03-21 07:50:00,41.0,,100.0,29.98,9.0,Calm,,,Overcast,False,False,False,False,False,False,False,False,False,False,False,False,False,Day,Day,Day,Day
C-5360576,2,2021-04-28 13:51:19,2021-05-06 23:59:00,43.355949,-77.92283499999998,43.35549,-77.940169,0.8714062931759999,NYSDOT - Region 4: bridge inspection on Lake Ontario State Parkway under Wilson Rd (Hamlin) Alternating Left/ Right Lane Closures Eastbound and Westbound Not currently Scheduled,,Brockport Village Right of Way,R,Hamlin,Monroe,NY,14464,US,US/Eastern,KROC,2021-04-28 13:54:00,55.0,55.0,74.0,29.23,10.0,CALM,0.0,0.0,Thunder in the Vicinity,False,False,False,False,True,False,False,False,False,True,False,False,False,Day,Day,Day,Day
C-5360577,2,2021-09-28 08:01:30,2021-09-28 08:29:30,34.781246,-86.582025,34.774524,-86.58463,0.4874072372219999,Stationary traffic on AL-1 - US-431 S - US-231 S from Winchester Rd (US-431/US-231) to US-72/Sparkman Dr (US-431/US-231) due to roadwork.,,N Memorial Pkwy,R,Huntsville,Madison,AL,35810,US,US/Central,KMDQ,2021-09-28 07:55:00,62.0,62.0,93.0,29.26,10.0,CALM,0.0,0.0,Fair,False,False,False,False,False,False,False,False,False,False,False,False,False,Day,Day,Day,Day
C-5360578,2,2021-09-28 18:28:00,2021-09-28 20:37:12,33.632332,-111.89795,33.628932,-111.893929,0.329692277743,Slow traffic from N 82nd St to N Northsight Blvd due to roadwork.,8445.0,E Frank Lloyd Wright Blvd,L,Scottsdale,Maricopa,AZ,85260-1985,US,US/Mountain,KSDL,2021-09-28 18:53:00,86.0,86.0,37.0,28.11,10.0,E,6.0,0.0,Fair,False,False,False,False,False,False,False,False,False,False,False,False,False,Night,Day,Day,Day
C-5360579,2,2021-04-05 07:09:30,2021-04-05 15:31:24,33.393384999999995,-111.80224,33.393349,-111.806283,0.23324138581,Slow traffic from S Gilbert Rd (E Southern Ave) to S Mesa Dr (E Southern Ave) due to roadwork.,1201.0,S Doran,L,Mesa,Maricopa,AZ,85204-5901,US,US/Mountain,KFFZ,2021-04-05 06:51:00,66.0,66.0,24.0,28.59,10.0,E,7.0,0.0,Mostly Cloudy,False,False,False,False,False,False,False,False,False,False,False,False,False,Day,Day,Day,Day
C-5360580,2,2021-07-20 10:00:00,2021-12-15 18:24:15,42.039438,-80.183216,42.038786,-80.184729,0.0897623230595,Roadwork on HEIDLER RD both directions between BEAR CREEK RD and HEIDLER RD MILLFAIR DR. There is a lane restriction.,5584.0,Millfair Rd,R,Fairview,Erie,PA,16415-2721,US,US/Eastern,KERI,2021-07-26 09:51:00,79.0,79.0,60.0,29.19,10.0,SW,9.0,0.0,Fair,False,False,False,False,False,False,False,False,False,False,False,False,False,Day,Day,Day,Day
C-5360581,2,2021-06-18 16:45:06,2021-06-18 17:14:00,39.740095,-104.850219,39.740095,-104.847111,0.165126636001,Stationary traffic on US-40 E - I-70 Bus E - US-287 S from Havana St (Colfax Ave) to Peoria St (Colfax Ave) due to roadwork.,11808.0,E Colfax Ave,R,Aurora,Arapahoe,CO,80010-5109,US,US/Mountain,KBKF,2021-06-18 16:58:00,86.0,86.0,24.0,24.42,10.0,SSE,7.0,0.0,Mostly Cloudy,False,False,True,False,False,False,False,False,False,False,False,True,False,Day,Day,Day,Day
C-5360582,2,2019-04-26 03:30:00,2019-04-26 18:00:00,37.28224,-107.87778,37.281163,-107.878136,0.0769442567012,At CO-789/US-160 - Construction work.,101.0,W 17th St,L,Durango,La Plata,CO,81301,US,US/Mountain,KDRO,2019-04-26 03:53:00,40.0,37.0,63.0,23.58,10.0,E,5.0,0.0,Mostly Cloudy,False,False,False,False,False,False,False,False,False,False,False,True,False,Night,Night,Night,Night
C-5360583,2,2020-09-08 13:51:17,2020-09-08 23:59:13,40.836629,-83.961373,40.82748,-83.982535,1.27417266376,Roadwork on I-75 from Bentley Rd/Exit 140 (I-75) to OH-696/Napoleon Rd/Exit 134 (I-75).,,I-75 S,R,Bluffton,Allen,OH,45817,US,US/Eastern,KFDY,2020-09-08 13:53:00,84.0,84.0,61.0,29.16,10.0,S,14.0,0.0,Fair,False,False,False,False,False,False,False,False,False,False,False,False,False,Day,Day,Day,Day
C-5360584,4,2020-07-21 07:00:00,2020-11-30 08:45:00,45.03462800000001,-93.239624,45.035273,-93.243689,0.203421842681,Construction on 36 1/2 WB near BUCHANAN Expect delays.,1398.0,36 1/2 Ave NE,R,Minneapolis,Hennepin,MN,55418-1305,US,US/Central,KMIC,2020-07-21 06:53:00,70.0,70.0,78.0,29.02,7.0,W,10.0,0.0,Light Rain,False,False,False,False,False,False,False,False,False,False,False,False,False,Day,Day,Day,Day
C-5360585,2,2021-12-25 19:23:00,2021-12-25 21:25:14,42.31035,-120.798385,42.280217,-120.759607,2.87443937324,Roadwork on NFD-366/NFD-3715 (OR-140) from NFD-3733 (OR-140) to OR-140.,,Highway 140,R,Lakeview,Lake,OR,97630,US,US/Pacific,KLKV,2021-12-25 19:27:00,25.0,13.0,86.0,24.74,3.0,SSE,13.0,0.0,Light Snow,False,False,False,False,False,False,False,False,False,False,False,False,False,Night,Night,Night,Night
C-5360586,4,2020-06-15 17:44:00,2020-08-14 09:53:36,41.402281,-80.377195,41.39942,-80.37682,0.198629388572,Roadwork on COLUMBIA AV both directions between MERCER ST and MAIN ST. All lanes closed.,1.0,Shady Ave,R,Greenville,Mercer,PA,16125-1822,US,US/Eastern,KYNG,2020-06-15 17:51:00,75.0,75.0,46.0,29.07,10.0,E,7.0,0.0,Mostly Cloudy,False,False,False,False,False,False,False,False,False,False,False,False,False,Day,Day,Day,Day
C-5360587,3,2020-05-17 23:35:42,2020-05-18 01:35:30,41.43375,-74.04465,41.4342,-74.0445,0.032048233297,At CR-32/Willow Ave - Roadwork. Right lane closed. Ramp restrictions.,2399.0,US Route 9W,R,Cornwall,Orange,NY,12518-1256,US,US/Eastern,KSWF,2020-05-17 23:45:00,59.0,59.0,59.0,29.67,10.0,VAR,6.0,0.0,Cloudy,False,False,False,False,False,False,False,False,False,False,False,False,False,Night,Night,Night,Night
C-5360588,2,2020-05-13 07:00:00,2020-05-13 17:00:00,41.467999,-73.821159,,,35.9900016785,Intermittent lane closures due to construction work on Taconic State Pkwy both ways between Exit 20 US-6 and NY-301.,1800.0,Route 301,L,Carmel,Putnam,NY,10512-3435,US,US/Eastern,KDXR,2020-05-13 06:53:00,34.0,29.0,75.0,29.79,10.0,WSW,6.0,0.0,Fair,False,False,False,False,False,False,False,False,False,False,False,False,False,Day,Day,Day,Day
C-5360589,2,2020-10-18 00:54:00,2020-10-18 07:52:00,31.19695,-105.447572,31.192807,-105.433803,0.86267006593,Slow traffic on I-10 from Lasca Branch Rd/Exit 99 (I-10) to I-10 Bus Loop/Exit 106 (WB)/Exit 105 (EB) (I-10) due to roadwork.,,I-10 E,R,Sierra Blanca,Hudspeth,TX,79851,US,US/Mountain,KGDP,2020-10-18 00:51:00,67.0,67.0,23.0,24.62,9.0,WSW,17.0,0.0,Fair,False,False,False,False,False,False,False,False,False,False,False,False,False,Night,Night,Night,Night
C-5360590,2,2020-09-22 14:09:00,2020-09-23 04:27:00,40.704816,-73.817562,40.694374,-73.812087,0.7763856142300001,Slow traffic on I-678 from Main St/Exit 8 (I-678) to Atlantic Ave/Exit 5 (I-678) due to roadwork.,,Van Wyck Expy S,R,Jamaica,Queens,NY,11435,US,US/Eastern,KJFK,2020-09-22 13:51:00,70.0,70.0,25.0,30.01,10.0,NNW,22.0,0.0,Mostly Cloudy / Windy,False,False,False,False,True,False,False,False,False,False,False,False,False,Day,Day,Day,Day
C-5360591,2,2021-11-19 07:33:00,2021-11-19 08:10:30,28.4666,-81.367672,28.47285,-81.368691,0.436246606704,Stationary traffic on FL-527 from E Lancaster Rd to Tiner Ave due to roadwork.,6524.0,S Orange Ave,R,Orlando,Orange,FL,32809-5114,US,US/Eastern,KMCO,2021-11-19 07:53:00,69.0,69.0,90.0,30.05,10.0,WNW,3.0,0.0,Mostly Cloudy,False,False,False,False,False,False,False,False,False,False,False,False,False,Day,Day,Day,Day
C-5360592,2,2021-12-07 14:21:30,2021-12-07 19:22:30,41.92313400000001,-87.679868,41.876718,-87.645709,3.65665060878,Slow traffic on I-94 E - I-90 E - Kennedy Expy E from Fullerton Ave/Exit 47A (I-90/I-94) to I-290/Eisenhower Expy/Exit 51H-I (I-90/I-94) due to roadwork.,,I-90 E,R,Chicago,Cook,IL,60647,US,US/Central,KMDW,2021-12-07 13:53:00,23.0,14.0,32.0,29.52,10.0,SW,8.0,0.0,Mostly Cloudy,False,False,False,False,False,False,False,False,False,False,False,False,False,Day,Day,Day,Day
C-5360593,3,2018-09-21 05:39:11,2020-03-01 00:00:00,35.52224000000001,-97.459976,,,0.949999988079,One lane closed due to construction on I-35 Frontage Rd Southbound between Bryant Ave / 63rd St and 50th St.,5099.0,N I 35 Service Rd,L,Oklahoma City,Oklahoma,OK,73111,US,US/Central,KTIK,2018-09-21 05:56:00,71.2,,85.0,29.94,10.0,East,4.6,,Mostly Cloudy,False,False,False,False,False,False,False,False,False,False,False,True,False,Night,Night,Night,Night
C-5360594,2,2020-03-17 19:00:01,2020-03-20 07:00:01,41.31352,-81.98164,41.31574000000001,-82.06974,4.57458874322,Between CR-61/Station Rd and OH-57/Grafton Rd - Roadwork. Roadway reduced to 1 lane.,11900.0,Cowley Rd,L,Columbia Station,Lorain,OH,44028-9106,US,US/Eastern,KCLE,2020-03-17 18:51:00,45.0,41.0,58.0,29.42,10.0,WSW,7.0,0.0,Partly Cloudy,False,False,False,False,False,False,False,False,False,False,False,False,False,Day,Day,Day,Day
C-5360595,2,2021-09-14 19:32:00,2021-09-14 19:52:30,29.669604,-89.97778199999998,29.666839000000003,-89.97655400000002,0.204774873492,Stationary traffic on LA-23 from LA-11 (LA-23) to Lake Hermitage Rd (LA-23) due to roadwork.,15702.0,Highway 23,L,Belle Chasse,Plaquemines,LA,70037,US,US/Central,KNBG,2021-09-14 12:43:00,77.0,77.0,100.0,29.97,5.0,ENE,6.0,0.0,Light Rain,False,False,False,False,False,False,False,False,False,False,False,False,False,Night,Night,Day,Day
C-5360596,2,2019-04-03 05:40:12,2019-04-13 04:59:00,40.57275,-73.998108,,,0.180000007153,Road closed intermittently due to paving repairs on Surf Ave both ways from 31st St to 32nd St.,2988.0,W 32nd St,R,Brooklyn,Kings,NY,11224-1704,US,US/Eastern,KJRB,2019-04-03 05:51:00,42.0,39.0,67.0,29.84,10.0,VAR,5.0,0.0,Fair,False,False,True,False,False,False,False,False,False,False,False,True,False,Night,Night,Day,Day
C-5360597,2,2017-10-27 19:09:18,2017-10-28 01:11:44,40.16148,-74.90029,40.163939,-74.90015,0.170061461292,At PA-413/US-1-BR/Exit 44 - Roadwork. Lane blocked.,,I-95 N,R,Levittown,Bucks,PA,19056,US,US/Eastern,KPNE,2017-10-27 18:54:00,60.1,,51.0,30.1,10.0,South,3.5,,Clear,False,False,False,False,True,False,False,False,False,False,False,False,False,Night,Night,Night,Day
C-5360598,2,2020-12-11 22:23:11,2020-12-12 02:55:41,36.786421,-94.855345,36.771911,-94.855375,1.00254689231,Stationary traffic on OK-125 from E 160 Rd to E 170 Rd due to roadwork.,57097.0,E 160 Rd,R,Fairland,Ottawa,OK,74343-3219,US,US/Central,KGMJ,2020-12-11 22:15:00,41.0,35.0,81.0,29.01,10.0,WSW,10.0,0.0,Partly Cloudy,False,False,False,False,False,False,False,False,False,False,False,False,False,Night,Night,Night,Night
C-5360599,2,2021-12-16 17:27:01,2021-12-16 19:32:39,27.338918,-82.542686,27.339833,-82.546737,0.2565451245439999,Slow traffic on FL-45 - US-41 N - FL-780 from Central Ave to 5th St due to roadwork.,1401.0,Fruitville Rd,L,Sarasota,Sarasota,FL,34236,US,US/Eastern,KSRQ,2021-12-16 17:53:00,75.0,75.0,76.0,30.08,10.0,NW,6.0,0.0,Mostly Cloudy,False,False,False,False,False,False,False,False,False,False,False,True,False,Day,Day,Day,Day
C-5360600,2,2020-10-15 14:45:00,2020-10-16 02:00:00,40.746499,-93.173621,40.753379,-93.231371,3.0599461441400004,Construction on IA-2 WB near COUNTY HWY-S70 Expect delays.,1997.0,210th St,L,Promise City,Wayne,IA,52583-8706,US,US/Central,KTVK,2020-10-15 14:55:00,55.0,55.0,21.0,29.04,10.0,W,5.0,0.0,Fair,False,False,False,False,False,False,False,False,False,False,False,False,False,Day,Day,Day,Day
C-5360601,2,2021-06-13 20:00:00,2021-06-16 23:59:59,41.363191,-72.720677,41.359619,-72.721478,0.250272925045,Milling and paving operations on CT-77 southbound between ELM ST (Guilford) and CT-80 (Guilford) Motorists can expect lane closures on Route 77 from the Route 80 (Killingworth Road) to 0.20 mile North of Elm Street. Traffic control personnel and signing patterns will be utilized to guide motorists through the work zone Sunday June 13th 2021 thru Tuesday June 15th 2021 Sunday/Monday 08:00 PM thru 05:00 AM All lanes open Tuesday June 29th 2021 thru Thursday July 1st 2021 Tuesday/Wednesday 08:00 PM thru 05:00 AM All lanes open,2693.0,Durham Rd,R,Guilford,New Haven,CT,06437-1049,US,US/Eastern,KSNC,2021-06-13 19:55:00,68.0,68.0,68.0,29.46,10.0,S,8.0,0.0,Fair,False,False,False,False,False,False,False,False,False,False,False,False,False,Day,Day,Day,Day
C-5360602,2,2020-11-02 04:13:42,2020-11-04 23:59:00,36.065063,-89.34335300000002,,,0.0,Intermittent lane closures and speed restriction of 55 mph due to construction work on US-51 St John Ave both ways at US-412 State Hwy 20.,,TN-3,R,Dyersburg,Dyer,TN,38024,US,US/Central,KDYR,2020-11-02 03:53:00,33.0,29.0,75.0,30.23,10.0,NNW,5.0,0.0,Fair,False,False,False,False,False,False,False,False,False,False,False,False,False,Night,Night,Night,Night
C-5360603,2,2019-09-02 08:55:45,2019-09-06 08:55:07,34.06707,-118.39919,34.06705,-118.395772,0.1956367788329999,At Crescent Dr - Roadwork.,101.0,S Beverly Dr,R,Beverly Hills,Los Angeles,CA,90212-3002,US,US/Pacific,KSMO,2019-09-02 08:51:00,72.0,72.0,84.0,29.75,8.0,SW,3.0,0.0,Fair,False,False,False,False,False,False,False,False,True,False,False,True,False,Day,Day,Day,Day
C-5360604,2,2021-05-25 10:11:30,2021-05-25 12:14:00,39.704364,-100.255039,39.71533400000001,-100.217489,2.13496409638,Slow traffic on KS-383 from Washington Ave (Railroad St/KS-383) to Kansas Ave (KS-383) due to roadwork.,,County Road 509,R,Jennings,Decatur,KS,67643,US,US/Central,KHLC,2021-05-25 09:53:00,65.0,65.0,87.0,27.67,10.0,NW,7.0,0.0,Mostly Cloudy,False,False,False,False,False,False,False,False,False,False,False,False,False,Day,Day,Day,Day
C-5360605,2,2021-06-22 15:39:51,2021-06-23 00:24:51,44.673868,-117.982979,44.674601,-117.992955,0.49276449771,Construction on OR-7 NB near MP 35 Allow extra time.,18581.0,Sumpter Stage Hwy,R,Baker City,Baker,OR,97814,US,US/Pacific,KBKE,2021-06-22 15:53:00,80.0,80.0,43.0,26.43,10.0,NNW,10.0,0.0,Mostly Cloudy,False,False,False,False,False,False,False,False,False,False,False,False,False,Day,Day,Day,Day
C-5360606,2,2021-06-16 16:32:30,2021-09-01 19:13:34,42.518288,-83.165773,42.518831,-83.164873,0.0592306613646999,Stationary traffic from Maplewood Ave to W Windemere Ave due to roadwork.,1737.0,W 13 Mile Rd,L,Royal Oak,Oakland,MI,48073-2301,US,US/Eastern,KVLL,2021-09-01 15:55:00,78.0,78.0,36.0,29.17,10.0,N,13.0,0.0,Fair,False,False,False,False,False,False,False,False,False,False,False,False,False,Day,Day,Day,Day
C-5360607,2,2021-01-30 14:50:30,2021-01-30 23:26:12,26.441139,-80.07041,26.439809000000004,-80.0722,0.1439026048609999,Slow traffic on US-1 S - FL-5 from Banyan Tree Ln to Old Dixie Hwy / Linton Blvd due to roadwork.,1702.0,S Federal Hwy,R,Delray Beach,Palm Beach,FL,33483-5030,US,US/Eastern,KBCT,2021-01-30 14:53:00,71.0,71.0,51.0,30.15,10.0,E,13.0,0.0,Cloudy,False,False,True,False,False,False,False,False,False,False,False,False,False,Day,Day,Day,Day
C-5360608,2,2020-11-11 13:19:30,2020-11-12 00:54:30,43.633818,-116.357742,43.632425,-116.354506,0.188284582932,Stationary traffic on ID-55 from N Centrepoint Way to E Leslie Dr due to roadwork.,3048.0,E Ustick Rd,L,Meridian,Ada,ID,83646,US,US/Mountain,KMAN,2020-11-11 13:15:00,43.0,38.0,53.0,27.42,10.0,NNW,8.0,0.0,Partly Cloudy,False,False,False,False,False,False,False,False,False,False,False,False,False,Day,Day,Day,Day
C-5360609,2,2020-04-03 07:00:00,2020-07-20 07:45:00,34.25312,-81.25576,34.274604,-81.288749,2.3983292261400004,Construction on MONTICELLO RD WB near GLENNS BRIDGE RD Drive with caution.,13301.0,State Highway 215 S,R,Winnsboro,Fairfield,SC,29180-7591,US,US/Eastern,KFDW,2020-04-03 06:55:00,43.0,40.0,76.0,29.38,10.0,N,5.0,0.0,Fair,False,False,False,False,False,False,False,False,False,False,False,False,False,Night,Day,Day,Day
C-5360610,2,2021-07-23 11:30:00,2021-07-23 11:41:31,40.695228,-111.795936,40.703298,-111.795075,0.559404991448,Slow traffic on I-215 N from Exit 4 (I-215) to I-80/Exit 2 (I-215) due to roadwork.,,I-215 N,R,Salt Lake City,Salt Lake,UT,84109,US,US/Mountain,KSLC,2021-07-23 11:54:00,85.0,85.0,38.0,25.83,10.0,SW,5.0,0.0,Partly Cloudy,False,False,False,False,False,False,False,False,False,False,False,False,False,Day,Day,Day,Day
C-5360611,2,2021-07-22 15:55:00,2021-07-22 16:46:30,39.679271,-81.084189,39.70912,-81.09819499999998,2.1926783708200004,Slow traffic on OH-800 from CR-47/Coal Run Rd (Main St/OH-800) to OH-255 (Main St/OH-800) due to roadwork.,40481.0,State Route 800,L,Woodsfield,Monroe,OH,43793-9321,US,US/Eastern,KPKB,2021-07-22 15:53:00,80.0,80.0,45.0,29.26,10.0,VAR,7.0,0.0,Fair,False,False,False,False,False,False,False,False,False,False,False,False,False,Day,Day,Day,Day
C-5360612,2,2021-10-11 11:21:00,2021-10-11 12:03:30,44.879026,-124.032333,44.873837,-124.033842,0.3660593390599999,Stationary traffic on US-101 S - US-101 N from OR-229/Siletz Hwy (US-101) to S Southpoint St/Beach St (US-101) due to roadwork.,6524.0,N Highway 101,R,Gleneden Beach,Lincoln,OR,97388,US,US/Pacific,KONP,2021-10-11 11:15:00,52.0,52.0,76.0,30.19,4.0,SW,5.0,0.0,Haze,False,False,False,False,False,False,False,False,False,False,False,False,False,Day,Day,Day,Day
C-5360613,2,2020-12-01 19:22:28,2020-12-02 20:07:30,41.393331,-96.442631,41.370353,-96.416015,2.10345003035,Construction on US-275 EB near COUNTY RD Allow extra time.,,US-275 E,R,Valley,Douglas,NE,68064,US,US/Central,KFET,2020-12-01 19:15:00,33.0,33.0,63.0,28.8,10.0,CALM,0.0,0.0,Fair,False,False,False,False,False,False,False,False,False,False,False,False,False,Night,Night,Night,Night
C-5360614,2,2016-11-24 09:01:07,2016-11-24 15:01:07,39.312451,-76.465657,39.311145,-76.46889300000002,0.195111228551,At Hartman Ave - Construction work.,862.0,Eastern Blvd,L,Essex,Baltimore,MD,21221-3503,US,US/Eastern,KMTN,2016-11-24 08:45:00,42.8,,87.0,30.24,10.0,Calm,,,Overcast,False,False,True,False,False,False,False,False,False,False,False,True,False,Day,Day,Day,Day
C-5360615,2,2021-11-16 13:18:30,2021-11-16 15:41:05,25.843401,-80.266102,25.845931,-80.266155,0.174837415953,Stationary traffic on FL-953 from E 21st St (FL-953) to FL-932/E 49th St (FL-953) due to roadwork.,798.0,E 23rd St,R,Hialeah,Miami-Dade,FL,33013-3914,US,US/Eastern,KOPF,2021-11-16 12:53:00,78.0,78.0,54.0,30.14,10.0,E,16.0,0.0,Fair,False,False,False,False,False,False,False,False,True,False,False,False,False,Day,Day,Day,Day
C-5360616,2,2020-11-17 12:51:54,2020-11-21 10:58:34,28.41159600000001,-80.820573,28.408687,-80.795648,1.52802160661,Roadwork on FL-407 (FL-528) from FL-501/FL-524/Industry Rd (FL-528) to FL-528 E.,,Martin Anderson Beachline Expy,R,Cocoa,Brevard,FL,32926,US,US/Eastern,KTIX,2020-11-17 12:47:00,79.0,79.0,42.0,30.19,7.0,N,13.0,,Fair,False,False,False,False,False,False,False,False,False,False,False,False,False,Day,Day,Day,Day
C-5360617,2,2021-11-23 11:50:15,2021-11-23 12:10:15,34.910361,-78.96077700000002,34.905254,-78.96529699999998,0.4360080897439999,Stationary traffic on US-301 S - US-301 N from Shipman Rd (US-301) to NC-1902/NC-71/E Everette Rd (US-301) due to roadwork.,23127.0,US Highway 301,L,Parkton,Robeson,NC,28371-9598,US,US/Eastern,KFAY,2021-11-23 11:53:00,46.0,40.0,35.0,29.98,10.0,N,14.0,0.0,Fair,False,False,False,False,False,False,False,False,False,True,False,False,False,Day,Day,Day,Day
C-5360618,2,2021-12-27 22:31:00,2021-12-28 02:54:41,46.13186500000001,-123.163549,46.135905,-123.161872,0.290456466368,Roadwork from Beaver Falls Rd to Easter Dr.,78328.0,Quincy Mayger Rd,R,Clatskanie,Columbia,OR,97016-2137,US,US/Pacific,KKLS,2021-12-27 22:56:00,28.0,28.0,88.0,29.81,6.0,CALM,0.0,0.0,Light Snow,False,False,False,False,False,False,False,False,False,False,False,False,False,Night,Night,Night,Night
C-5360619,2,2021-09-10 16:03:30,2021-09-10 18:13:10,41.88313,-88.341502,41.888327,-88.340251,0.364798903495,Slow traffic on County Hwy-41 from Delnor Dr / Lark St to Williamsburg Ave due to roadwork.,,37W047 Keslinger Rd,R,Geneva,Kane,IL,60134,US,US/Central,KDPA,2021-09-10 15:52:00,79.0,79.0,39.0,29.19,10.0,S,10.0,0.0,Fair,False,False,False,False,False,False,False,False,False,False,False,False,False,Day,Day,Day,Day
C-5360620,2,2021-06-29 09:37:57,2021-06-29 17:23:00,41.710249,-72.699247,41.724299,-72.670927,1.7537545490900002,Construction on CT-15 NB near EXIT 85 Construction. Right lane closed.,1648.0,Berlin Tpke,L,Wethersfield,Hartford,CT,06109-1304,US,US/Eastern,KHFD,2021-06-29 09:53:00,88.0,88.0,61.0,30.15,10.0,CALM,0.0,0.0,Fair,False,False,False,False,True,False,False,False,False,False,False,True,False,Day,Day,Day,Day
C-5360621,2,2019-01-30 09:03:45,2019-02-06 09:01:26,30.21877000000001,-90.84316,30.19207,-90.8524,1.92553525362,At St Amant St - Construction work.,10201.0,Highway 429,L,Saint Amant,Ascension,LA,70774-4500,US,US/Central,KL38,2019-01-30 08:53:00,38.0,33.0,53.0,30.26,10.0,ENE,7.0,0.0,Fair,False,False,False,False,False,False,False,False,False,False,False,False,False,Day,Day,Day,Day
C-5360622,2,2019-07-08 21:02:36,2019-07-12 21:02:04,25.88974,-80.198172,25.88926,-80.20881,0.662079170956,At I-95/SR-9a - Construction work.,20.0,NE 125th St,R,North Miami,Miami-Dade,FL,33161-4501,US,US/Eastern,KOPF,2019-07-08 20:53:00,76.0,76.0,94.0,29.95,10.0,CALM,0.0,0.0,Fair,False,False,False,False,False,False,False,False,True,False,False,True,False,Night,Night,Day,Day
C-5360623,2,2020-05-11 07:00:00,2020-10-02 10:50:14,46.785992,-89.032535,46.797756,-89.01895400000002,1.03605330073,Construction on MI-26 NB near FIRESTEEL RIVER EAST BRANCH Expect delays.,,M-26,R,Ontonagon,Ontonagon,MI,49953,US,US/Eastern,KCMX,2020-05-11 06:53:00,27.0,20.0,53.0,29.01,10.0,N,6.0,0.0,Fair,False,False,False,False,False,False,False,False,False,False,False,False,False,Day,Day,Day,Day
C-5360624,2,2020-09-02 18:30:30,2020-09-02 20:02:30,40.411898,-81.349852,40.409555,-81.349561,0.162608148933,Stationary traffic on US-250 from Barnhill Rd (US-250) to US-36/Water St (OH-800/US-250) due to resurfacing work.,,OH-800 S,R,Uhrichsville,Tuscarawas,OH,44683,US,US/Eastern,KPHD,2020-09-02 18:53:00,78.0,78.0,74.0,28.9,10.0,W,9.0,0.0,Fair,False,False,False,False,False,False,False,False,False,False,False,False,False,Day,Day,Day,Day
C-5360625,2,2019-04-16 09:03:29,2019-04-21 09:01:32,32.936598,-96.68282,32.932573,-96.68282,0.278101013686,At Jupiter Rd - Construction work. Right lane closed.,876.0,S Jupiter Rd,L,Richardson,Dallas,TX,75081,US,US/Central,KADS,2019-04-16 08:47:00,63.0,63.0,82.0,29.31,10.0,S,15.0,0.0,Mostly Cloudy,False,False,False,False,False,False,False,False,False,False,False,False,False,Day,Day,Day,Day
