ID,Severity,Start_Time,End_Time,Start_Lat,Start_Lng,End_Lat,End_Lng,Distance(mi),Description,Number,Street,Side,City,County,State,Zipcode,Country,Timezone,Airport_Code,Weather_Timestamp,Temperature(F),Wind_Chill(F),Humidity(%),Pressure(in),Visibility(mi),Wind_Direction,Wind_Speed(mph),Precipitation(in),Weather_Condition,Amenity,Bump,Crossing,Give_Way,Junction,No_Exit,Railway,Roundabout,Station,Stop,Traffic_Calming,Traffic_Signal,Turning_Loop,Sunrise_Sunset,Civil_Twilight,Nautical_Twilight,Astronomical_Twilight
C-2522447,4,2021-06-17 21:00:00,2021-06-18 05:00:00,32.939251,-97.313103,,,0.52999997139,Road closed due to construction work on I-35 Svrd Northbound from Golden Triangle Blvd to Lovejoy Dr.,11200.0,North Fwy,R,Fort Worth,Tarrant,TX,76177-6900,US,US/Central,KAFW,2021-06-17 20:53:00,89.0,89.0,48.0,29.18,10.0,S,9.0,0.0,Mostly Cloudy,False,False,False,False,False,False,False,False,False,False,False,False,False,Night,Day,Day,Day
C-2522448,2,2021-06-19 13:23:03,2021-06-19 13:48:04,43.991963,-71.04998499999998,43.994002,-71.039837,0.5237358067710001,Stationary traffic on US-302 E - NH-113 - US-302 W from Mill St (NH-113/E Main St/US-302) to ME-5/Main St (US-302) due to roadwork.,1920.0,E Main St,L,Center Conway,Carroll,NH,03813-4118,US,US/Eastern,KIZG,2021-06-19 12:54:00,84.0,84.0,40.0,29.16,10.0,S,6.0,0.0,Fair,False,False,False,False,False,False,False,False,False,False,False,False,False,Day,Day,Day,Day
C-2522449,2,2018-12-11 09:00:00,2018-12-11 15:00:00,40.681995,-76.190216,,,0.0,Intermittent lane closures due to construction work on PA-61 Claude A Lord Blvd both ways at PA-61 Claude A Lord Blvd / US-209 Centre St / US-209 Mauch Chunk St.,400.0,S Claude A Lord Blvd,L,Pottsville,Schuylkill,PA,17901-3963,US,US/Eastern,KRDG,2018-12-11 08:54:00,23.0,,96.0,30.18,10.0,Calm,,,Clear,False,False,False,False,False,False,False,False,False,False,False,True,False,Day,Day,Day,Day
C-2522450,2,2019-09-11 08:00:00,2019-09-12 16:00:00,38.94133,-105.15916,38.941243,-105.159535,0.0210299775735999,At CR-42/Lower Twin Rock Rd - Construction work.,11062.0,US Highway 24,R,Divide,Teller,CO,80814-9241,US,US/Mountain,KAFF,2019-09-11 07:58:00,66.0,66.0,38.0,23.59,10.0,CALM,0.0,0.0,Mostly Cloudy,False,False,False,False,False,False,False,False,False,False,False,False,False,Day,Day,Day,Day
C-2522451,2,2020-08-31 14:30:00,2020-08-31 16:39:26,28.563734000000004,-81.37786700000002,28.558164,-81.381297,0.43753463788,Roadwork on I-4 from Ivanhoe Blvd/Exit 4 (I-4) to US-17/US-92/Colonial Dr (I-4).,,I-4 W,R,Orlando,Orange,FL,32804,US,US/Eastern,KORL,2020-08-31 14:21:00,77.0,77.0,94.0,29.87,8.0,WNW,6.0,0.03,Light Rain,False,False,False,False,True,False,False,False,False,False,False,False,False,Day,Day,Day,Day
C-2522452,2,2021-03-30 05:21:03,2021-04-10 11:52:35,40.715824,-73.994919,40.71990200000001,-74.002583,0.4903785682159999,Slow traffic from Allen St/Avenue of the Immigrants (Canal St) to Church St (Canal St) due to roadwork.,,Canal St,R,New York,New York,NY,10002,US,US/Eastern,KJRB,2021-03-30 05:51:00,43.0,43.0,53.0,30.27,10.0,VAR,3.0,0.0,Fair,True,False,True,False,False,False,False,False,False,False,False,True,False,Night,Night,Night,Day
C-2522453,4,2021-10-16 04:40:14,2021-10-18 23:59:00,42.360377,-71.056719,42.361014,-71.056963,0.0457414938803,Closed road from North St to Hanover St due to roadwork.,5.0,North St,L,Boston,Suffolk,MA,02109-1601,US,US/Eastern,KBOS,2021-10-16 04:54:00,66.0,66.0,90.0,29.81,10.0,S,12.0,0.0,Cloudy,True,False,True,False,False,False,False,False,False,False,False,True,False,Night,Night,Night,Night
C-2522454,2,2020-09-14 16:00:00,2020-09-14 23:15:00,40.505508,-74.450172,40.500898,-74.44282199999998,0.500561952194,Construction on NJ-18 SB near BISHOP PL Construction. Left lane closed.,,NJ-18,R,New Brunswick,Middlesex,NJ,08901,US,US/Eastern,KLDJ,2020-09-14 15:55:00,76.0,76.0,40.0,30.09,10.0,NNW,10.0,0.0,Mostly Cloudy,False,False,False,False,True,False,False,False,False,False,False,False,False,Day,Day,Day,Day
C-2522455,2,2020-09-17 12:13:30,2020-09-17 15:56:58,39.615513,-86.473904,39.615435,-86.479784,0.3130123286239999,Stationary traffic on IN-39 from IN-39 exit [59] to E County Road 1000 S / Koger St due to roadwork.,,I-70 W,R,Mooresville,Hendricks,IN,46158,US,US/Eastern,KIND,2020-09-17 11:54:00,75.0,75.0,55.0,29.17,10.0,NE,7.0,0.0,Partly Cloudy,False,False,False,False,False,False,False,False,False,False,False,False,False,Day,Day,Day,Day
C-2522456,2,2020-09-30 07:25:00,2020-10-02 08:10:57,25.874851,-80.388067,25.899761,-80.38564699999998,1.7276783554,Construction on FLORIDA'S TPKE NB near EXIT 34 Construction. Left lane closed.,,Florida's Tpke N,R,Miami,Miami-Dade,FL,33178,US,US/Eastern,KMIA,2020-09-30 07:53:00,80.0,80.0,87.0,29.92,10.0,CALM,0.0,0.0,Partly Cloudy,False,False,False,False,False,False,False,False,False,False,False,False,False,Day,Day,Day,Day
C-2522457,3,2019-07-09 10:00:00,2019-07-09 14:00:00,40.63586,-74.018005,,,0.0,Right lane blocked due to construction work on I-278 Brooklyn Queens Expy Westbound at 6th Avenue.,540.0,65th St,R,Brooklyn,Kings,NY,11220-4919,US,US/Eastern,KJRB,2019-07-09 09:51:00,78.0,78.0,62.0,29.89,10.0,NE,6.0,0.0,Fair,False,False,False,False,False,False,False,False,False,False,False,False,False,Day,Day,Day,Day
C-2522458,2,2018-10-01 07:00:00,2018-10-01 17:00:00,28.035095,-82.104805,,,0.0,Intermittent lane closures due to new traffic signals and installation on FL-601 Park Rd both ways at Frontage Rd.,1998.0,S Frontage Rd,L,Plant City,Hillsborough,FL,33563,US,US/Eastern,KPCM,2018-10-01 06:55:00,75.2,,94.0,30.14,10.0,NNE,4.6,,Clear,False,False,True,False,False,False,False,False,False,False,False,True,False,Night,Day,Day,Day
C-2522459,2,2020-07-01 16:01:00,2020-07-01 22:46:00,34.032973,-118.137434,34.033193,-118.114304,1.32448147108,Construction on CA-60 EB near PORTRERO GRANDE DR Expect delays.,,CA-60 E,R,Montebello,Los Angeles,CA,90640,US,US/Pacific,KEMT,2020-07-01 15:53:00,78.0,78.0,50.0,29.76,10.0,SSW,6.0,0.0,Fair,False,False,False,False,False,False,False,False,False,False,False,False,False,Day,Day,Day,Day
C-2522460,2,2019-02-06 06:43:47,2019-05-07 15:34:25,40.21992,-76.786821,40.194397,-76.686302,5.58962519623,Between S Eisenhower Blvd and Toll House Rd - Roadwork. Traffic problem.,,PA-283 W,R,Middletown,Dauphin,PA,17057,US,US/Eastern,KMDT,2019-02-06 06:56:00,33.1,,92.0,30.18,6.0,Calm,,,Mostly Cloudy,False,False,False,False,False,False,False,False,False,False,False,False,False,Night,Day,Day,Day
C-2522461,2,2021-06-17 22:01:00,2021-06-18 05:44:00,33.751534,-118.01283,33.763144,-118.02677,1.13345456716,Lane closure due to K-rail Installation between Westminster Ave and Valley View St,,I-405 N,R,Westminster,Orange,CA,92683,US,US/Pacific,KSLI,2021-06-17 21:58:00,64.0,64.0,100.0,29.78,7.0,S,7.0,0.0,Cloudy,False,False,False,False,False,False,False,False,False,False,False,False,False,Night,Night,Night,Night
C-2522463,2,2020-10-06 15:00:00,2020-10-06 23:00:00,36.940959,-76.537038,36.940779,-76.538268,0.0690538974269,On US-258 in the County of Isle Of Wight from Access; Deep Bottom Dr; Rt. 662E/W (Isle of Wight County) to Carrollton Blvd; US-17N motorists can expect potential delays in this area from 10/06/20 at 8:00 AM until 10/06/20 at 4:00 PM due to maintenance activities. The east right shoulder is closed. The west right shoulder is closed.,,Brewers Neck Blvd,R,Carrollton,Isle of Wight,VA,23314,US,US/Eastern,KPHF,2020-10-06 14:54:00,75.0,75.0,46.0,30.05,10.0,SSW,8.0,0.0,Fair,False,False,False,False,False,False,False,False,False,False,False,True,False,Day,Day,Day,Day
C-2522464,3,2021-11-12 22:00:00,2021-11-13 07:00:00,41.871319,-87.91812900000002,,,2.67000007629,Right lane closed due to construction work on I-294 Tri-State Tollway Northbound between Exit 29 I-88 and I-290 Eisenhower Expy.,,I-294 S,R,Hillside,Cook,IL,60162,US,US/Central,KORD,2021-11-12 21:51:00,36.0,27.0,86.0,29.09,10.0,W,14.0,0.0,Wintry Mix,False,False,False,False,False,False,False,False,False,False,False,False,False,Night,Night,Night,Night
C-2522465,2,2020-12-25 08:58:00,2020-12-25 09:20:00,34.157336,-96.259726,34.135435,-96.271528,1.65688276137,Slow traffic on US-69 S - US-75 S from E1860 Rd/Boggy Depot Rd (US-75/US-69) to OK-22 (US-75/US-69) due to roadwork.,,US-69 S,R,Caddo,Bryan,OK,74729,US,US/Central,KDUA,2020-12-25 08:55:00,37.0,37.0,56.0,29.57,10.0,CALM,0.0,0.0,Fair,False,False,False,False,False,False,False,False,False,False,False,False,False,Day,Day,Day,Day
C-2522466,2,2021-02-14 23:38:00,2021-02-15 00:32:00,34.538387,-92.669553,34.52506,-92.682824,1.19100576997,Slow traffic on AR-88 W - US-70 W - I-30 W from US-67/Exit 114 (I-30) to Old Military Rd/Exit 106 (I-30) due to roadwork.,,AR-88 W,R,Benton,Saline,AR,72015,US,US/Central,KLIT,2021-02-14 23:53:00,14.0,-1.0,77.0,30.03,3.0,N,15.0,0.0,Light Snow,False,False,False,False,False,False,False,False,False,False,False,False,False,Night,Night,Night,Night
C-2522467,3,2020-03-23 08:00:00,2020-03-27 16:00:00,42.664112,-71.194603,,,25.0599994659,Intermittent lane closures due to Sweeping on I-495 both ways from Lowell Connector to I-93.,,I-495 S,R,Andover,Essex,MA,01810,US,US/Eastern,KLWM,2020-03-23 07:54:00,28.0,23.0,72.0,30.5,10.0,ENE,5.0,0.0,Cloudy,False,False,False,False,False,False,False,False,False,False,False,False,False,Day,Day,Day,Day
C-2522468,2,2019-11-21 00:01:00,2019-12-21 23:59:00,42.982365,-87.909706,,,0.0,Right lane blocked due to construction on WI-38 Chase Ave Northbound at Holt Ave.,,W Holt Ave,R,Milwaukee,Milwaukee,WI,53207,US,US/Central,KMKE,2019-11-21 00:52:00,43.0,37.0,82.0,29.22,8.0,S,10.0,0.0,Cloudy,False,False,True,True,False,False,False,False,False,False,False,True,False,Night,Night,Night,Night
C-2522469,2,2021-03-31 06:00:00,2021-03-31 20:45:00,34.713221000000004,-86.670971,34.732762,-86.670029,1.35121387669,Construction on RESEARCH PARK BLVD NB near OLD MADISON PIKE Allow extra time.,,Highway 255,R,Huntsville,Madison,AL,35806,US,US/Central,KHUA,2021-03-31 05:58:00,64.0,64.0,99.0,29.24,7.0,SSW,7.0,0.07,Light Rain,False,False,False,False,False,False,False,False,False,False,False,False,False,Night,Night,Day,Day
C-2522470,4,2020-10-21 16:37:19,2020-10-29 06:59:00,33.490194,-84.452097,33.490217,-84.449802,0.132253279939,Closed road from Longview Rd to Highway 314 due to roadwork.,799.0,Roberts Rd,L,Fayetteville,Fayette,GA,30214-7241,US,US/Eastern,KFFC,2020-10-21 16:53:00,79.0,79.0,64.0,29.29,10.0,E,5.0,0.0,Fair,False,False,False,False,False,False,False,False,False,False,False,False,False,Day,Day,Day,Day
C-2522471,2,2021-11-07 12:38:19,2021-12-30 23:59:00,40.600229,-73.995586,40.602531,-73.9932,0.202398206479,Slow traffic from Belt Pkwy/Leif Ericson Dr (Bay Pkwy) to Bay Ridge Pkwy (Bay Pkwy) due to roadwork.,8684.0,Bay Pkwy,R,Brooklyn,Kings,NY,11214-4102,US,US/Eastern,KJRB,2021-11-07 12:51:00,53.0,53.0,41.0,30.06,10.0,VAR,5.0,0.0,Fair,True,False,True,False,False,False,False,False,False,False,False,True,False,Day,Day,Day,Day
C-2522472,2,2019-02-04 00:43:18,2021-12-23 15:38:08,41.645497,-124.113035,41.642375,-124.115435,0.248769906404,Roadwork on Humboldt Rd/Endert Beach Rd (Redwood Hwy/US-101) from Wilson Creek Rd (Redwood Hwy/US-101) to US-101 S - US-101 N.,,US Highway 101 N,R,Klamath,Del Norte,CA,95548,US,US/Pacific,KCEC,2021-08-12 18:56:00,56.0,56.0,90.0,29.95,10.0,S,6.0,0.0,Fair,False,False,False,False,False,False,False,False,False,False,False,False,False,Night,Night,Night,Night
C-2522473,2,2021-02-19 20:01:00,2021-02-20 10:46:00,34.070941999999995,-117.865705,34.071433,-117.86725,0.0947094115273,Lane closure due to Paving Operation between Holt Ave and Azusa Ave Route 39,,I-10 W,R,West Covina,Los Angeles,CA,91791,US,US/Pacific,KPOC,2021-02-19 20:47:00,50.0,50.0,50.0,29.07,10.0,CALM,0.0,,Fair,False,False,False,False,False,False,False,False,False,False,False,False,False,Night,Night,Night,Night
C-2522474,2,2020-04-01 07:32:23,2020-04-02 19:32:19,42.7194,-87.86301,42.71958,-87.86669,0.187217045071,At S Stuart Rd/Willow Rd - Roadwork. Two lanes closed.,1249.0,Sunnyslope Dr,R,Racine,Racine,WI,53406,US,US/Central,KRAC,2020-04-01 07:53:00,38.0,30.0,93.0,29.37,10.0,NNE,13.0,0.0,Cloudy,False,False,False,False,False,False,False,False,True,False,False,True,False,Day,Day,Day,Day
C-2522475,2,2021-08-29 20:00:00,2021-08-30 05:00:00,36.868305,-76.194953,36.86046,-76.195461,0.542764806578,On I-64 in the City of Norfolk from mile marker 284 to mile marker 282.8 motorists can expect potential delays in this area from 08/29/21 at 8:00 PM until 08/30/21 at 5:00 AM due to paving operations. The west right center lane right lane and right shoulder are closed.,,I-64 E,R,Norfolk,Norfolk,VA,23502,US,US/Eastern,KORF,2021-08-29 19:59:00,81.0,81.0,77.0,30.05,9.0,NNE,7.0,0.0,Partly Cloudy,False,False,False,False,False,False,False,False,False,False,False,False,False,Night,Day,Day,Day
C-2522476,2,2021-09-10 14:51:53,2021-09-10 16:57:50,40.600077,-73.965963,40.597985,-73.96410300000002,0.174397001881,Slow traffic on Ocean Pkwy from Avenue T to E 7th St due to roadwork.,,Ocean Pkwy,R,Brooklyn,Kings,NY,11223,US,US/Eastern,KJRB,2021-09-10 14:51:00,73.0,73.0,39.0,29.81,10.0,VAR,6.0,0.0,Fair,False,False,True,False,False,False,False,False,False,False,False,True,False,Day,Day,Day,Day
C-2522477,4,2020-07-26 18:47:30,2020-09-26 06:59:00,44.898014,-93.318823,44.898077,-93.331314,0.611366071958,Closed road from Xerxes Ave S to Halifax Ave S due to roadwork.,5798.0,Xerxes Ave S,R,Minneapolis,Hennepin,MN,55410-2639,US,US/Central,KMSP,2020-07-26 20:53:00,78.0,78.0,66.0,29.06,10.0,NNW,14.0,0.0,Partly Cloudy,False,False,False,False,False,False,False,False,True,False,False,False,False,Day,Day,Day,Day
C-2522478,2,2020-11-13 17:01:00,2020-11-13 23:46:00,32.998391,-117.083112,32.989541,-117.083072,0.611481156647,Construction on I-15 SB near CAMINO DEL NORTE Expect delays.,,Escondido Fwy S,R,San Diego,San Diego,CA,92128,US,US/Pacific,KRNM,2020-11-13 16:53:00,56.0,56.0,72.0,28.61,10.0,WNW,7.0,0.0,Fair,False,False,False,False,False,False,False,False,False,False,False,False,False,Night,Day,Day,Day
C-2522479,2,2021-08-02 04:56:41,2021-08-08 02:56:57,41.194539,-76.31209100000002,41.193827,-76.315216,0.169757939531,Roadwork on Shickshinney Lake Rd (PA-239) from PA-487/Main St (Mill St/PA-239) to PA-239.,999.0,Bonnieville Rd,L,Stillwater,Luzerne,PA,17878-9249,US,US/Eastern,KIPT,2021-08-02 04:54:00,60.0,60.0,90.0,29.37,10.0,W,7.0,0.0,Cloudy,False,False,False,False,False,False,False,False,False,False,False,False,False,Night,Night,Day,Day
C-2522480,2,2020-09-28 14:04:00,2020-09-29 02:48:30,41.769493,-112.266315,41.796513,-112.292855,2.31409488802,Slow traffic on I-84 from 1000/Exit 39 (I-84) to Whites Valley Rd/Exit 32 (I-84) due to roadwork.,,I-84 W,R,Snowville,Box Elder,UT,84336,US,US/Mountain,KMLD,2020-09-28 13:51:00,61.0,61.0,25.0,25.85,10.0,N,7.0,0.0,Fair,False,False,False,False,False,False,False,False,False,False,False,False,False,Day,Day,Day,Day
C-2522481,2,2021-10-29 21:50:00,2021-10-29 22:13:30,43.88460900000001,-111.656019,43.885979,-111.659346,0.190811199878,Stationary traffic on ID-33 from 1300 (ID-33) to Center St (ID-33) due to roadwork.,,ID-33,R,Teton,Fremont,ID,83451,US,US/Mountain,KRXE,2021-10-29 21:53:00,53.0,53.0,59.0,25.08,10.0,S,13.0,0.0,Fair,False,False,False,False,False,False,False,False,False,False,False,False,False,Night,Night,Night,Night
C-2522482,2,2021-02-24 03:24:00,2021-02-24 04:07:00,32.5419,-93.620778,32.53794,-93.637668,1.02112980657,Stationary traffic on I-20 W from LA-157/Exit 33 (I-20) to Exit 26 (I-20) due to roadwork.,,I-20 W,R,Barksdale AFB,Bossier,LA,71110,US,US/Central,KBAD,2021-02-24 02:56:00,44.0,39.0,75.0,29.8,10.0,SSE,8.0,0.0,Fair,False,False,False,False,False,False,False,False,False,False,False,False,False,Night,Night,Night,Night
C-2522483,2,2019-06-16 09:00:00,2019-06-21 15:00:00,40.19846,-75.163063,,,9.06999969482,Lane closed due to resurfacing work on PA-463 Horsham Rd both ways from Lower State Rd to Tournament Dr.,,Tournament Dr,R,Horsham,Montgomery,PA,19044,US,US/Eastern,KLOM,2019-06-16 08:55:00,73.0,73.0,67.0,29.58,10.0,S,10.0,0.0,Fair,False,False,True,False,False,False,False,False,False,False,False,True,False,Day,Day,Day,Day
C-2522484,2,2021-02-22 00:00:00,2021-12-27 03:02:48,26.273849,-80.188261,26.27503,-80.186258,0.148520086831,Slow traffic on FL-834 from Fishermans Dr to Coral Tree Ter / Coral Tree Cir due to roadwork.,4710.0,W Sample Rd,R,Pompano Beach,Broward,FL,33063,US,US/Eastern,KFXE,2021-12-07 08:53:00,71.0,71.0,84.0,30.09,10.0,NNW,5.0,0.0,Fair,False,False,False,False,False,False,False,False,False,False,False,False,False,Night,Night,Night,Night
C-2522485,2,2020-10-15 05:55:00,2020-10-15 07:12:00,30.323305,-91.006808,30.349278,-91.031757,2.33108291721,Queuing traffic on I-10 from LA-73/Exit 173 (I-10) to LA-427/Exit 166 (I-10) due to roadwork.,,I-10 W,R,Prairieville,Ascension,LA,70769,US,US/Central,KL38,2020-10-15 05:53:00,63.0,63.0,97.0,29.85,5.0,CALM,0.0,0.0,Fair,False,False,False,False,False,False,False,False,False,False,False,False,False,Night,Night,Night,Day
C-2522486,2,2021-09-30 12:52:30,2021-09-30 13:13:30,39.763708,-86.335352,39.763001,-86.336865,0.0940405050176,Slow traffic on US-36 E - US-36 W from Washington to Conrail Railroad due to roadwork.,10619.0,E US Highway 36,R,Avon,Hendricks,IN,46123-7983,US,US/Eastern,KIND,2021-09-30 12:54:00,74.0,74.0,62.0,29.31,10.0,ESE,5.0,0.0,Mostly Cloudy,False,False,False,False,False,False,False,False,False,False,False,False,False,Day,Day,Day,Day
C-2522487,2,2021-09-27 17:28:07,2021-09-27 17:49:22,32.55113,-97.127325,32.549093,-97.128682,0.161414831179,Slow traffic on US-287 Bus S - US-287 Bus N - FM-157 - TX-496 from S Wisteria St to Comal Dr due to roadwork.,1191.0,Heritage Pkwy,R,Mansfield,Tarrant,TX,76063-2761,US,US/Central,KGKY,2021-09-27 17:53:00,90.0,90.0,27.0,29.26,10.0,SE,5.0,0.0,Fair,False,False,False,False,False,False,False,False,False,False,False,False,False,Day,Day,Day,Day
C-2522488,2,2018-06-02 00:01:00,2018-06-02 06:00:00,40.740101,-73.845428,,,1.7599999904599997,Two lanes closed due to construction work on Grand Central Pkwy Westbound between Exits 11 11E-W 12 Jewel Ave and Exits 10E-W 10W-E I-495 Long Island Expy.,,Grand Central Pkwy W,R,Corona,Queens,NY,11368,US,US/Eastern,KLGA,2018-06-02 00:51:00,73.0,,84.0,29.71,8.0,East,4.6,0.0,Light Rain,False,False,False,False,False,False,False,False,False,False,False,False,False,Night,Night,Night,Night
C-2522489,2,2020-04-02 09:27:48,2020-04-02 17:00:00,42.06913,-76.10028,42.06100000000001,-76.12605,1.43624853649,Between CR-36/Castle Gardens Rd and RT-17 (East) - Roadwork. Right lane closed.,2424.0,Vestal Pkwy W,R,Vestal,Broome,NY,13850-1056,US,US/Eastern,KBGM,2020-04-02 09:53:00,37.0,27.0,59.0,28.12,10.0,N,20.0,0.0,Cloudy,False,False,False,False,False,False,False,False,False,False,False,True,False,Day,Day,Day,Day
C-2522490,2,2020-09-02 13:35:00,2020-09-02 15:58:00,39.449619,-81.64666700000002,39.440239,-81.65571700000002,0.8082063106659999,Stationary traffic on OH-339 from OH-676/Lancaster St (OH-339) to OH-550 (OH-339) due to roadwork.,12322.0,State Route 339,R,Vincent,Washington,OH,45784-5456,US,US/Eastern,KPKB,2020-09-02 13:53:00,81.0,81.0,72.0,28.93,10.0,WSW,14.0,0.0,Cloudy,False,False,False,False,False,False,False,False,False,False,False,False,False,Day,Day,Day,Day
C-2522491,4,2018-09-11 08:31:56,2018-09-11 13:31:21,33.76723,-118.20567,33.76675,-118.211373,0.329241788014,Closed at Long Beach Fwy - Closed. Construction work.,,W Ocean Blvd,R,Long Beach,Los Angeles,CA,90802,US,US/Pacific,KLGB,2018-09-11 08:53:00,69.1,,73.0,29.88,10.0,Variable,4.6,,Overcast,False,False,False,False,True,False,False,False,False,False,False,False,False,Day,Day,Day,Day
C-2522492,2,2021-09-02 03:13:12,2021-09-02 06:01:00,34.154041,-118.325699,,,0.7699999809270001,Exit ramp from CA-134 Westbound at Exit 3 to W Riverside Dr closed due to paving repairs.,,CA-134 W,R,Burbank,Los Angeles,CA,91506,US,US/Pacific,KBUR,2021-09-02 02:53:00,67.0,67.0,73.0,29.07,10.0,S,3.0,0.0,Cloudy,False,False,False,False,False,False,False,False,False,False,False,False,False,Night,Night,Night,Night
C-2522493,2,2021-09-02 19:36:44,2021-11-13 12:46:33,47.623482,-111.210685,47.58959,-111.239144,2.6909475302,Construction on US-87 SB near MP 4 Expect delays.,,US Highway 87,R,Floweree,Cascade,MT,59440,US,US/Mountain,KGFA,2021-09-02 19:58:00,57.0,57.0,48.0,26.45,10.0,NE,8.0,0.0,Fair,False,False,False,False,False,False,False,False,False,False,False,False,False,Day,Day,Day,Day
C-2522494,2,2021-04-26 08:47:15,2021-04-26 16:12:24,40.241889,-79.57757,40.238511,-79.57994000000002,0.264762246565,Slow traffic on US-119 S from Fairview St (US-119) to Burton Ave (US-119) due to roadwork.,115.0,N 4th St,R,Youngwood,Westmoreland,PA,15697-1307,US,US/Eastern,KLBE,2021-04-26 08:50:00,39.0,36.0,56.0,28.96,10.0,VAR,5.0,0.0,Fair,False,False,False,False,False,False,False,False,False,False,False,False,False,Day,Day,Day,Day
C-2522495,2,2021-11-08 08:00:30,2021-11-08 08:22:30,32.080298,-106.482807,32.08664,-106.484501,0.449271983191,Stationary traffic on NM-213 from Nike Air Rd to White Sands due to roadwork.,45.0,War Rd,R,Chaparral,Doña Ana,NM,88081-7366,US,US/Mountain,KBIF,2021-11-08 07:51:00,56.0,56.0,36.0,26.11,10.0,CALM,0.0,0.0,Cloudy,False,False,False,False,False,False,False,False,False,False,False,False,False,Day,Day,Day,Day
C-2522496,2,2021-10-24 00:00:00,2021-11-27 10:45:00,41.9902,-72.601039,41.990114,-72.601456,0.0222238620049999,CT DOT-Newington-HWY-Oper Ctr: bridge work on CT-190 westbound BIRCH ST (Enfield) to CT-159 (Suffield) anticpate off peak lane closures and allow for extra travel time Wednesday September 2nd 2020 thru Saturday November 27th 2021 Sunday/Monday/Tuesday,,CT-190,R,Enfield,Hartford,CT,06082,US,US/Eastern,KBDL,2021-10-24 00:51:00,43.0,39.0,86.0,29.81,10.0,NW,6.0,0.0,Fair,False,False,False,False,False,False,False,False,False,False,False,False,False,Night,Night,Night,Night
C-2522497,4,2018-11-27 20:02:51,2018-11-28 01:02:28,32.959140000000005,-97.03954,32.96658,-97.0371,0.5331608311129999,Closed at Exit 36B - Closed due to roadwork.,2011.0,N Highway 121,R,Grapevine,Tarrant,TX,76051-2079,US,US/Central,KDFW,2018-11-27 19:53:00,52.0,,45.0,30.02,10.0,South,9.2,,Partly Cloudy,False,False,False,False,False,False,False,False,False,False,False,False,False,Night,Night,Night,Night
C-2522498,2,2020-09-11 13:50:30,2020-09-12 05:03:12,39.710825,-86.375847,39.709179,-86.381649,0.328694016046,Stationary traffic on IN-267 from US-40/E Main St (Plainfield) (South) (Quaker Blvd/IN-267) to Simmons St (US-40/E Main St/IN-267) due to construction work.,1864.0,E Main St,R,Plainfield,Hendricks,IN,46168-1850,US,US/Eastern,KIND,2020-09-11 13:50:00,70.0,70.0,78.0,29.38,9.0,ENE,9.0,0.0,Cloudy,False,False,False,False,False,False,False,False,False,False,False,False,False,Day,Day,Day,Day
C-2522499,2,2021-10-29 17:54:56,2021-10-29 20:04:27,40.735131,-73.998469,40.735554,-73.996679,0.0981658654188,Stationary traffic from W 9th St / Christopher St to E 12th St / 5th Ave due to roadwork.,450.0,Avenue of the Americas,R,New York,New York,NY,10011-8424,US,US/Eastern,KNYC,2021-10-29 17:51:00,55.0,55.0,67.0,29.67,10.0,ENE,15.0,0.0,Cloudy,True,False,True,False,False,False,False,False,True,False,False,False,False,Day,Day,Day,Day
C-2522500,4,2019-11-01 00:04:33,2019-11-01 05:03:19,33.81196,-84.33415,33.81293,-84.33377,0.0704815291224,Closed at GA-236/Lavista Rd NE - Closed due to roadwork.,2011.0,Briarcliff Rd NE,R,Atlanta,DeKalb,GA,30329-3723,US,US/Eastern,KPDK,2019-11-01 00:51:00,37.0,29.0,75.0,29.12,10.0,NW,13.0,0.0,Partly Cloudy,False,False,False,False,False,False,False,False,False,False,False,False,False,Night,Night,Night,Night
C-2522501,2,2021-08-23 07:51:30,2021-08-23 08:59:30,37.79034,-114.407147,37.74823,-114.436577,3.32400563356,Stationary traffic on US-93 S - US-93 N from NV-319 (US-93) to Beaver Dam Rd (US-93) due to roadwork.,,US-93 N,R,Panaca,Lincoln,NV,89042,US,US/Pacific,KP38,2021-08-23 07:56:00,76.0,76.0,22.0,26.96,10.0,S,5.0,0.0,Fair,False,False,False,False,False,False,False,False,False,True,False,False,False,Day,Day,Day,Day
C-2522502,2,2017-04-11 13:18:30,2017-11-25 01:21:22,39.85969,-75.47981,39.85971,-75.479848,0.0024436562517199,At US-1/US-322/Baltimore Pike - Roadwork. Traffic problem.,,Garnet Mine Rd,R,Garnet Valley,Delaware,PA,19060,US,US/Eastern,KOQN,2017-04-11 13:15:00,79.0,79.0,34.0,29.45,10.0,VAR,3.0,0.0,Fair,False,False,False,False,False,False,False,False,False,False,False,False,False,Day,Day,Day,Day
C-2522503,2,2020-09-15 23:45:14,2020-09-17 00:30:14,26.611423,-80.06878,26.607545,-80.068931,0.268106601791,Construction on I-95 SB near EXIT 63 Construction. Right lane closed.,,I-95 S,R,Lake Worth,Palm Beach,FL,33461,US,US/Eastern,KPBI,2020-09-15 23:53:00,83.0,83.0,79.0,30.01,10.0,SE,5.0,0.0,Partly Cloudy,False,False,False,False,False,False,False,False,False,False,False,False,False,Night,Night,Night,Night
C-2522504,2,2020-09-15 12:30:24,2020-09-18 01:43:45,32.353037,-101.403244,32.377364,-101.377681,2.24740806812,Roadwork on TX-350 from FM-700 (TX-350) to FM-820 (TX-350).,4703.0,E Highway 350,L,Big Spring,Howard,TX,79720,US,US/Central,KBPG,2020-09-15 12:35:00,76.0,76.0,52.0,27.53,10.0,N,3.0,0.0,Fair,False,False,False,False,False,False,False,False,False,False,False,False,False,Day,Day,Day,Day
C-2522505,2,2017-06-16 08:31:02,2017-06-16 14:31:02,34.21928,-117.07161,34.205129,-117.107419,2.26765323351,Between Green Valley Lake Rd and View Dr - Construction work.,31101.0,Green Valley Lake Rd,L,Running Springs,San Bernardino,CA,92382,US,US/Pacific,KSBD,2017-06-16 08:45:00,77.0,,34.0,29.93,10.0,Calm,,,Clear,False,False,False,True,False,False,False,False,False,True,False,False,False,Day,Day,Day,Day
C-2522506,2,2019-04-03 20:02:18,2019-04-07 20:01:51,30.48151,-81.6438,30.481254,-81.642209,0.0963720816527999,At I-95 - Construction work.,,Max Leggett Pkwy,R,Jacksonville,Duval,FL,32218,US,US/Eastern,KJAX,2019-04-03 19:56:00,59.0,59.0,62.0,30.28,10.0,E,7.0,0.0,Mostly Cloudy,False,False,True,False,False,False,False,False,False,False,False,True,False,Night,Day,Day,Day
