ID,Severity,Start_Time,End_Time,Start_Lat,Start_Lng,End_Lat,End_Lng,Distance(mi),Description,Number,Street,Side,City,County,State,Zipcode,Country,Timezone,Airport_Code,Weather_Timestamp,Temperature(F),Wind_Chill(F),Humidity(%),Pressure(in),Visibility(mi),Wind_Direction,Wind_Speed(mph),Precipitation(in),Weather_Condition,Amenity,Bump,Crossing,Give_Way,Junction,No_Exit,Railway,Roundabout,Station,Stop,Traffic_Calming,Traffic_Signal,Turning_Loop,Sunrise_Sunset,Civil_Twilight,Nautical_Twilight,Astronomical_Twilight
C-4173471,2,2020-11-11 13:34:00.000000000,2020-11-12 03:28:55.000000000,33.479401,-111.98692,33.48033,-111.987795,0.0816261448978999,Slow traffic from E Wilshire Dr to N 42nd St due to roadwork.,2807.0,N 44th St,R,Phoenix,Maricopa,AZ,85008-1550,US,US/Mountain,KPHX,2020-11-11 13:51:00,67.0,67.0,19.0,28.75,10.0,W,5.0,0.0,Fair,True,False,False,False,False,False,False,False,True,False,False,False,False,Day,Day,Day,Day
C-4173472,2,2020-07-22 16:30:00.000000000,2020-07-22 22:15:00.000000000,42.481228,-92.770231,42.473911,-92.770252,0.505557683463,Construction on IA-14 EB near COUNTY HWY-D19 Expect delays.,15205.0,N Ave,L,Holland,Grundy,IA,50642-8066,US,US/Central,KMIW,2020-07-22 16:53:00,80.0,80.0,54.0,28.96,10.0,VAR,6.0,0.0,Fair,False,False,False,False,False,False,False,False,False,False,False,False,False,Day,Day,Day,Day
C-4173473,2,2021-11-30 14:52:00.000000000,2021-11-30 16:06:00.000000000,39.827799,-84.89035600000003,39.83159000000001,-84.890305,0.2619471316539999,Stationary traffic on US-27 N - IN-227 from US-40/S A St (S 8th St/S 9th St/US-27) to N C St (IN-227/S 8th St/S 9th St/US-27) due to roadwork.,34.0,S 9th St,L,Richmond,Wayne,IN,47374-5504,US,US/Eastern,KVES,2021-11-30 14:50:00,50.0,50.0,50.0,28.93,10.0,W,14.0,0.0,Fair,False,False,True,False,False,False,False,False,False,False,False,False,False,Day,Day,Day,Day
C-4173474,2,2021-02-16 11:06:00.000000000,2021-02-16 14:53:30.000000000,32.236967,-111.052767,32.238213,-111.042075,0.630766781418,Slow traffic from N Camino de Oeste (W Speedway Blvd) to N Greasewood Rd (W Speedway Blvd) due to roadwork.,4168.0,W Speedway Blvd,R,Tucson,Pima,AZ,85745-9039,US,US/Mountain,KDMA,2021-02-16 10:58:00,55.0,55.0,32.0,27.04,10.0,N,9.0,0.0,Cloudy,False,False,False,False,False,False,False,False,False,False,False,False,False,Day,Day,Day,Day
C-4173475,2,2021-09-23 13:47:30.000000000,2021-09-23 14:15:30.000000000,37.227693,-80.418453,37.233307,-80.425015,0.52988238495,Stationary traffic from Washington St SW to Prices Fork Rd / Toms Creek Rd due to roadwork.,157.0,Kent St,R,Blacksburg,Montgomery,VA,24061-1054,US,US/Eastern,KBCB,2021-09-23 13:55:00,62.0,62.0,59.0,27.78,10.0,WNW,9.0,0.0,Partly Cloudy,True,False,True,False,False,False,False,False,False,False,False,True,False,Day,Day,Day,Day
C-4173476,2,2021-12-21 16:42:30.000000000,2021-12-21 18:46:44.000000000,33.479343,-112.169005,33.480468,-112.170965,0.137114866086,Stationary traffic from W Cambridge Ave to N 52nd Ave due to roadwork.,2674.0,N 51st Ave,L,Phoenix,Maricopa,AZ,85035-2020,US,US/Mountain,KGEU,2021-12-21 16:58:00,63.0,63.0,32.0,28.89,10.0,CALM,0.0,0.0,Cloudy,False,False,False,False,False,False,False,False,False,False,False,False,False,Day,Day,Day,Day
C-4173477,3,2021-10-08 21:00:00.000000000,2021-10-09 05:00:00.000000000,42.630009,-85.662178,,,4.8000001907300005,Road closed intermittently due to construction work on US-131 Southbound from Exit 64 135th Ave to Exit 61 M-179 129th Ave.,,US-131 N,R,Wayland,Allegan,MI,49348,US,US/Eastern,KGRR,2021-10-08 20:53:00,63.0,63.0,100.0,29.03,7.0,E,3.0,0.02,Cloudy,False,False,False,False,False,False,False,False,False,False,False,False,False,Night,Night,Night,Night
C-4173478,2,2021-07-08 07:04:00.000000000,2021-07-08 07:42:30.000000000,41.59670300000001,-109.160156,41.610145,-109.13442,1.6219021192299998,Slow traffic on US-30 E - I-80 E from I-80/US-30/Exit 107 (I-80) to Baxter Rd/Exit 111 (I-80) due to roadwork.,,I-80 E,R,Rock Springs,Sweetwater,WY,82901,US,US/Mountain,KRKS,2021-07-08 06:54:00,58.0,58.0,35.0,23.47,10.0,SSE,6.0,0.0,Fair,False,False,False,False,False,False,False,False,False,False,False,False,False,Day,Day,Day,Day
C-4173479,2,2021-09-13 05:15:57.000000000,2021-09-15 09:22:22.000000000,32.849099,-96.683488,32.848883,-96.683753,0.0214322090864,Roadwork on Barnes Bridge Rd (Garland Rd/TX-78) from Easton Rd (Garland Rd/TX-78) to TX-78.,11341.0,Garland Rd,L,Dallas,Dallas,TX,75218-2515,US,US/Central,KDAL,2021-09-13 04:53:00,76.0,76.0,79.0,29.53,10.0,SE,7.0,0.0,Mostly Cloudy,False,False,False,False,False,False,False,False,False,False,False,True,False,Night,Night,Night,Night
C-4173480,2,2021-12-15 15:43:21.000000000,2021-12-15 16:11:01.000000000,27.843852,-82.68714,27.83895200000001,-82.683662,0.399716529398,Slow traffic on US-19 S from CR-611/49th St (US-19) to FL-694/Gandy Blvd/Park Blvd (US-19) due to roadwork.,7898.0,US Highway 19 N,L,Pinellas Park,Pinellas,FL,33781-1708,US,US/Eastern,KPIE,2021-12-15 15:53:00,80.0,80.0,60.0,30.15,10.0,ENE,8.0,0.0,Fair,False,False,True,False,False,False,False,False,False,False,False,False,False,Day,Day,Day,Day
C-4173481,2,2020-12-03 04:01:00.000000000,2020-12-03 13:46:00.000000000,38.550117,-121.474057,38.343124,-121.335676,16.1436180605,Alternating Lanes closure due to Shoulder Work between Grant Line Rd Overcrossing and Dillard Rd Overcrossing,,CA-99 S,R,Sacramento,Sacramento,CA,95817,US,US/Pacific,KSAC,2020-12-03 03:53:00,40.0,40.0,83.0,30.2,8.0,CALM,0.0,0.0,Fair,False,False,False,False,True,False,False,False,False,False,False,False,False,Night,Night,Night,Night
C-4173482,2,2021-05-30 17:02:34.000000000,2021-05-30 17:22:34.000000000,42.334649,-83.049184,42.332536,-83.045859,0.22395586258,Slow traffic on M-1 - M-3 from Clifford St / John R St to Randolph St due to roadwork.,1463.0,Woodward Ave,L,Detroit,Wayne,MI,48226-2001,US,US/Eastern,KDET,2021-05-30 16:53:00,68.0,68.0,28.0,29.55,10.0,SE,10.0,0.0,Fair,False,False,True,False,False,False,True,False,False,False,False,False,False,Day,Day,Day,Day
C-4173483,2,2020-11-10 01:47:00.000000000,2020-11-11 02:41:03.000000000,40.997425,-76.64784499999998,40.998125,-76.649745,0.110254270011,Construction on PA-54 WB near I-80 Allow extra time.,1150.0,Continental Blvd,R,Danville,Montour,PA,17821-8394,US,US/Eastern,KSEG,2020-11-10 01:48:00,39.0,39.0,100.0,29.74,0.75,CALM,0.0,0.0,Fog,False,False,False,False,False,False,False,False,False,False,False,False,False,Night,Night,Night,Night
C-4173484,2,2021-10-10 15:09:35.000000000,2021-10-10 17:15:11.000000000,33.271869,-85.83636899999998,33.273913,-85.836332,0.141243122409,Roadwork on AL-148 (AL-9) from AL-77/2nd St (AL-9) to AL-9.,82880.0,Highway 9,R,Ashland,Clay,AL,36251-6208,US,US/Central,KANB,2021-10-10 14:53:00,85.0,85.0,46.0,29.33,10.0,CALM,0.0,0.0,Light Rain,False,False,False,False,False,False,False,False,False,False,False,False,False,Day,Day,Day,Day
C-4173485,1,2020-07-15 07:00:00.000000000,2020-07-15 17:00:00.000000000,39.498379,-119.821808,,,0.0,Road closed due to construction work on Foley Way both ways in Brighton Manor.,2601.0,Foley Way,R,Reno,Washoe,NV,89509-3511,US,US/Pacific,KRNO,2020-07-15 06:55:00,67.0,67.0,47.0,25.63,10.0,CALM,0.0,0.0,Fair,False,False,False,False,False,False,False,False,False,False,False,False,False,Day,Day,Day,Day
C-4173486,2,2020-10-24 17:14:00.000000000,2020-10-25 01:08:30.000000000,40.716965,-73.994449,40.717863,-73.997117,0.152875960323,Queuing traffic from Chrystie St to Mott St due to resurfacing work.,74.0,Chrystie St,R,New York,New York,NY,10002-5026,US,US/Eastern,KJRB,2020-10-24 16:51:00,67.0,67.0,54.0,29.82,10.0,VAR,5.0,0.0,Cloudy,True,False,True,False,False,False,False,False,False,False,False,True,False,Day,Day,Day,Day
C-4173487,2,2021-09-18 10:46:38.000000000,2021-11-17 13:19:49.000000000,33.508395,-112.047534,33.509223,-112.04808,0.0652865694611,Stationary traffic from E Pierson St to N 15th St due to roadwork.,4908.0,N 16th St,L,Phoenix,Maricopa,AZ,85014,US,US/Mountain,KPHX,2021-11-17 10:51:00,71.0,71.0,20.0,28.81,10.0,ESE,8.0,0.0,Mostly Cloudy,True,False,False,False,False,False,False,False,True,False,False,False,False,Day,Day,Day,Day
C-4173488,2,2019-05-09 14:47:00.000000000,2021-06-12 05:22:20.000000000,40.454918,-76.51649,40.318931,-76.823697,18.6994600378,Roadwork on I-81 southbound between Exit 72: PAXTONIA/LINGLESTOWN and .4 miles north of Exit 70: I-83 SOUTH/US 322 EAST - HARRISBURG. There is a lane restriction.,,I-81 S,R,Jonestown,Lebanon,PA,17038,US,US/Eastern,KMUI,2019-05-09 14:56:00,55.0,55.0,96.0,29.67,4.0,ENE,5.0,0.0,Cloudy,False,False,False,False,False,False,False,False,False,False,False,False,False,Day,Day,Day,Day
C-4173489,2,2017-01-10 15:30:32.000000000,2017-01-10 17:00:00.000000000,33.46109000000001,-80.73359,33.447321,-80.716932,1.35173592442,Between US-301/Exit 154 and SC-36/Road 36/Exit 159 - Construction work.,,I-26 E,R,Orangeburg,Orangeburg,SC,29115,US,US/Eastern,KOGB,2017-01-10 15:53:00,60.1,,49.0,30.38,10.0,SSW,11.5,,Clear,False,False,False,False,False,False,False,False,False,False,False,False,False,Day,Day,Day,Day
C-4173490,2,2021-08-18 11:59:25.000000000,2021-08-18 12:28:22.000000000,25.925974,-80.158948,25.92602,-80.15373000000002,0.324261172561,Slow traffic on FL-826 from 19th Ave (FL-826) to US-1/FL-5/Biscayne Blvd (FL-826) due to roadwork.,2048.0,NE 163rd St,R,North Miami Beach,Miami-Dade,FL,33162-4902,US,US/Eastern,KHWO,2021-08-18 11:53:00,89.0,89.0,65.0,30.14,10.0,ESE,18.0,0.0,Partly Cloudy,False,False,True,False,False,False,False,False,True,False,False,True,False,Day,Day,Day,Day
C-4173491,2,2021-11-07 12:22:18.000000000,2021-11-07 12:43:32.000000000,35.620877,-87.833389,35.631148,-87.833878,0.710189708985,Slow traffic on TN-13 from US-412/TN-100/TN-20/E Main St (TN-13) to TN-438/Old TN-13 (TN-13) due to roadwork.,40.0,Lobelville Hwy,R,Linden,Perry,TN,37096-6076,US,US/Central,KMRC,2021-11-07 12:30:00,63.0,63.0,39.0,29.48,9.0,SE,3.0,0.0,Fair,False,False,False,False,False,False,False,False,False,False,False,False,False,Day,Day,Day,Day
C-4173492,2,2021-07-23 14:59:51.000000000,2021-07-23 16:10:48.000000000,28.265478,-81.486199,28.258573,-81.486174,0.477092487861,Stationary traffic from US-192/W Irlo Bronson Memorial Hwy (Poinciana Blvd) to US-17/US-92/S Orange Blossom Trl (Poinciana Blvd) due to roadwork.,1498.0,S Poinciana Blvd,R,Kissimmee,Osceola,FL,34746,US,US/Eastern,KISM,2021-07-23 14:56:00,,,,29.96,10.0,WNW,12.0,0.0,Fair,False,False,False,False,False,False,False,False,False,False,False,True,False,Day,Day,Day,Day
C-4173493,2,2019-06-25 09:31:53.000000000,2019-06-29 09:31:36.000000000,38.86126,-77.09198,38.858676,-77.101851,0.560284567611,Between S Walter Reed Dr and S Four Mile Run Dr - Construction work. Lane blocked.,,S Glebe Rd,R,Arlington,Arlington,VA,22204,US,US/Eastern,KDCA,2019-06-25 09:52:00,80.0,80.0,64.0,29.87,10.0,N,12.0,0.0,Cloudy,False,False,True,False,False,False,False,False,False,False,False,True,False,Day,Day,Day,Day
C-4173494,3,2019-07-09 18:55:51,2019-07-13 18:55:14,41.48152,-81.66139,41.48539,-81.6635,0.288836222678,Ramp to Exit 161B - Roadwork.,,I-77 N,R,Cleveland,Cuyahoga,OH,44127,US,US/Eastern,KBKL,2019-07-09 18:53:00,73.0,73.0,73.0,29.39,9.0,NE,9.0,0.0,Fair,False,False,False,False,False,False,False,False,False,False,False,False,False,Day,Day,Day,Day
C-4173495,2,2021-07-22 11:38:30,2021-07-22 16:47:48,39.763711,-86.343339,39.763699,-86.33254000000002,0.573549978662,Slow traffic on US-36 E - US-36 W from IN-267 (US-36) to Raceway Rd (Rockville Rd/US-36) due to roadwork.,,Shiloh Park Dr,R,Avon,Hendricks,IN,46123,US,US/Eastern,KIND,2021-07-22 11:54:00,76.0,76.0,64.0,29.37,10.0,VAR,6.0,0.0,Partly Cloudy,False,False,False,False,False,False,False,False,False,False,False,False,False,Day,Day,Day,Day
C-4173496,2,2021-10-25 07:29:00,2021-10-25 15:45:00,37.612418,-77.52033,37.613401,-77.520842,0.0734728416152,Construction on US-250 WB near DEEP RUN AVE Left shoulder closed.,7150.0,W Broad St,R,Henrico,Henrico,VA,23228,US,US/Eastern,KOFP,2021-10-25 07:54:00,62.0,62.0,93.0,29.79,7.0,S,6.0,0.0,Fair,False,False,False,False,False,False,False,False,False,False,False,True,False,Day,Day,Day,Day
C-4173497,2,2021-09-25 15:48:10,2021-09-25 16:09:44,32.86906,-97.342388,32.861519,-97.342922,0.521954312762,Slow traffic on FM-156 from E Bailey Boswell Rd (Blue Mound Rd/FM-156) to E McLeroy Blvd (Blue Mound Rd/FM-156) due to roadwork.,6868.0,Blue Mound Rd,R,Fort Worth,Tarrant,TX,76131,US,US/Central,KFWD,2021-09-25 15:53:00,88.0,88.0,21.0,29.31,10.0,SE,8.0,0.0,Fair,False,False,False,False,False,False,False,False,False,False,False,True,False,Day,Day,Day,Day
C-4173498,2,2021-08-13 10:49:44,2021-08-13 12:57:27,31.807437,-106.261659,31.80651,-106.268699,0.41830425869,Slow traffic on US-62 W - US-180 W from N Zaragoza Rd (Montana Ave/US-62) to TX-375 Loop/Joe Battle Blvd (Montana Ave/US-62) due to roadwork.,12277.0,Montana Ave,R,El Paso,El Paso,TX,79938,US,US/Mountain,KELP,2021-08-13 10:47:00,75.0,75.0,69.0,26.26,10.0,WSW,12.0,,Cloudy,False,False,False,False,False,False,False,False,False,False,False,True,False,Day,Day,Day,Day
C-4173499,2,2021-08-04 13:41:00,2021-08-04 14:21:32,42.25877,-71.123419,42.255087,-71.124268,0.2581482687449999,Stationary traffic from Thatcher St/Greenwood Ave (Hyde Park Ave) to Millstone Rd (Hyde Park Ave) due to roadwork.,99.0,Webster St,R,Hyde Park,Suffolk,MA,02136-2821,US,US/Eastern,KMQE,2021-08-04 13:53:00,77.0,77.0,54.0,30.12,10.0,SSE,10.0,0.0,Fair,False,False,True,False,False,False,False,False,True,True,False,False,False,Day,Day,Day,Day
C-4173500,2,2020-10-10 03:00:00,2020-10-12 12:45:00,29.783731,-95.481373,29.783871,-95.456823,1.4722115180500002,Construction on I-10 EB near ANTOINE DR Drive with caution.,,Katy Tollway,R,Houston,Harris,TX,77024,US,US/Central,KMCJ,2020-10-10 02:53:00,71.0,71.0,84.0,29.73,10.0,W,5.0,0.0,Fair,False,False,True,True,False,False,False,False,False,False,False,True,False,Night,Night,Night,Night
C-4173501,4,2020-05-17 06:12:31,2020-05-17 11:12:30,47.65558,-122.13779,47.63075,-122.14987,1.80540163309,Closed between 40th St and 140th Ave NE - Closed due to roadwork.,,WA-520 W,R,Redmond,King,WA,98052,US,US/Pacific,KBFI,2020-05-17 05:53:00,55.0,55.0,89.0,29.71,10.0,SSE,7.0,0.0,Cloudy,False,False,False,False,True,False,False,False,False,False,False,False,False,Day,Day,Day,Day
C-4173502,2,2021-11-02 16:22:54,2021-11-02 17:32:51,33.832828000000006,-84.425507,33.829913,-84.432688,0.458729204451,Stationary traffic from US-41/GA-3/Northside Pkwy (Moores Mill Rd) to Warren Rd (Moores Mill Rd) due to roadwork.,1161.0,Moores Mill Rd NW,R,Atlanta,Fulton,GA,30327-1607,US,US/Eastern,KMGE,2021-11-02 15:56:00,66.0,66.0,45.0,29.03,10.0,NNW,10.0,0.0,Fair,False,False,False,False,False,False,False,False,False,False,False,False,False,Day,Day,Day,Day
C-4173503,2,2021-06-09 17:30:00,2021-06-09 18:27:00,44.51182,-108.967155,44.511691,-108.989737,1.11267286171,Slow traffic on US-20 W - US-14 E - US-20 E - US-16 E - US-14 W - US-16 W from 3FK Rd (US-14) to WY-120 (US-14) due to roadwork.,5766.0,Greybull Hwy,L,Cody,Park,WY,82414-9620,US,US/Mountain,KCOD,2021-06-09 17:56:00,90.0,90.0,7.0,24.76,10.0,S,16.0,0.0,Fair,False,False,False,False,False,False,False,False,False,False,False,False,False,Day,Day,Day,Day
C-4173504,2,2021-12-21 12:11:00,2021-12-21 14:25:41,26.650787,-80.19761,26.649796,-80.203634,0.378249107679,Slow traffic on FL-7 - FL-882 - US-441 S from Via Buena Vida / Olympia Blvd to Wellington Green Mall due to roadwork.,9287.0,Forest Hill Blvd,L,West Palm Beach,Palm Beach,FL,33411,US,US/Eastern,KPBI,2021-12-21 12:21:00,75.0,75.0,82.0,29.73,10.0,SSW,18.0,0.0,Light Rain,False,False,False,False,False,False,False,False,False,False,False,False,False,Day,Day,Day,Day
C-4173505,2,2020-09-10 12:54:30,2020-09-10 15:51:05,40.719597,-73.758286,40.721707,-73.759867,0.167654808552,Queuing traffic from Jamaica Ave (Francis Lewis Blvd) to Grand Central Pkwy/McLaughlin Ave (Francis Lewis Blvd) due to resurfacing work.,,89th Ave,R,Queens Village,Queens,NY,11427,US,US/Eastern,KJFK,2020-09-10 12:51:00,81.0,81.0,79.0,30.21,10.0,SSW,7.0,0.0,Mostly Cloudy,False,False,True,False,False,False,False,False,True,True,False,True,False,Day,Day,Day,Day
C-4173506,2,2021-06-08 02:42:30,2021-12-30 19:52:13,41.953975,-87.691513,41.954551,-87.68839,0.16533150872,Stationary traffic on IL-19 from N Rockwell St to W Cuyler Ave due to roadwork.,2525.0,W Irving Park Rd,L,Chicago,Cook,IL,60618-3715,US,US/Central,KORD,2021-12-08 08:51:00,29.0,22.0,72.0,29.18,10.0,W,7.0,0.0,Fair,False,False,False,False,False,False,False,False,True,False,False,False,False,Night,Night,Night,Night
C-4173507,2,2021-08-26 17:55:00,2021-08-26 18:47:00,33.524002,-112.121245,33.524025,-112.116892,0.250737987761,Slow traffic from N 35th Ave (W Bethany Home Rd) to I-17/N Black Canyon Hwy (W Bethany Home Rd) due to roadwork.,5999.0,N 29th Ave,R,Phoenix,Maricopa,AZ,85017,US,US/Mountain,KPHX,2021-08-26 17:51:00,110.0,110.0,12.0,28.5,10.0,VAR,5.0,0.0,Fair,False,False,True,False,False,False,False,False,False,True,False,True,False,Day,Day,Day,Day
C-4173508,3,2019-09-27 04:35:50,2019-09-27 06:00:00,32.003311,-83.758263,,,7.730000019069999,Two lanes closed due to construction work on GA-401 Northbound from Exit 99 GA-300 to Exit 104 Farmers Market Rd.,,GA-401 N,R,Cordele,Crisp,GA,31015,US,US/Eastern,KCKF,2019-09-27 04:35:00,73.0,73.0,92.0,29.57,10.0,CALM,0.0,,Fair,False,False,False,False,False,False,False,False,False,False,False,False,False,Night,Night,Night,Night
C-4173509,2,2021-04-28 08:00:00,2021-05-31 17:00:00,37.091404,-78.381929,37.099904,-78.374824,0.705858487878,On US-360 in the County of Prince Edward from Rt. 729N/S (Prince Edward County) to Rt. 633N/S (Prince Edward County) motorists can expect potential delays in this area from 04/28/21 at 8:00 AM until 05/31/21 at 5:00 PM due to bridge work. The east left shoulder and left lane are closed.,3398.0,Patrick Henry Hwy,R,Meherrin,Prince Edward,VA,23954,US,US/Eastern,KFVX,2021-04-28 07:55:00,64.0,64.0,76.0,29.59,10.0,SSW,7.0,0.0,Fair,False,False,False,False,False,False,False,False,False,False,False,False,False,Day,Day,Day,Day
C-4173510,4,2021-06-21 00:00:00,2021-07-21 00:00:00,39.666896,-75.769973,39.669467,-75.771376,0.1926748469729999,Road closed for sewer main work. Detour signage will be posted for motorists. Gravenor Lane between Elkton Road and Cornwall Drive (T201504401) (Group 2),1601.0,Gravenor Ln,L,Newark,New Castle,DE,19711-7707,US,US/Eastern,KILG,2021-06-21 00:51:00,76.0,76.0,85.0,29.7,10.0,S,7.0,0.0,Fair,False,False,True,False,False,False,False,False,False,False,False,False,False,Night,Night,Night,Night
C-4173511,2,2019-03-14 09:31:37,2019-03-18 09:31:34,38.83566,-77.00783,38.846477,-77.008139,0.7475684945909999,Between Capitol St SE and Malcolm X Ave SE/MacDill Blvd SW - Construction work. Lane blocked.,3733.0,S Capitol St SE,L,Washington,District of Columbia,DC,20032,US,US/Eastern,KDCA,2019-03-14 09:52:00,55.0,,62.0,30.16,10.0,South,9.2,,Mostly Cloudy,False,False,False,False,False,False,False,False,False,False,False,True,False,Day,Day,Day,Day
C-4173512,2,2021-05-13 04:32:00,2021-06-07 05:15:00,39.663166,-104.858046,39.659015,-104.847747,0.618345958188,Stationary traffic on CO-83 from CO-30/Havana St (S Parker Rd/CO-83) to I-225 (S Parker Rd/CO-83) due to roadwork.,,S Lansing Way,R,Aurora,Arapahoe,CO,80014,US,US/Mountain,KBKF,2021-05-13 04:58:00,40.0,40.0,91.0,24.52,10.0,CALM,0.0,0.0,Fair,False,False,True,False,False,False,False,False,False,True,False,True,False,Night,Night,Night,Day
C-4173513,4,2021-07-17 07:00:00,2021-07-17 20:00:00,37.07541,-88.589334,37.072605,-88.587571,0.21681040112,I-24 Bus Loop W - US-60 Bus W - I-24 Bus Loop E - US-60 Bus E is closed from US-45 Bus/N 8th St (I-24 Bus Loop) to US-60/Irvin Cobb Dr (I-24 Bus Loop/Wayne Sullivan Dr) due to roadwork.,1200.0,S 3rd St,R,Paducah,McCracken,KY,42003-1607,US,US/Central,KPAH,2021-07-17 06:53:00,73.0,73.0,90.0,29.63,9.0,CALM,0.0,0.0,Fair,False,False,False,False,False,False,False,False,False,False,False,False,False,Day,Day,Day,Day
C-4173514,2,2021-08-24 13:09:30,2021-10-01 03:45:00,36.855712,-76.1774,36.854565,-76.178687,0.10650464846,Slow traffic on US-58 W from Lake Edward Dr to Reel St due to roadwork.,1043.0,Newtown Rd,R,Norfolk,Norfolk,VA,23502-3005,US,US/Eastern,KORF,2021-08-24 13:59:00,90.0,90.0,57.0,30.01,8.0,VAR,7.0,0.0,Fair,False,False,False,False,False,False,False,False,False,False,False,False,False,Day,Day,Day,Day
C-4173515,2,2021-06-14 16:20:03,2021-06-14 18:24:26,25.895549,-80.211073,25.89882,-80.21123100000001,0.226217837757,Slow traffic on US-441 N from North Miami Blvd/125th St (US-441) to FL-916/Opa Locka Blvd (US-441) due to roadwork.,693.0,NW 132nd St,R,North Miami,Miami-Dade,FL,33168-2805,US,US/Eastern,KOPF,2021-06-14 16:10:00,77.0,77.0,88.0,29.99,10.0,WSW,8.0,0.01,Light Rain,False,False,False,False,False,False,False,False,True,False,False,False,False,Day,Day,Day,Day
C-4173516,2,2021-07-04 23:23:30,2021-07-05 00:03:30,46.540568,-87.407014,46.543682,-87.41980500000004,0.644832201919,Stationary traffic on M-28 - US-41 - US-41 N from Grove St (MI-28) to S McClellan Ave (MI-28) due to roadwork.,722.0,US Highway 41 W,L,Marquette,Marquette,MI,49855,US,US/Eastern,KSAW,2021-07-04 23:18:00,76.0,76.0,68.0,28.5,10.0,SSW,8.0,0.0,Fair,False,False,True,False,False,False,False,False,False,False,False,True,False,Night,Night,Night,Night
C-4173517,2,2020-11-18 17:00:00,2020-11-19 00:45:00,41.313886,-73.865912,41.313739,-73.866274,0.0213563072303,Construction on US-6 WB near BAKER ST Construction. Right lane closed.,3193.0,E Main St,R,Mohegan Lake,Westchester,NY,10547-1527,US,US/Eastern,KSWF,2020-11-18 16:45:00,30.0,24.0,55.0,29.95,10.0,NNW,6.0,0.0,Fair,False,False,False,False,False,False,False,False,False,False,False,True,False,Night,Day,Day,Day
C-4173518,2,2019-09-03 10:00:00,2019-09-03 16:00:00,41.171551,-73.752289,,,1.4199999570800002,Intermittent lane closures due to construction work on NY-117 Bedford Rd both ways between Annandale Dr and Whippoorwill Rd.,437.0,Bedford Rd,R,Chappaqua,Westchester,NY,10514-2209,US,US/Eastern,KHPN,2019-09-03 09:56:00,72.0,72.0,64.0,29.59,10.0,VAR,7.0,0.0,Fair,False,False,False,False,False,False,False,False,False,False,False,False,False,Day,Day,Day,Day
C-4173519,2,2021-02-16 16:20:30,2021-02-16 16:38:00,29.894324,-94.314296,29.907844,-94.297725,1.36299633449,Slow traffic on I-10 E from Hamshire Rd/Exit 833 (I-10) to FM-365 Rd/Exit 838 (I-10) due to roadwork.,,I-10 E,R,Winnie,Jefferson,TX,77665,US,US/Central,KBMT,2021-02-16 16:15:00,36.0,30.0,44.0,30.08,10.0,E,7.0,0.0,Mostly Cloudy,False,False,False,False,False,False,False,False,False,False,False,False,False,Day,Day,Day,Day
C-4173520,2,2021-04-30 09:03:31,2021-12-16 13:41:30,40.08704,-77.867338,40.091162,-77.85683399999998,0.624019244313,Slow traffic on Pennsylvania Tpke E - I-76 E from Waters Dr (Pennsylvania Tpke/I-76) to PA-75/Exit 189 (I-76) due to roadwork.,,I-76 E,R,Neelyton,Huntingdon,PA,17239,US,US/Eastern,KAOO,2021-12-16 13:53:00,66.0,66.0,47.0,28.36,10.0,SW,15.0,0.0,Fair,False,False,False,False,False,False,False,False,False,False,False,False,False,Day,Day,Day,Day
C-4173521,2,2021-04-05 05:35:00,2021-04-05 15:32:49,43.63518,-116.354401,43.632425,-116.354506,0.190424777118,Slow traffic on ID-55 from W McMillan Rd (ID-55) to E Fairview Ave (ID-55) due to roadwork.,3307.0,N Eagle Rd,L,Meridian,Ada,ID,83646-7790,US,US/Mountain,KMAN,2021-04-05 05:35:00,46.0,41.0,46.0,27.25,10.0,NW,13.0,0.0,,False,False,False,False,False,False,False,False,False,False,False,False,False,Night,Night,Night,Night
C-4173522,2,2021-04-12 09:30:00,2021-04-12 15:46:00,39.718741,-120.219365,39.731161,-120.211905,0.945285275805,Construction on CA-49 NB near PLUMAS COUNTY LINE Expect long delays.,698.0,Vinton Loyalton Rd,R,Chilcoot,Plumas,CA,96105,US,US/Pacific,KRTS,2021-04-12 09:35:00,45.0,41.0,25.0,24.96,10.0,ESE,7.0,0.0,Fair,False,False,False,False,False,False,False,False,False,False,False,False,False,Day,Day,Day,Day
C-4173523,2,2021-10-18 14:58:58,2021-10-18 16:00:00,39.107218,-94.599827,39.113048,-94.614237,0.871258456479,Construction on I-70 WB near MM 423 Drive with caution.,,Lewis and Clark Viaduct Brg W,R,Kansas City,Jackson,MO,64105,US,US/Central,KMKC,2021-10-18 14:54:00,74.0,74.0,32.0,29.22,10.0,SSW,17.0,0.0,Fair,False,False,False,False,False,False,False,False,False,False,False,False,False,Day,Day,Day,Day
C-4173524,2,2020-10-10 13:45:00,2020-10-10 22:36:30,43.671486,-116.354334,43.662988,-116.354567,0.587271349708,Queuing traffic on ID-55 from ID-44 Byp/S Eagle Rd (ID-55) to US-20/US-26/Chinden Blvd (ID-55) due to roadwork.,2564.0,S Eagle Rd,R,Eagle,Ada,ID,83616,US,US/Mountain,KBOI,2020-10-10 13:53:00,64.0,64.0,23.0,26.83,7.0,NW,8.0,0.0,Cloudy,False,False,True,False,False,False,False,False,False,False,False,True,False,Day,Day,Day,Day
C-4173525,2,2021-07-10 15:20:57,2021-07-10 18:10:35,26.258109,-80.186273,26.260823,-80.18628100000002,0.187520195846,Slow traffic from Coconut Creek Pkwy (46th Ave/Lyons Rd) to FL-834/W Sample Rd/NW 36th St (Lyons Rd) due to roadwork.,2290.0,Lyons Rd,L,Pompano Beach,Broward,FL,33066,US,US/Eastern,KFXE,2021-07-10 14:53:00,86.0,86.0,67.0,30.09,10.0,E,10.0,0.0,Fair,False,False,False,False,False,False,False,False,False,False,False,False,False,Day,Day,Day,Day
C-4173526,2,2019-06-23 21:02:32,2019-06-27 21:01:35,34.78322,-86.67272,34.77649,-86.67279,0.46501568178,At Dan Tibbs Rd - Construction work.,,Highway 255,R,Huntsville,Madison,AL,35806,US,US/Central,KHUA,2019-06-23 20:58:00,79.0,79.0,79.0,29.2,10.0,S,3.0,0.0,Fair,False,False,False,False,True,False,False,False,False,False,False,False,False,Night,Night,Day,Day
C-4173527,2,2016-10-24 22:26:46,2016-10-25 05:00:00,39.6742,-75.65411,39.68556,-75.65571,0.789499099876,At I-95/Exit 165 - Construction work.,,DE-7 N,R,Newark,New Castle,DE,19702,US,US/Eastern,KILG,2016-10-24 22:51:00,48.0,,58.0,30.19,10.0,NW,8.1,,Clear,False,False,False,False,True,False,False,False,False,False,False,False,False,Night,Night,Night,Night
