ID,Severity,Start_Time,End_Time,Start_Lat,Start_Lng,End_Lat,End_Lng,Distance(mi),Description,Number,Street,Side,City,County,State,Zipcode,Country,Timezone,Airport_Code,Weather_Timestamp,Temperature(F),Wind_Chill(F),Humidity(%),Pressure(in),Visibility(mi),Wind_Direction,Wind_Speed(mph),Precipitation(in),Weather_Condition,Amenity,Bump,Crossing,Give_Way,Junction,No_Exit,Railway,Roundabout,Station,Stop,Traffic_Calming,Traffic_Signal,Turning_Loop,Sunrise_Sunset,Civil_Twilight,Nautical_Twilight,Astronomical_Twilight
C-954022,2,2017-07-27 00:01:00,2017-07-29 23:59:00,40.473366,-80.03083000000002,,,0.0,Restrictions due to paving repairs on Frederick St from Dickson St / Wing Way to Schimmer St.,3098.0,Frederick St,R,Pittsburgh,Allegheny,PA,15212-2473,US,US/Eastern,KAGC,2017-07-27 00:53:00,68.0,,81.0,30.05,10.0,SSE,3.5,,Clear,False,False,False,False,False,False,False,False,False,False,False,False,False,Night,Night,Night,Night
C-954023,2,2020-09-03 19:55:33,2020-09-03 23:13:00,41.757563,-72.663327,41.744663,-72.66205699999998,0.893705985726,Road Work on I-91 Southbound between Exits 29A and 26 (3.0 miles) in effect today until 3:28 pm. The right lane is closed. Reported Thursday September 3 at 12:56 pm.,,I-91 S,R,Hartford,Hartford,CT,06103,US,US/Eastern,KHFD,2020-09-03 19:53:00,75.0,75.0,60.0,29.72,10.0,CALM,0.0,0.0,Mostly Cloudy,False,False,False,False,False,False,False,False,False,False,False,False,False,Night,Night,Day,Day
C-954024,2,2021-10-04 11:41:00,2021-10-04 13:43:58,42.210376,-121.75494,42.21178,-121.757827,0.176744993326,Slow traffic on OR-39 from Summers Ln (S 6th St/OR-39) to Shasta Way (S 6th St/OR-39) due to roadwork.,2801.0,S 6th St,R,Klamath Falls,Klamath,OR,97603-4605,US,US/Pacific,KLMT,2021-10-04 11:53:00,66.0,66.0,34.0,25.85,10.0,ESE,3.0,0.0,Fair,False,False,True,False,False,False,False,False,False,False,False,True,False,Day,Day,Day,Day
C-954025,2,2020-10-26 14:15:30,2020-10-26 23:17:52,46.457115,-108.549588,46.479805,-108.565218,1.73523014566,Roadwork on US-87 from US-12 (Roundup) (North) (US-87) to Winnett Rd/Shipp Rd (US-87).,120.0,US Highway 87 N,L,Roundup,Musselshell,MT,59072-6323,US,US/Mountain,KBIL,2020-10-26 13:53:00,21.0,5.0,55.0,26.4,10.0,WSW,23.0,0.0,Fair / Windy,False,False,False,False,False,False,False,False,False,False,False,False,False,Day,Day,Day,Day
C-954026,4,2019-09-01 00:26:29,2019-09-01 05:24:22,26.339577,-80.07781800000002,26.339199,-80.076308,0.0970787615293,Closed at SR-A1A/S Ocean Blvd - Closed due to roadwork.,531.0,E Camino Real,L,Boca Raton,Palm Beach,FL,33432-6127,US,US/Eastern,KBCT,2019-09-01 00:53:00,81.0,81.0,88.0,29.9,9.0,ENE,3.0,0.0,Partly Cloudy,False,False,False,False,False,False,False,False,False,True,False,True,False,Night,Night,Night,Night
C-954027,2,2019-03-02 23:02:13,2019-04-02 09:04:11,25.73249,-80.357742,25.732731,-80.34808000000002,0.6016071730100001,Between 102nd Ave and 94th Ave - Construction work.,10002.0,SW 40th St,R,Miami,Miami-Dade,FL,33165-3948,US,US/Eastern,KMIA,2019-03-24 08:53:00,73.0,,59.0,30.22,10.0,ESE,9.2,,Mostly Cloudy,False,False,False,False,False,False,False,False,False,False,False,False,False,Night,Night,Night,Night
C-954028,2,2021-09-21 07:46:00,2021-09-21 08:10:00,34.568745,-92.990031,34.579728,-92.985186,0.8073620382,Slow traffic on AR-7 - AR-298 - AR-128 from US-70 Bus/Gorge Rd (AR-7) to W Glazypeau Rd (AR-7) due to roadwork.,4000.0,Park Ave,R,Hot Springs National Park,Garland,AR,71901-8445,US,US/Central,KHOT,2021-09-21 07:53:00,79.0,79.0,72.0,29.41,10.0,E,3.0,0.0,Fair,False,False,False,False,False,False,False,False,False,False,False,False,False,Day,Day,Day,Day
C-954029,2,2020-07-20 14:00:00,2020-07-21 03:30:00,37.624636,-75.82381099999998,37.625598,-75.821766,0.130160414786,Construction on BOBTOWN RD NB near WATERFIELD ST Construction. Right lane closed.,30827.0,Boston Rd,R,Painter,Accomack,VA,23420-4231,US,US/Eastern,KMFV,2020-07-20 14:15:00,96.0,96.0,51.0,29.89,10.0,W,6.0,0.0,Fair,False,False,False,False,False,False,False,False,False,False,False,False,False,Day,Day,Day,Day
C-954030,2,2021-11-03 09:41:00,2021-12-13 18:00:00,38.120282,-77.911621,38.113484,-77.916499,0.539377479136,On US-522 in the County of Louisa from Zachary Taylor Hwy; County/City/Town Line: LOUISA CL/SPOTSYLVANIA COUNTY LINE to Daniel Rd; Rt. 687N/S (Louisa County) motorists can expect potential delays in this area from 12/13/21 at 7:34 AM until 12/13/21 at 6:00 PM due to bridge work. The north through lanes are alternating closures. The south through lanes are alternating closures.,8318.0,Zachary Taylor Hwy,R,Mineral,Spotsylvania,VA,23117-5303,US,US/Eastern,KLKU,2021-12-13 07:35:00,25.0,25.0,86.0,29.88,10.0,S,3.0,0.0,Fair,False,False,False,False,False,False,False,False,False,False,False,False,False,Day,Day,Day,Day
C-954031,3,2016-12-01 07:00:00,2016-12-01 16:00:00,42.357452,-73.427086,,,16.65,Maintenance work on I-90 Eastbound between Exit B1 Berkshire Spur and Exit B3 NY-22.,12597.0,State Route 22,L,Austerlitz,Columbia,NY,12017,US,US/Eastern,KPSF,2016-12-01 06:54:00,45.0,39.7,90.0,29.48,10.0,WNW,10.4,,Mostly Cloudy,False,False,False,False,False,False,False,False,False,False,False,False,False,Night,Day,Day,Day
C-954032,4,2021-04-23 09:32:00,2021-06-24 02:41:55,34.299902,-111.357341,34.387093,-111.454834,8.199163604439999,Construction on AZ-260 WB near W EAST VERDE ESTATES RD Expect delays.,,E Verde Estates Rd,R,Payson,Gila,AZ,85541,US,US/Mountain,KPAN,2021-04-23 09:35:00,55.0,55.0,41.0,24.83,10.0,WSW,7.0,0.0,Fair,True,False,False,False,False,False,False,False,False,False,False,False,False,Day,Day,Day,Day
C-954033,2,2020-04-01 13:30:36,2020-04-01 14:00:36,40.68218,-73.69167,40.68131,-73.69409,0.140326238575,At Valley Stream St Pk Rd/Exit 15A - Roadwork. Left lane closed.,,Southern State Pkwy W,R,Valley Stream,Nassau,NY,11580,US,US/Eastern,KJFK,2020-04-01 13:51:00,52.0,52.0,40.0,29.76,10.0,N,15.0,0.0,Mostly Cloudy,False,False,False,False,True,False,False,False,False,False,False,False,False,Day,Day,Day,Day
C-954034,2,2021-01-28 16:59:09,2021-01-29 17:46:12,39.251038,-76.456335,39.250207,-76.455864,0.0627036821389,Construction on I-695 near (CO-5527) MORSE LN Expect delays.,,I-695 S,R,Dundalk,Baltimore County,MD,21222,US,US/Eastern,KDMH,,,,,,,,,,,False,False,False,False,False,False,False,False,False,False,False,False,False,Day,Day,Day,Day
C-954035,2,2021-06-24 16:05:20,2021-06-24 18:31:50,25.942723,-80.202236,25.94164,-80.20523399999998,0.200737687705,Stationary traffic on FL-7 - FL-860 - US-441 S from NE 183rd St / N Miami Ave to US-441 due to roadwork.,75.0,NW 183rd St,R,Miami,Miami-Dade,FL,33169-4516,US,US/Eastern,KHWO,2021-06-24 15:53:00,82.0,82.0,71.0,30.07,10.0,ENE,7.0,0.0,Fair,False,False,False,False,False,False,False,False,True,False,False,False,False,Day,Day,Day,Day
C-954036,2,2020-10-15 16:27:00,2020-10-15 17:04:00,35.196473,-111.393674,35.19994600000001,-111.402139,0.534796223051,Slow traffic on I-40 from Exit 219 (I-40) to Townsend Winona Rd/Exit 211 (I-40) due to roadwork.,,I-40 W,R,Flagstaff,Coconino,AZ,86004,US,US/Mountain,KFLG,2020-10-15 15:57:00,80.0,80.0,12.0,23.34,10.0,NNE,10.0,0.0,Fair,False,False,False,False,False,False,False,False,False,False,False,False,False,Day,Day,Day,Day
C-954037,2,2021-11-12 08:15:30,2021-11-12 10:18:47,33.638071999999994,-112.222619,33.638115,-112.219638,0.1715046090549999,Stationary traffic from N 83rd Ave (W Bell Rd) to N 67th Ave (W Bell Rd) due to roadwork.,7597.0,W Bell Rd,L,Peoria,Maricopa,AZ,85382-3829,US,US/Mountain,KGEU,2021-11-12 07:58:00,59.0,59.0,28.0,28.96,10.0,NNE,6.0,0.0,Fair,True,False,False,False,False,False,False,False,True,False,False,False,False,Day,Day,Day,Day
C-954038,2,2021-01-26 01:15:30,2021-01-26 01:47:00,29.730071,-95.454988,29.72602,-95.470491,0.971378502488,Slow traffic on I-69 N - US-59 S - US-59 N - I-69 S from Newcastle Dr (US-59 HOV) to Chimney Rock Rd (US-59 HOV) due to roadwork.,,I-69 N,R,Houston,Harris,TX,77027,US,US/Central,KMCJ,2021-01-26 00:53:00,66.0,66.0,48.0,29.77,10.0,NE,5.0,0.0,Mostly Cloudy,False,False,False,False,False,False,False,False,False,False,False,False,False,Night,Night,Night,Night
C-954039,2,2021-08-25 15:56:00,2021-08-25 16:28:30,45.195083,-93.394004,45.198707,-93.392334,0.263265351118,Slow traffic on US-169 N from S Ferry Rd to W Main St due to roadwork.,1670.0,S Ferry St,R,Anoka,Anoka,MN,55303-2148,US,US/Central,KANE,2021-08-25 15:45:00,84.0,84.0,35.0,29.12,10.0,NNW,12.0,0.0,Partly Cloudy,False,False,True,False,False,False,False,False,False,False,False,False,False,Day,Day,Day,Day
C-954040,3,2020-04-25 22:00:00,2020-04-26 05:00:00,33.656406,-84.49771899999998,,,3.77999997139,Two lanes blocked due to construction on I-285 Southbound from GA-154 Campbellton Rd to Camp Creek Pkwy.,,Camp Creek Pkwy,R,Atlanta,Fulton,GA,30344,US,US/Eastern,KATL,2020-04-25 21:52:00,70.0,70.0,53.0,28.77,10.0,W,13.0,0.0,Partly Cloudy,False,False,False,False,False,False,False,False,False,False,False,False,False,Night,Night,Night,Night
C-954041,3,2020-07-28 19:00:00,2020-07-29 05:00:00,38.69813900000001,-90.450768,,,5.63999986649,Intermittent lane closures due to construction work on I-270 Southbound between I-70 and MO-364 Page Ave.,,I-270 S,R,Saint Louis,St. Louis County,MO,63146,US,US/Central,KSTL,2020-07-28 18:51:00,86.0,86.0,44.0,29.28,10.0,E,8.0,0.0,Fair,False,False,False,False,False,False,False,False,False,False,False,False,False,Day,Day,Day,Day
C-954042,2,2020-10-13 19:19:00,2020-10-14 01:29:00,36.18357,-86.351845,36.183057,-86.3335,1.02366915677,Slow traffic on I-40 from TN-109/Exit 232 (I-40) to S Hartmann Dr/Exit 236 (I-40) due to roadwork.,,I-40 E,R,Lebanon,Wilson,TN,37090,US,US/Central,KMQY,2020-10-13 18:53:00,62.0,62.0,53.0,29.48,10.0,CALM,0.0,0.0,Fair,False,False,False,False,True,False,False,False,False,False,False,False,False,Night,Night,Night,Day
C-954043,2,2021-02-24 09:00:00,2021-02-24 17:45:00,33.430298,-86.71015,33.487297,-86.786694,5.91421021305,Construction on US-280 WB near MM 5 Allow extra time.,4205.0,Highway 280,R,Birmingham,Shelby,AL,35242,US,US/Central,KBHM,2021-02-24 08:53:00,60.0,60.0,26.0,29.48,10.0,WSW,5.0,0.0,Fair,False,False,False,False,False,False,False,False,False,False,False,False,False,Day,Day,Day,Day
C-954044,2,2021-04-26 12:21:21,2021-04-26 13:50:58,35.821006,-90.650657,35.820966,-90.646313,0.2433855351709999,Stationary traffic on AR-18 from US-63 Bus/E Nettleton Ave/Frisco St (AR-18) to AR-18/CR-43/Commerce Dr (AR-18) due to roadwork.,1999.0,Arch St,L,Jonesboro,Craighead,AR,72401-5546,US,US/Central,KJBR,2021-04-26 10:53:00,69.0,69.0,61.0,29.74,10.0,S,13.0,0.0,Fair,False,False,True,False,False,False,True,False,False,False,False,False,False,Day,Day,Day,Day
C-954045,2,2021-05-25 00:29:37,2021-05-25 09:14:37,44.272591,-121.169356,44.266255,-121.15641,0.775821488759,Road maintenance operations are occurring causing no to minimum delays. Use caution.,,SE Evergreen Ave,R,Redmond,Deschutes,OR,97756,US,US/Pacific,KRDM,2021-05-25 00:56:00,44.0,44.0,85.0,26.86,10.0,CALM,0.0,0.0,Fair,False,False,True,False,False,False,True,False,False,False,False,False,False,Night,Night,Night,Night
C-954046,2,2021-04-16 17:49:20,2021-04-16 19:02:24,40.60859,-74.12791999999997,40.60862,-74.13073,0.1474100258,Stationary traffic from Bradley Ave exit [11] to N Gannon Ave due to roadwork.,,I-278 W,R,Staten Island,Richmond,NY,10314,US,US/Eastern,KLDJ,2021-04-16 17:55:00,50.0,50.0,59.0,29.62,10.0,NW,17.0,0.0,Mostly Cloudy,False,False,True,False,False,False,False,False,False,False,False,False,False,Day,Day,Day,Day
C-954047,2,2021-08-06 18:20:59,2021-09-26 17:42:00,42.318049,-83.078621,42.314932,-83.075939,0.255259335821,Stationary traffic from Ambassador Bridge Toll Plaza (Ambassador Bridge) to Ambassador Bridge (North) (Ambassador Bridge) due to roadwork.,,Ambassador Brg,R,Detroit,Wayne,MI,48216,US,US/Eastern,KDET,2021-08-06 17:53:00,85.0,85.0,40.0,29.34,10.0,WSW,15.0,0.0,Partly Cloudy,False,False,False,False,False,False,False,False,False,False,False,False,False,Day,Day,Day,Day
C-954048,2,2021-03-03 04:20:33,2021-11-23 09:29:00,41.623731,-84.69724000000002,41.629621,-84.76026999999998,3.2806223558200003,Slow traffic on I-90 W - I-80 W - Ohio Tpke W from CR-15/Exit 13 (I-90/I-80) to OH-49/Exit 2 (I-90/I-80) due to roadwork.,,I-80 W,R,Montpelier,Williams,OH,43543,US,US/Eastern,KDFI,2021-06-19 11:53:00,80.0,80.0,58.0,29.06,10.0,VAR,7.0,0.0,Partly Cloudy,False,False,False,False,False,False,False,False,False,False,False,False,False,Night,Night,Night,Night
C-954049,2,2021-10-26 03:43:23,2021-11-09 03:02:26,30.126962,-98.031616,30.120396000000003,-98.031086,0.454771739222,Roadwork on RM-12 (RM-150) from FM-3237 (RM-150) to RM-150.,15300.0,FM 150 W,L,Driftwood,Hays,TX,78619-9200,US,US/Central,KHYI,2021-10-26 03:56:00,73.0,73.0,100.0,29.29,9.0,S,8.0,0.0,Cloudy,False,False,False,False,False,False,False,False,False,False,False,False,False,Night,Night,Night,Night
C-954050,2,2021-07-23 19:27:28,2021-07-23 19:47:28,25.865119,-80.121131,25.86806,-80.12120300000002,0.203253044732,Stationary traffic on FL-A1A from FL-934/71st St (FL-A1A) to FL-922/96th St/Kane Concourse (FL-A1A) due to roadwork.,7999.0,Collins Ave,R,Miami Beach,Miami-Dade,FL,33141,US,US/Eastern,KOPF,2021-07-23 19:02:00,84.0,84.0,74.0,30.03,6.0,S,5.0,0.01,Light Rain,False,False,False,False,False,False,False,False,False,False,False,False,False,Day,Day,Day,Day
C-954051,2,2020-10-28 12:06:14,2020-10-29 23:18:22,37.313723,-82.35891099999998,37.315586,-82.36095300000002,0.170763878186,Roadwork on KY-197 (KY-80) from US-460 (KY-80) to KY-80.,1.0,Beaver Creek Rd,L,Elkhorn City,Pike,KY,41522-8700,US,US/Eastern,KLNP,2020-10-28 12:15:00,63.0,63.0,100.0,27.33,2.0,SW,5.0,0.0,Light Drizzle,False,False,False,False,False,False,False,False,False,False,False,False,False,Day,Day,Day,Day
C-954052,2,2021-05-07 01:43:00,2021-10-15 18:46:00,40.3094,-76.880712,40.322327,-76.885699,0.931010669109,Slow traffic on US-322 W - US-22 W - William Penn Hwy from I-81 (US-22/US-322) to PA-39 (US-22/US-322) due to roadwork.,,US-22 W,R,Harrisburg,Dauphin,PA,17110,US,US/Eastern,KCXY,2021-05-07 01:56:00,50.0,50.0,74.0,29.58,10.0,CALM,0.0,0.0,Fair,False,False,False,False,False,False,False,False,False,False,False,False,False,Night,Night,Night,Night
C-954053,2,2021-11-15 00:06:30,2021-11-15 00:19:30,41.401724,-82.15299499999998,41.392301,-82.160347,0.754381581346,Slow traffic on I-90 W from OH-2 (I-90) to I-80 (I-90) due to roadwork.,,I-90 W,R,Elyria,Lorain,OH,44035,US,US/Eastern,KLPR,2021-11-15 00:53:00,35.0,27.0,92.0,28.91,7.0,W,12.0,0.0,Light Rain,False,False,False,False,False,False,False,False,False,False,False,False,False,Night,Night,Night,Night
C-954054,2,2021-09-11 10:03:00,2021-09-11 12:04:34,39.873555,-75.583111,39.872647,-75.591412,0.444624364748,Slow traffic on US-1 S - PA-100 from Ring Rd to Upper Bank Dr due to roadwork.,1537.0,Baltimore Pike,L,Chadds Ford,Delaware,PA,19317-7370,US,US/Eastern,KOQN,2021-09-11 09:55:00,68.0,68.0,64.0,29.54,10.0,WNW,8.0,0.0,Fair,False,False,False,False,False,False,False,False,False,False,False,False,False,Day,Day,Day,Day
C-954055,2,2021-11-17 17:11:00,2021-11-21 00:01:04,45.285821,-121.687088,45.285854,-121.67221200000002,0.7231569451450001,Roadwork on US-26 (Mt Hood Hwy/OR-35) from NFD-3540 (Mt Hood Hwy/OR-35) to OR-35.,14099.0,Mount Hood Hwy,R,Government Camp,Clackamas,OR,97028,US,US/Pacific,KCZK,2021-11-17 16:53:00,49.0,43.0,44.0,30.07,10.0,E,17.0,0.0,Fair,False,False,False,False,False,False,False,False,False,False,False,False,False,Night,Night,Day,Day
C-954056,2,2021-08-27 17:11:17,2021-08-27 18:11:27,26.259862,-80.178516,26.260823,-80.18628100000002,0.485698733433,Stationary traffic from NW 40th Ave to NW 25th Ct due to roadwork.,,NW 40th Ave,R,Pompano Beach,Broward,FL,33066,US,US/Eastern,KFXE,2021-08-27 16:53:00,88.0,88.0,65.0,29.94,10.0,ESE,13.0,0.0,Partly Cloudy,False,False,False,False,False,False,False,False,False,False,False,False,False,Day,Day,Day,Day
C-954057,3,2018-06-14 02:05:32,2018-06-14 06:00:00,41.413891,-73.268188,,,7.880000114439999,One lane closed due to construction work on I-84 Eastbound between Exit 9 CT-25 Hawleyville Rd and Exit 11 Wasserman Way.,,US-6 E,R,Sandy Hook,Fairfield,CT,06482,US,US/Eastern,KOXC,2018-06-14 01:51:00,68.0,,93.0,29.75,10.0,WSW,5.8,,Clear,False,False,False,False,False,False,False,False,False,False,False,False,False,Night,Night,Night,Night
C-954058,2,2021-11-02 07:36:00,2021-11-02 09:37:24,28.2609,-81.612871,28.261306,-81.615229,0.146217894766,Stationary traffic from CR-545/S Lake Wilson Rd (Osceola Polk Line Rd/CR-532) to I-4 (Osceola Polk Line Rd/CR-532) due to roadwork.,,Osceola Polk Line Rd,R,Davenport,Osceola,FL,33896,US,US/Eastern,KISM,2021-11-02 07:56:00,65.0,65.0,90.0,30.05,10.0,N,3.0,0.0,Fair,False,False,False,False,False,False,False,False,False,False,False,False,False,Night,Day,Day,Day
C-954059,2,2021-06-16 20:14:00,2021-12-29 17:16:00,37.391633,-77.65029200000002,37.391701,-77.649817,0.0264949960371,On Rt. 4928 (Nashua Ct) in the County of Chesterfield from Nashua Dr; Cul-de-Sac to Nashua Dr; Rt. 4927N/S (Chesterfield County) motorists can expect potential delays in this area from 07/19/21 at 8:46 AM until 07/19/21 at 6:00 PM due to paving operations. The east through lanes are alternating closures. The west through lanes are alternating closures.,13798.0,Nashua Ct,R,Midlothian,Chesterfield,VA,23112-7617,US,US/Eastern,KFCI,2021-07-19 08:56:00,72.0,72.0,100.0,29.85,10.0,WSW,3.0,0.0,Fair,False,False,False,False,False,False,False,False,False,False,False,False,False,Day,Day,Day,Day
C-954060,2,2019-06-25 07:00:00,2019-06-25 19:00:00,37.948058,-107.916884,37.948072,-107.916076,0.0440344196037,At CO-145-spur - Construction work.,,Ilium Rd,R,Telluride,San Miguel,CO,81435,US,US/Mountain,KTEX,2019-06-25 06:55:00,46.0,43.0,43.0,21.61,10.0,SE,7.0,0.0,Partly Cloudy,False,False,False,False,False,False,False,False,False,False,False,False,False,Day,Day,Day,Day
C-954061,2,2020-08-21 14:00:00,2020-08-21 23:45:00,29.741116,-95.457705,29.741076,-95.458635,0.0558611116652,Construction on FM-1093 WB near 610 Construction. Right lane closed.,,West Loop S,R,Houston,Harris,TX,77027,US,US/Central,KMCJ,2020-08-21 13:53:00,93.0,93.0,41.0,29.79,10.0,SSE,7.0,0.0,Partly Cloudy,False,False,False,True,False,False,False,False,False,False,False,True,False,Day,Day,Day,Day
C-954062,2,2020-09-13 15:16:00,2020-09-13 20:02:30,42.521799,-122.813383,42.524139,-122.814063,0.16534512552,Stationary traffic on OR-62 from Linn Rd (OR-62) to Butte Falls Hwy (OR-62) due to roadwork.,14741.0,Highway 62,L,Eagle Point,Jackson,OR,97524-7854,US,US/Pacific,KMFR,2020-09-13 14:53:00,69.0,69.0,38.0,28.49,0.5,SSE,3.0,0.0,Smoke,False,False,False,False,False,False,False,False,False,False,False,False,False,Day,Day,Day,Day
C-954063,2,2020-10-05 13:00:00,2020-10-10 02:45:00,38.942588,-77.311376,38.942593,-77.311539,0.00876630157314,Construction on HUNTER MILL RD NB near CLOVERMEADOW DR Construction. Shoulder closed.,1769.0,Hunter Mill Rd,R,Vienna,Fairfax County,VA,22182-1827,US,US/Eastern,KIAD,2020-10-05 12:52:00,66.0,66.0,48.0,29.86,10.0,NNW,15.0,0.0,Fair,False,False,False,False,False,False,False,False,False,False,False,False,False,Day,Day,Day,Day
C-954064,2,2020-04-27 21:20:02,2020-04-28 05:00:00,38.00774000000001,-122.21054,38.01587,-122.18898,1.30117324581,At Cummings Skwy - Roadwork. Lane closed.,3200.0,John Muir Pkwy,L,Rodeo,Contra Costa,CA,94572,US,US/Pacific,KCCR,2020-04-27 20:53:00,71.0,71.0,53.0,30.01,10.0,SW,8.0,0.0,Fair,False,False,False,False,False,False,False,False,False,False,False,False,False,Night,Night,Night,Day
C-954065,2,2021-03-14 23:09:30,2021-03-14 23:39:30,40.20452,-104.939778,40.204429,-104.954387,0.7709395960959999,Stationary traffic on CO-66 - County Hwy-30 from CR-17 (CR-30/CO-66) to I-25/US-87 (CR-30/CO-66) due to roadwork.,6131.0,State Highway 66,R,Platteville,Weld,CO,80651-9010,US,US/Mountain,KLMO,2021-03-14 23:15:00,30.0,30.0,83.0,24.84,,NW,3.0,0.0,Cloudy,False,False,False,False,False,False,False,False,False,False,False,False,False,Night,Night,Night,Night
C-954066,2,2018-04-12 21:00:00,2018-04-13 06:00:00,40.552364,-74.31774899999998,,,0.0,Right lane closed due to construction work on US-1 Southbound at Garden State Pkwy.,,US Highway 1,R,Fords,Middlesex,NJ,08863,US,US/Eastern,KLDJ,2018-04-12 20:55:00,60.3,,50.0,29.83,10.0,SSW,8.1,,Clear,False,False,False,False,False,False,False,False,False,False,False,False,False,Night,Night,Night,Day
C-954067,2,2020-10-01 03:39:45,2020-10-01 06:01:00,34.039379,-118.051758,,,0.7400000095370001,Entry ramp to CA-60 Eastbound from N Santa Anita Ave Northbound closed due to paving repairs.,,CA-60 E,R,South El Monte,Los Angeles,CA,91733,US,US/Pacific,KEMT,2020-10-01 03:53:00,69.0,69.0,53.0,29.78,10.0,CALM,0.0,0.0,Fair,False,False,False,False,False,False,False,False,False,False,False,False,False,Night,Night,Night,Night
C-954068,2,2016-04-20 08:56:04,2016-04-20 15:00:00,39.635008,-74.774203,39.63212,-74.77154,0.244737641983,At US-30/S White Horse Pike - Construction work.,463.0,S White Horse Pike,L,Hammonton,Atlantic,NJ,08037-1135,US,US/Eastern,KACY,2016-04-20 08:54:00,55.9,,34.0,30.26,10.0,North,11.5,,Clear,False,False,False,False,False,False,False,False,False,False,False,False,False,Day,Day,Day,Day
C-954069,2,2017-07-19 16:54:19,2017-07-20 02:01:27,40.585994,-75.576553,40.57961,-75.62631999999998,2.64847015637,Between PA-309/Exit 53 and PA-100/Exit 49 - Roadwork. Lane blocked.,,I-78 W,R,Allentown,Lehigh,PA,18104,US,US/Eastern,KXLL,2017-07-19 16:55:00,89.6,,49.0,30.0,10.0,SW,8.1,,Scattered Clouds,False,False,False,False,False,False,False,False,False,False,False,False,False,Day,Day,Day,Day
C-954071,2,2019-04-10 04:50:18,2019-04-10 05:20:04,38.463989,-75.178436,,,0.0,Intermittent lane closures due to construction work on Hudson Rd both ways at DE-54 Lighthouse Rd.,,Hudson Rd,R,Selbyville,Sussex,DE,19975,US,US/Eastern,KOXB,2019-04-10 04:53:00,47.0,44.0,97.0,29.79,9.0,ESE,7.0,0.0,Mostly Cloudy,False,False,False,False,False,False,False,False,False,False,False,False,False,Night,Night,Night,Night
C-954072,2,2020-09-22 10:28:30,2020-09-23 01:49:16,40.99087,-73.663449,40.988988,-73.670591,0.3945250379609999,Queuing traffic on I-95 S - I-287 W from Delavan Ave exit [2] to Midland Ave due to roadwork.,,New England Trwy S,R,Port Chester,Westchester,NY,10573,US,US/Eastern,KHPN,2020-09-22 10:56:00,61.0,61.0,38.0,29.64,10.0,N,17.0,0.0,Fair,False,False,False,False,False,False,False,False,False,False,False,False,False,Day,Day,Day,Day
C-954073,2,2021-08-04 18:00:55,2021-08-04 18:32:36,25.944209,-80.180293,25.943141,-80.186273,0.3787974191229999,Stationary traffic on FL-860 from NE 12th Ave to I-95 N due to roadwork.,1045.0,NE Miami Gardens Dr,R,Miami,Miami-Dade,FL,33179-4615,US,US/Eastern,KHWO,2021-08-04 17:53:00,82.0,82.0,65.0,30.03,10.0,N,5.0,0.0,Fair,False,False,True,False,False,False,False,False,False,False,False,False,False,Day,Day,Day,Day
C-954074,2,2021-02-23 04:52:57,2021-11-23 17:01:18,30.214535,-95.373552,30.2105,-95.397846,1.47709736363,Roadwork on Conroe Porter Rd (College Park Dr/TX-242) from Needham Rd/Dogwood (River Dr/TX-242) to TX-242.,13099.0,Highway 242,R,Conroe,Montgomery,TX,77302,US,US/Central,KCXO,2021-02-23 04:53:00,35.0,35.0,89.0,29.88,10.0,CALM,0.0,0.0,Fair,False,False,False,False,False,False,False,False,False,False,False,False,False,Night,Night,Night,Night
C-954075,2,2020-05-07 08:01:27,2020-05-07 20:00:00,41.88083,-87.6243,41.88083,-87.6243,0.0,At S Michigan Ave - Roadwork. Roadway reduced to 1 lane.,,E Monroe St,R,Chicago,Cook,IL,60603,US,US/Central,KMDW,2020-05-07 07:53:00,53.0,53.0,59.0,29.32,10.0,WNW,10.0,0.0,Fair,True,False,True,False,False,False,False,False,False,False,False,True,False,Day,Day,Day,Day
C-954076,2,2021-06-28 19:53:00,2021-06-28 20:26:00,38.014319,-102.613345,38.021492,-102.613304,0.495612123281,Stationary traffic on US-385 N - US-385 S - US-287 S - US-287 N from CO-116 (US-385/US-287) to CR-8.2 (US-385/US-287) due to roadwork.,25206.0,US Highway 287,R,Lamar,Prowers,CO,81052-9707,US,US/Mountain,KLAA,2021-06-28 19:53:00,75.0,75.0,38.0,26.3,10.0,E,5.0,0.0,Fair,False,False,False,False,False,False,False,False,False,False,False,False,False,Day,Day,Day,Day
C-954077,2,2020-09-29 03:01:00,2020-09-29 13:46:00,34.118209,-118.592188,34.118813,-118.591957,0.0437743087076,Construction on CA-27 NB near TIGER TRL Expect long delays.,1762.0,N Topanga Canyon Blvd,R,Topanga,Los Angeles,CA,90290-4391,US,US/Pacific,KSMO,,,,,,,,,,,False,False,False,False,False,False,False,False,False,False,False,False,False,Night,Night,Night,Night
C-954078,3,2019-09-30 05:56:35,2019-09-30 06:00:00,37.495888,-77.561058,,,0.0,Intermittent lane closures due to construction work on VA-76 Powhite Pkwy both ways near US-60 Midlothian Tpke.,,Powhite Pkwy S,R,Richmond,Chesterfield,VA,23235,US,US/Eastern,KFCI,2019-09-30 05:56:00,69.0,69.0,93.0,29.97,10.0,E,5.0,0.0,Cloudy,False,False,False,False,False,False,False,False,False,False,False,False,False,Night,Night,Night,Day
C-954079,2,2017-04-10 08:12:28,2017-04-10 14:13:55,41.83687000000001,-79.15895,41.82356,-79.11938,2.23514391431,Between US-62/US-6-BR/Ludlow St and US-6-BR/Pennsylvania Ave E - Roadwork. Lane blocked.,,US-6 E,R,Warren,Warren,PA,16365,US,US/Eastern,KJHW,2017-04-10 08:15:00,59.0,,31.0,30.01,10.0,SSW,12.7,,Clear,False,False,False,True,True,False,False,False,False,False,False,True,False,Day,Day,Day,Day
C-954080,2,2021-06-16 15:59:30,2021-06-16 18:21:03,39.740099,-104.848457,39.740887,-104.84694,0.0972636155428,Stationary traffic on US-40 E - I-70 Bus E - US-287 S from Oswego St to E 16th Ave due to roadwork.,11976.0,E Colfax Ave,R,Aurora,Arapahoe,CO,80010-5110,US,US/Mountain,KBKF,2021-06-16 15:58:00,97.0,97.0,9.0,24.48,10.0,CALM,0.0,0.0,Mostly Cloudy,True,False,False,False,False,False,False,False,False,False,False,False,False,Day,Day,Day,Day
