ID,Severity,Start_Time,End_Time,Start_Lat,Start_Lng,End_Lat,End_Lng,Distance(mi),Description,Number,Street,Side,City,County,State,Zipcode,Country,Timezone,Airport_Code,Weather_Timestamp,Temperature(F),Wind_Chill(F),Humidity(%),Pressure(in),Visibility(mi),Wind_Direction,Wind_Speed(mph),Precipitation(in),Weather_Condition,Amenity,Bump,Crossing,Give_Way,Junction,No_Exit,Railway,Roundabout,Station,Stop,Traffic_Calming,Traffic_Signal,Turning_Loop,Sunrise_Sunset,Civil_Twilight,Nautical_Twilight,Astronomical_Twilight
C-1162103,2,2021-04-06 06:00:00,2021-04-06 16:45:00,32.63879,-85.481576,32.648384,-85.482711,0.6661631677709999,Construction on AL-147 NB near MM 6 Drive with caution.,1522.0,N College St,R,Auburn,Lee,AL,36830-2914,US,US/Central,KAUO,2021-04-06 05:56:00,54.0,54.0,75.0,29.3,10.0,WNW,3.0,0.0,Fair,False,False,False,False,False,False,False,False,False,False,False,False,False,Night,Day,Day,Day
C-1162104,2,2019-11-26 04:40:52,2019-11-26 06:00:00,41.545807,-73.044762,,,1.12999999523,Left lane blocked due to construction on CT-8 Southbound from Exits 31 32 33 34 I-84 Exits 19 20 to Exit 30 Charles St.,,Bank St,R,Waterbury,New Haven,CT,06708,US,US/Eastern,KOXC,2019-11-26 04:51:00,34.0,34.0,96.0,29.18,4.0,CALM,0.0,0.0,Fair,False,False,False,False,False,False,False,False,False,False,False,False,False,Night,Night,Night,Night
C-1162105,4,2021-11-16 08:30:00,2021-11-17 10:30:28,30.141265,-92.074316,30.142277000000004,-92.077645,0.210842995079,Emergency Maintenance on LA-733 Both Directions near Robley Dr . All Lanes Closed. Starting 11/16/2021 8:30 AM and Ending 11/17/2021 10:30 AM,101.0,Waverly Blvd,L,Lafayette,Lafayette,LA,70508,US,US/Central,KLFT,2021-11-16 08:53:00,67.0,67.0,79.0,30.14,10.0,VAR,3.0,0.0,Fair,False,False,False,False,False,False,False,False,False,False,False,False,False,Day,Day,Day,Day
C-1162106,2,2020-09-14 17:14:33,2020-11-28 08:44:59,40.70943,-73.910446,40.708978,-73.90968199999998,0.0507590224339,Construction on FAIRVIEW AVE near HARMAN ST Allow extra time.,2000.0,Himrod St,R,Ridgewood,Queens,NY,11385-1233,US,US/Eastern,KLGA,2020-09-14 16:51:00,77.0,77.0,39.0,30.07,10.0,NNW,12.0,0.0,Mostly Cloudy,False,False,False,False,False,False,False,False,False,True,False,False,False,Day,Day,Day,Day
C-1162107,4,2018-09-10 19:37:41,2018-09-10 21:37:20,40.96959,-83.48433,40.96804,-83.48255,0.141749079907,At OH-330/CR-197 - Roadwork.,,State Highway 15,R,Vanlue,Hancock,OH,45890,US,US/Eastern,KFDY,2018-09-10 19:53:00,63.0,,93.0,29.97,10.0,Calm,,,Overcast,False,False,False,False,False,False,False,False,False,False,False,False,False,Day,Day,Day,Day
C-1162108,2,2018-10-04 10:39:45,2018-10-04 16:00:00,33.751179,-84.726212,,,0.0,Right lane closed due to construction work on GA-92 Fairburn Rd both ways at Duralee Ln.,8389.0,Duralee Ln,R,Douglasville,Douglas,GA,30134-2548,US,US/Eastern,KFTY,2018-10-04 10:53:00,82.0,,65.0,30.15,10.0,Calm,,,Clear,False,False,False,False,False,False,False,False,False,False,False,False,False,Day,Day,Day,Day
C-1162109,2,2021-11-18 12:19:00,2021-11-18 12:40:00,40.793192,-77.867884,40.790905,-77.863886,0.262118809469,Slow traffic on US-322 Bus W - US-322 Bus E from W Park Ave (US-322 Bus/N Atherton St) to PA-26/W College Ave/W Beaver Ave (US-322 Bus/Atherton St) due to roadwork.,276.0,N Atherton St,L,State College,Centre,PA,16803,US,US/Eastern,KUNV,2021-11-18 11:53:00,63.0,63.0,59.0,28.57,10.0,W,12.0,0.0,Light Rain,True,False,True,False,False,False,False,False,False,False,False,True,False,Day,Day,Day,Day
C-1162111,2,2018-05-03 11:08:41,2019-09-23 12:26:15,40.643146,-75.432161,40.627233,-75.481401,2.80616575908,Between PA-378 and PA-145/MacArthur Rd - Roadwork. Lane blocked. Traffic problem.,,US-22 E,R,Allentown,Lehigh,PA,18109,US,US/Eastern,KABE,2018-05-03 10:51:00,82.9,,39.0,30.01,10.0,SW,16.1,,Clear,False,False,False,False,False,False,False,False,False,False,False,False,False,Day,Day,Day,Day
C-1162112,2,2019-06-10 19:00:00,2019-06-11 07:01:00,39.780022,-104.94445,,,0.330000013113,Road closed due to construction during the night on 46th Ave both ways from Madison St to Garfield St.,,E 46th Ave,R,Denver,Denver,CO,80216,US,US/Mountain,KBJC,2019-06-10 19:45:00,72.0,72.0,27.0,24.52,40.0,N,9.0,0.0,Partly Cloudy,False,False,False,False,False,False,False,False,False,False,False,False,False,Day,Day,Day,Day
C-1162113,2,2020-10-08 03:00:00,2020-10-09 13:00:00,35.849064,-80.121949,35.854094,-80.10253900000002,1.1412198439,North East of Lexington / Mile Marker 96 to 103 Both Directions. Weather permitting nightly lane closures in the Northbound and Southbound directions of I-85 are to be expected as contract forces continue pavement rehabilitation and bridge preservation work on I-85 NB and I-85 SB from just north of US-64 (exit 96) near Lexington to NC-109 (exit 103) in Thomasville. The contractor will be narrowing NB I-85 and SB I-85 nightly to complete this work.&amp;nbsp; Motorist are advised to slow down and use caution in the area and allow additional travel time to reach their destinations safely.,,I-85 N,R,Thomasville,Davidson,NC,27360,US,US/Eastern,KEXX,2020-10-08 02:55:00,56.0,56.0,100.0,29.24,10.0,CALM,0.0,0.0,Fair,False,False,False,False,False,False,False,False,False,False,False,False,False,Night,Night,Night,Night
C-1162114,2,2021-12-09 11:39:00,2021-12-09 11:59:34,40.814579,-73.913878,40.81661,-73.919516,0.32651080425,Slow traffic from St Anns Ave (E 149th St) to Grand Concourse (E 149th St) due to roadwork.,526.0,E 149th St,R,Bronx,Bronx,NY,10455-2812,US,US/Eastern,KLGA,2021-12-09 11:51:00,38.0,30.0,44.0,30.19,10.0,NW,14.0,0.0,Cloudy,True,False,False,False,False,False,False,False,True,False,False,True,False,Day,Day,Day,Day
C-1162115,2,2021-07-17 02:02:00,2021-07-17 02:54:00,35.032998,-81.85034499999998,35.028455,-81.868831,1.09196537014,Slow traffic on I-85 S from SC-110/Exit 83 (I-85) to Gossett Rd/Exit 80 (I-85) due to roadwork.,,I-85 S,R,Spartanburg,Spartanburg,SC,29307,US,US/Eastern,KSPA,2021-07-17 01:55:00,73.0,73.0,94.0,29.27,10.0,CALM,0.0,0.0,Partly Cloudy,False,False,False,False,True,False,False,False,False,False,False,False,False,Night,Night,Night,Night
C-1162116,2,2020-11-03 05:00:00,2020-11-07 11:03:04,40.933631,-73.86873299999998,40.931981,-73.877193,0.4560784669870001,Construction bridge work on Cross County Parkway both directions between Exit 3 - Midland Avenue; Ramp (Yonkers) and Exit 5; Kimball Avenue; Midland Avenue (Yonkers) various lane closures until 5:00 A.M. 20200887229,,Cross County Pkwy W,R,Yonkers,Westchester,NY,10704,US,US/Eastern,KLGA,2020-11-03 04:51:00,44.0,35.0,37.0,29.8,10.0,WSW,22.0,0.0,Fair / Windy,False,False,False,False,True,False,False,False,False,False,False,False,False,Night,Night,Night,Day
C-1162117,2,2021-08-24 13:31:00,2021-08-25 14:21:21,39.970874,-75.19305200000002,39.97636,-75.195565,0.4017231452149999,Construction on I-76 WB near US-13 Allow extra time.,,US-30 W,R,Philadelphia,Philadelphia,PA,19104,US,US/Eastern,KPHL,2021-08-24 13:54:00,90.0,90.0,48.0,29.96,10.0,SSW,12.0,0.0,Fair,False,False,False,False,True,False,False,False,False,False,False,False,False,Day,Day,Day,Day
C-1162118,2,2020-03-13 00:00:01,2020-03-14 00:00:01,40.4064,-104.86669,40.4064,-104.86669,0.0,At CO-257/CR-19/CR-21 - Construction work.,,Highway 34 Byp,R,Greeley,Weld,CO,80634,US,US/Mountain,KGXY,2020-03-13 00:56:00,34.0,28.0,70.0,25.37,10.0,E,7.0,0.0,Cloudy,False,False,False,False,False,False,False,False,False,False,False,False,False,Night,Night,Night,Night
C-1162119,2,2021-03-22 07:32:47,2021-03-23 00:45:00,40.049082,-80.734866,40.050442,-80.726626,0.445829081299,Construction on I-470 EB near MM 0 Drive with caution.,,I-470 E,R,Bellaire,Belmont,OH,43906,US,US/Eastern,KHLG,2021-03-22 07:53:00,44.0,44.0,34.0,29.04,10.0,SE,3.0,0.0,Fair,False,False,False,False,True,False,False,False,False,False,False,False,False,Day,Day,Day,Day
C-1162120,2,2021-06-03 20:48:00,2021-06-04 21:33:00,41.819039,-72.66077299999998,41.818839,-72.66629300000002,0.284572989036,Construction on I-291 WB near EXIT 2B Construction. Right lane closed.,,I-291 W,R,Windsor,Hartford,CT,06095,US,US/Eastern,KBDL,2021-06-03 20:51:00,68.0,68.0,87.0,29.76,9.0,S,9.0,0.0,Cloudy,False,False,False,False,False,False,False,False,False,False,False,False,False,Night,Day,Day,Day
C-1162121,4,2018-11-19 04:07:02,2018-11-19 09:06:30,35.50122,-80.56265,35.46516,-80.58736,2.85313020566,Closed between NC-152/Exit 68 and Earnhardt Rd/Exit 60 - Closed due to roadwork.,,US-601 S,R,Kannapolis,Cabarrus,NC,28083,US,US/Eastern,KJQF,2018-11-19 06:50:00,39.2,,100.0,30.18,5.0,Calm,,,Clear,False,False,False,False,True,False,False,False,False,False,False,False,False,Night,Night,Night,Night
C-1162122,2,2021-12-21 11:59:00,2021-12-21 12:19:00,26.944181,-80.084499,26.948075,-80.084958,0.270530996132,Stationary traffic on US-1 N - FL-A1A - FL-5 from FL-706/E Indiantown Rd (FL-A1A/US-1) to County Line Rd (US-1) due to roadwork.,,N Highway A1A,R,Jupiter,Palm Beach,FL,33477,US,US/Eastern,KPBI,2021-12-21 11:53:00,77.0,77.0,71.0,29.73,10.0,SSW,20.0,0.0,Mostly Cloudy,False,False,True,False,False,False,False,False,False,False,False,True,False,Day,Day,Day,Day
C-1162123,2,2021-06-15 21:01:00,2021-06-16 00:08:30,40.6037,-74.06859399999998,40.602358,-74.05757,0.585686370973,Slow traffic on Staten Island Expy E - I-278 E from Hylan Blvd/Exit 14 (I-278) to Verrazano-Narrows Bridge (Lower/Upper Level Split) (I-278) due to roadwork.,,I-278 E,R,Staten Island,Richmond,NY,10305,US,US/Eastern,KEWR,2021-06-15 20:51:00,73.0,73.0,55.0,29.74,10.0,WNW,12.0,0.0,Fair,False,False,False,False,False,False,False,False,False,False,False,False,False,Night,Day,Day,Day
C-1162124,2,2021-04-20 05:51:00,2021-04-20 18:41:15,33.682708,-112.031079,33.687649,-112.03232,0.348766528635,Stationary traffic from E Lone Cactus Dr to N 22nd St due to roadwork.,21569.0,N Cave Creek Rd,L,Phoenix,Maricopa,AZ,85050,US,US/Mountain,KDVT,2021-04-20 05:53:00,58.0,58.0,25.0,28.26,10.0,E,7.0,0.0,Fair,False,False,False,False,False,False,False,False,False,False,False,False,False,Day,Day,Day,Day
C-1162125,2,2021-06-17 22:08:50,2021-06-18 05:45:00,33.206166,-80.40626400000002,33.231316,-80.443264,2.75565049816,Construction on I-26 WB near EXIT 177 Construction. Left lane closed.,,I-26 W,R,Harleyville,Dorchester,SC,29448,US,US/Eastern,KDYB,2021-06-17 22:15:00,73.0,73.0,83.0,30.0,10.0,CALM,0.0,0.0,Fair,False,False,False,False,False,False,False,False,False,False,False,False,False,Night,Night,Night,Day
C-1162127,2,2021-05-21 21:01:00,2021-05-22 07:46:00,38.246576,-122.416992,38.245173,-122.444171,1.4780049217500002,One-Way Traffic closure due to Guardrail Repair between Burndale Rd and Fremont Rd,2697.0,Fremont Dr,R,Sonoma,Sonoma,CA,95476-9555,US,US/Pacific,KO69,2021-05-21 20:55:00,57.0,57.0,63.0,29.88,10.0,WSW,6.0,0.0,Partly Cloudy,False,False,False,False,False,False,False,False,False,False,False,False,False,Night,Night,Day,Day
C-1162128,2,2020-10-30 17:15:30,2020-10-31 00:32:27,32.512434000000006,-96.384484,32.52637,-96.373245,1.1644289652200002,Roadwork on FM-2451 (TX-34) from US-175 (S Washington St/TX-34) to TX-34.,8859.0,S State Highway 34,R,Scurry,Kaufman,TX,75158-2137,US,US/Central,KTRL,2020-10-30 16:53:00,66.0,66.0,33.0,29.7,10.0,E,7.0,0.0,Fair,False,False,False,False,False,False,False,False,False,False,False,False,False,Day,Day,Day,Day
C-1162129,2,2019-02-25 07:57:06,2019-03-02 23:59:00,34.157612,-118.431236,,,1.61000001431,Restrictions due to construction work on Riverside Dr both ways between Hazeltine Ave and Woodman Ave.,,Riverside Dr,R,Sherman Oaks,Los Angeles,CA,91423,US,US/Pacific,KBUR,2019-02-25 07:53:00,48.9,,61.0,30.07,10.0,Calm,,,Clear,False,False,False,False,False,False,False,False,False,False,False,True,False,Day,Day,Day,Day
C-1162130,2,2021-04-13 15:25:00,2021-04-13 15:51:30,39.229978,-76.973508,39.24424000000001,-76.97720600000002,1.00508594474,Slow traffic on MD-32 W - MD-32 from MD-108 (MD-32) to Ten Oaks Rd (MD-32) due to roadwork.,,State Route 32,R,Clarksville,Howard,MD,21029,US,US/Eastern,KGAI,2021-04-13 14:56:00,63.0,63.0,58.0,29.5,10.0,VAR,7.0,0.0,Fair,False,False,False,False,False,False,False,False,False,False,False,False,False,Day,Day,Day,Day
C-1162131,4,2019-01-10 23:04:46,2019-01-11 04:04:14,47.23686,-122.43196,47.23254,-122.43873,0.435853248783,Ramp closed to I-5/WA-7 - Closed due to roadwork.,,I-705 S,R,Tacoma,Pierce,WA,98421,US,US/Pacific,KTIW,2019-01-10 22:53:00,46.9,,86.0,30.06,10.0,NE,3.5,,Clear,False,False,False,False,False,False,False,False,False,False,False,False,False,Night,Night,Night,Night
C-1162132,4,2019-04-18 15:04:33,2019-04-18 20:02:30,34.258965,-83.961072,34.257344,-83.963489,0.177750682648,Closed at Sherri Beth Ln - Closed due to roadwork.,9113.0,Browns Bridge Rd,L,Gainesville,Forsyth,GA,30506-4016,US,US/Eastern,KGVL,2019-04-18 14:53:00,77.0,77.0,50.0,28.59,10.0,S,10.0,0.0,Mostly Cloudy,False,False,False,False,False,False,False,False,False,False,False,False,False,Day,Day,Day,Day
C-1162133,4,2020-11-16 19:50:30,2021-05-01 06:59:00,41.351847,-106.223852,41.323311,-106.451827,11.9899877951,WY-130 is closed from Barber Lake Rd to USFS Road 256 due to roadwork.,3293.0,State Highway 130,R,Centennial,Albany,WY,82055,US,US/Mountain,KLAR,2020-11-16 19:53:00,37.0,30.0,54.0,23.18,10.0,SSW,10.0,0.0,Fair,False,False,False,False,False,False,False,False,False,False,False,False,False,Night,Night,Night,Night
C-1162134,4,2021-11-02 02:14:12,2021-11-04 23:59:00,37.631964,-122.40213,37.633581,-122.40247,0.113262426226,Closed road from San Bruno Ave E to South San Francisco due to roadwork.,,San Bruno Ave E,R,San Francisco,San Mateo,CA,94128,US,US/Pacific,KSFO,2021-11-02 01:56:00,61.0,61.0,90.0,30.15,10.0,S,3.0,0.0,Cloudy,False,False,False,False,False,False,False,False,False,False,False,False,False,Night,Night,Night,Night
C-1162135,2,2020-02-24 09:01:00,2020-02-24 14:30:00,37.4004,-122.11217,37.39845,-122.10822,0.255265397074,At Jordan Ave Lt - Construction work. Lane closed.,1099.0,Sherwood Ave,R,Los Altos,Santa Clara,CA,94022,US,US/Pacific,KNUQ,,,,,,,,,,,False,False,True,False,False,False,False,False,False,True,False,True,False,Day,Day,Day,Day
C-1162136,2,2020-11-16 17:33:00,2020-11-16 19:57:49,43.498117,-110.876229,43.517649,-111.001567,6.42428916232,Roadwork on N Fall Creek Rd/West St (WY-22) from WY--ID State Border (WY-22) to WY-22.,1201.0,West St,L,Wilson,Teton,WY,83014,US,US/Mountain,KJAC,2020-11-16 17:56:00,38.0,32.0,83.0,23.88,10.0,SW,8.0,0.0,Fair,False,False,False,False,False,False,False,False,False,True,False,False,False,Night,Night,Day,Day
C-1162137,2,2020-11-12 10:48:00,2020-11-12 21:59:26,40.574665,-75.619612,40.579657,-75.621533,0.35934500698,Slow traffic on PA-100 from S Route 100 / Schantz Rd to I-78 E due to roadwork.,124.0,N Route 100,L,Breinigsville,Lehigh,PA,18031-1506,US,US/Eastern,KXLL,2020-11-12 10:55:00,50.0,50.0,82.0,29.61,10.0,NNW,10.0,0.01,Cloudy,False,False,False,False,False,False,False,False,False,False,False,False,False,Day,Day,Day,Day
C-1162138,2,2021-06-26 22:36:00,2021-06-26 22:58:30,40.717338,-73.831204,40.716198,-73.82383399999998,0.393914182606,Slow traffic on Grand Central Pkwy E from 69th Rd/Jewel Ave/Exit 11 (Grand Central Pkwy) to Jackie Robinson Pkwy/Union Tpke/Exit 13/Exit 14 (Grand Central Pkwy) due to roadwork.,,Grand Central Pkwy E,R,Forest Hills,Queens,NY,11375,US,US/Eastern,KLGA,2021-06-26 22:51:00,77.0,77.0,74.0,30.15,10.0,SSW,9.0,0.0,Mostly Cloudy,False,False,False,False,True,False,False,False,False,False,False,False,False,Night,Night,Night,Night
C-1162139,2,2020-11-19 00:44:30,2020-11-19 04:47:23,43.598933,-116.551359,43.605178,-116.589908,1.97642866104,Roadwork on I-84 Bus/Garrity Blvd/Exit 38 (I-84) from ID-55/Exit 33 (I-84) to I-84 W - Vietnam Veterans Memorial Hwy - US-30 W - ID-55 S.,,I-84 W,R,Nampa,Canyon,ID,83687,US,US/Mountain,KMAN,2020-11-19 00:35:00,45.0,45.0,100.0,27.39,10.0,CALM,0.0,0.0,Mostly Cloudy,False,False,False,False,False,False,False,False,False,False,False,False,False,Night,Night,Night,Night
C-1162140,2,2021-11-04 13:44:30,2021-11-04 14:04:30,39.969971,-75.291185,39.967878000000006,-75.295825,0.285099203453,Slow traffic on US-1 N - US-1 S from Haverford Rd/Haverford Ave (City Ave/US-1) to Drexel Ave (Township Line Rd/US-1) due to roadwork.,204.0,E Township Line Rd,R,Havertown,Delaware,PA,19083-5430,US,US/Eastern,KPHL,2021-11-04 13:54:00,52.0,52.0,37.0,30.29,10.0,NNE,5.0,0.0,Cloudy,False,False,True,False,False,False,False,False,False,False,False,True,False,Day,Day,Day,Day
C-1162141,2,2021-02-16 15:10:18,2021-02-16 17:38:22,32.852801,-89.536082,32.93122,-89.548526,5.466125670449999,Slow traffic on MS-35 from MS-25 (MS-35) to Old MS-19 (MS-35) due to roadwork.,3493.0,Highway 35 N,L,Carthage,Leake,MS,39051-9301,US,US/Central,KJAN,2021-02-16 14:54:00,27.0,27.0,58.0,29.87,10.0,CALM,0.0,0.0,Partly Cloudy,False,False,False,False,False,False,False,False,False,False,False,False,False,Day,Day,Day,Day
C-1162142,2,2021-02-03 07:06:00,2021-02-03 07:40:00,32.738345,-97.474704,32.738355,-97.478184,0.202251333799,Stationary traffic on I-30 W from Las Vegas Trl/Exit 6 (I-30) to W Loop 820 S/Exit 5 (I-30) due to roadwork.,,I-30 W,R,Fort Worth,Tarrant,TX,76108,US,US/Central,KNFW,2021-02-03 06:52:00,45.0,42.0,68.0,29.33,10.0,SE,6.0,0.0,Fair,False,False,False,False,True,False,False,False,False,False,False,False,False,Night,Day,Day,Day
C-1162143,2,2021-09-17 15:54:31,2021-09-17 18:14:24,40.721415,-73.999027,40.722186,-74.000654,0.100481152373,Slow traffic from Lafayette St (Broome St) to W Broadway/Watts St (Broome St) due to roadwork.,430.0,Broome St,R,New York,New York,NY,10013-3269,US,US/Eastern,KJRB,2021-09-17 15:51:00,74.0,,79.0,30.09,8.0,,,0.0,Cloudy,True,False,True,False,False,False,False,False,False,False,False,True,False,Day,Day,Day,Day
C-1162144,4,2020-01-11 03:48:11,2020-01-11 08:47:31,33.46172,-112.11506,33.4572,-112.03749,4.482259827180001,Closed between 27th Ave/Exit 142 and AZ-51/AZ-202-LOOP/Exit 147 - Closed due to roadwork.,,I-10 E,R,Phoenix,Maricopa,AZ,85009,US,US/Mountain,KPHX,2020-01-11 03:51:00,44.0,39.0,63.0,28.98,10.0,ESE,10.0,0.0,Fair,False,False,False,False,True,False,False,False,False,False,False,False,False,Night,Night,Night,Night
C-1162145,2,2020-07-07 21:29:29,2020-07-09 19:20:21,42.353079,-87.963635,42.353073,-87.962899,0.037582846606,Construction on GAGES LAKE RD near HUNT CLUB RD Allow extra time.,17100.0,W Gages Lake Rd,L,Gurnee,Lake,IL,60031,US,US/Central,KUGN,2020-07-07 21:55:00,72.0,72.0,81.0,29.2,10.0,NNW,3.0,0.0,Light Rain,False,False,False,False,False,False,False,False,False,False,False,True,False,Night,Night,Day,Day
C-1162146,2,2021-12-03 15:00:14,2021-12-03 15:21:28,28.281816,-82.278666,28.268096000000003,-82.28625100000002,1.05434994143,Slow traffic on County Hwy-577 from CR-579A/Prospect Rd (Curley Rd/CR-577) to FL-54 (Curley Rd/CR-577) due to roadwork.,8635.0,Curley Rd,L,Wesley Chapel,Pasco,FL,33545-9132,US,US/Eastern,KZPH,2021-12-03 14:55:00,77.0,77.0,47.0,29.94,10.0,CALM,0.0,0.0,Fair,False,False,False,False,False,False,False,False,False,False,False,False,False,Day,Day,Day,Day
C-1162147,3,2017-05-01 20:00:00,2017-05-02 05:30:00,41.697876,-73.884567,,,0.43,Road closed due to construction work on US-44 Dutchess Tpke both ways between Burnett Blvd and Catskill Ave.,684.0,Dutchess Tpke,R,Poughkeepsie,Dutchess,NY,12603-6441,US,US/Eastern,KPOU,2017-05-01 19:53:00,68.0,,73.0,29.69,10.0,SE,6.9,,Mostly Cloudy,False,False,True,False,False,False,False,False,False,False,False,False,False,Night,Day,Day,Day
C-1162148,2,2021-10-08 16:56:30,2021-10-08 17:21:00,33.411473,-112.011033,33.407033,-112.012593,0.319697180463,Stationary traffic from I-10/US-60/Maricopa Fwy (S 32nd St) to E Broadway Rd (S 32nd St) due to roadwork.,4000.0,S 32nd St,R,Phoenix,Maricopa,AZ,85040,US,US/Mountain,KPHX,2021-10-08 16:51:00,91.0,91.0,24.0,28.68,10.0,W,8.0,0.0,Mostly Cloudy,False,False,True,False,False,False,False,False,False,False,False,True,False,Day,Day,Day,Day
C-1162149,2,2019-01-31 09:00:00,2019-01-31 15:30:00,37.325294,-77.225105,,,0.0,Intermittent lane closures due to construction on VA-106 Jordan Point Rd both ways at Jordan Pkwy.,12073.0,Roxbury Rd,L,Charles City,Charles City,VA,23030-2742,US,US/Eastern,KRIC,2019-01-31 08:54:00,17.1,11.7,52.0,30.51,10.0,Variable,3.5,,Clear,False,False,False,False,False,False,False,False,False,False,False,False,False,Day,Day,Day,Day
C-1162150,2,2018-12-14 23:01:34,2018-12-18 23:00:52,40.75698,-74.00480999999998,40.76198,-74.00108,0.396805631918,Between 34th St and 42nd St - Construction work.,298.0,12th Ave,L,New York,New York,NY,10001,US,US/Eastern,KNYC,2018-12-14 22:51:00,50.0,,93.0,30.27,4.0,North,,0.03,Light Rain,False,False,True,False,False,False,False,False,False,False,False,True,False,Night,Night,Night,Night
C-1162151,2,2019-08-06 20:00:58,2019-08-10 20:00:29,34.009640000000005,-118.48728,34.007940000000005,-118.48971,0.1821187369159999,At Main St - Construction work.,1889.0,4th St,L,Santa Monica,Los Angeles,CA,90405,US,US/Pacific,KSMO,2019-08-06 19:51:00,68.0,68.0,78.0,29.69,10.0,S,7.0,0.0,Fair,False,False,True,False,False,False,False,False,True,False,False,True,False,Night,Day,Day,Day
C-1162152,2,2020-03-19 20:00:00,2020-03-20 05:00:00,35.009468,-85.27166700000002,,,1.20000004768,Intermittent lane closures due to maintenance work on US-41 Ringgold Rd both ways between Seminole Dr and 29th St.,,TN-8,R,Chattanooga,Hamilton,TN,37404,US,US/Eastern,KCHA,2020-03-19 19:53:00,77.0,77.0,56.0,29.42,10.0,S,10.0,0.0,Mostly Cloudy,False,False,False,False,False,False,False,False,False,False,False,False,False,Night,Day,Day,Day
C-1162153,2,2021-11-03 06:48:30,2021-11-03 07:11:00,26.70279600000001,-81.755646,26.700899,-81.762305,0.4314195941179999,Slow traffic on FL-80 from Buckingham Rd/Old Olga Rd (FL-80) to I-75 (FL-80) due to roadwork.,12201.0,Palm Beach Blvd,L,Fort Myers,Lee,FL,33905,US,US/Eastern,KFMY,2021-11-03 06:53:00,70.0,70.0,81.0,30.05,10.0,NE,6.0,0.0,Partly Cloudy,False,False,False,False,False,False,False,False,False,False,False,False,False,Night,Night,Day,Day
C-1162154,2,2021-07-09 08:32:30,2021-07-09 09:24:00,30.697785,-96.48934,30.68249,-96.492095,1.06938630251,Slow traffic on TX-OSR from Sandy Point Rd to Homola Rd due to roadwork.,4669.0,W OSR,R,Bryan,Brazos,TX,77807-5122,US,US/Central,KCLL,2021-07-09 08:34:00,74.0,74.0,85.0,29.68,4.0,SE,20.0,0.07,Light Rain,False,False,True,False,False,False,True,False,False,False,False,True,False,Day,Day,Day,Day
C-1162155,2,2021-07-07 20:01:00,2021-07-08 05:46:00,33.590437,-117.499153,33.581148,-117.528602,1.81248876784,Construction on CA-74 WB near SAN JUAN CANYON Expect long delays.,39074.0,Ortega Hwy,R,San Juan Capistrano,Orange,CA,92675,US,US/Pacific,KSNA,2021-07-07 19:53:00,70.0,70.0,71.0,29.74,10.0,SSW,10.0,0.0,Fair,False,False,False,False,False,False,False,False,False,False,False,False,False,Day,Day,Day,Day
C-1162156,2,2020-08-10 14:00:00,2020-08-14 22:45:00,41.902337,-70.958949,41.902356,-70.95886999999998,0.00426942428521,Construction on MA-18 EB near US-44 Allow extra time.,,Bedford St,R,Middleboro,Plymouth,MA,02346,US,US/Eastern,KTAN,2020-08-10 13:52:00,94.0,94.0,43.0,29.91,10.0,WSW,10.0,0.0,Partly Cloudy,False,False,False,False,False,False,False,False,False,False,False,False,False,Day,Day,Day,Day
C-1162157,2,2021-11-29 10:43:30,2021-11-29 18:32:18,41.988519,-87.668142,41.990362,-87.671306,0.206439571206,Slow traffic on US-14 E - US-14 W from Hollywood Ave (US-14) to Peterson Ave/Ridge Ave (US-14) due to roadwork.,5871.0,N Ridge Ave,R,Chicago,Cook,IL,60660-3445,US,US/Central,KORD,2021-11-29 10:51:00,38.0,30.0,36.0,29.3,10.0,SSW,13.0,0.0,Cloudy,False,False,True,False,False,False,False,False,False,False,False,False,False,Day,Day,Day,Day
C-1162158,2,2020-10-23 11:48:00,2020-10-23 23:17:04,27.862673,-82.32651,27.865748,-82.326545,0.212473021043,Stationary traffic on US-301 from Gibsonton Dr/Boyette Rd (US-301) to Riverview Dr (US-301) due to roadwork.,9208.0,US Highway 301 S,R,Riverview,Hillsborough,FL,33569,US,US/Eastern,KTPF,2020-10-23 11:55:00,86.0,86.0,62.0,30.0,10.0,ESE,8.0,0.0,Cloudy,False,False,False,False,False,False,False,False,True,False,False,True,False,Day,Day,Day,Day
C-1162159,2,2021-08-15 00:00:00,2021-12-17 18:30:01,42.417561,-83.335415,42.412625,-83.334541,0.34394680397,Slow traffic from Ravine St to Savoie St due to roadwork.,17874.0,Middlebelt Rd,R,Livonia,Wayne,MI,48152-3610,US,US/Eastern,KVLL,2021-12-17 14:15:00,41.0,35.0,40.0,29.43,10.0,WNW,9.0,0.0,Fair,False,False,True,False,False,False,False,False,False,False,False,False,False,Night,Night,Night,Night
C-1162160,2,2021-12-06 15:44:30,2021-12-06 16:04:30,32.932477,-97.300459,32.932547,-97.307149,0.387989282607,Stationary traffic on FM-1709 from Alta Vista Rd (Golden Triangle Blvd) to I-35W/North Fwy (Golden Triangle Blvd) due to roadwork.,3849.0,Golden Triangle Blvd,R,Fort Worth,Tarrant,TX,76244-4841,US,US/Central,KAFW,2021-12-06 15:53:00,53.0,53.0,23.0,29.45,10.0,N,16.0,0.0,Fair,False,False,False,False,False,False,False,False,False,False,False,True,False,Day,Day,Day,Day
C-1162161,2,2016-08-30 09:00:50,2016-08-30 15:00:50,33.81277,-84.30781,33.81243,-84.30796,0.0250202590822,At Clairmont Cir - Construction work.,1975.0,Clairmont Rd,R,Decatur,Dekalb,GA,30033-3415,US,US/Eastern,KPDK,2016-08-30 08:53:00,77.0,,69.0,30.06,10.0,Variable,4.6,,Clear,False,False,False,False,False,False,False,False,False,False,False,True,False,Day,Day,Day,Day
C-1162162,2,2019-05-22 05:01:26,2019-05-27 05:00:37,38.474938,-90.235334,38.48817,-90.280081,2.58714948664,Between I-255/IL-3/Exit 6 and Koch Rd/Exit 3 - Construction work. Roadway reduced to 1 lane.,,I-255 S,R,Columbia,Monroe,IL,62236,US,US/Central,KCPS,2019-05-23 05:03:00,70.0,70.0,90.0,29.56,10.0,SSW,3.0,0.0,Mostly Cloudy,False,False,False,False,False,False,False,False,False,False,False,False,False,Night,Night,Day,Day
